activity type;database;name;production amount;code;unit;reference product;location;ISIC_num;ISIC_name;CPC_num;CPC_name;prod_category;prod_sub_category
;ei_cutoff_3.9_remind_SSP1-PkBudg500_2050 2025-09-04;market for chlorine dioxide;;ae4a4b286baf64e432ec0ac447f8bb19;kilogram;chlorine dioxide;RoW;20110;Manufacture of basic chemicals;34110;Hydrocarbons and their halogenated, sulphonated, nitrated or nitrosated derivatives;Chemical;Chemical products
;ei_cutoff_3.9_remind_SSP1-PkBudg500_2050 2025-09-04;market for seed-cotton, organic;;2d43cda80e788dec50a7901210a1686b;kilogram;seed-cotton, organic;GLO;1160;Growing of fibre crops;1921;Cotton, whether or not ginned;AgriForeAnim;Agricultural & forestry products
;ei_cutoff_3.9_remind_SSP1-PkBudg500_2050 2025-09-04;market for petroleum;;c7cf571e5175aa5d01e44a386009bcec;kilogram;petroleum;RoW;46610;Wholesale of solid, liquid and gaseous fuels and related products;12010;Petroleum oils and oils obtained from bituminous minerals, crude;OreMinFuel;Ores, minerals & fuels
;ei_cutoff_3.9_remind_SSP1-PkBudg500_2050 2025-09-04;market for sodium borates;;de03d27ded836711c700f636845168d5;kilogram;sodium borates;GLO;8910;Mining of chemical and fertilizer minerals;16190;Other chemical minerals;OreMinFuel;Ores, minerals & fuels
;ei_cutoff_3.9_remind_SSP1-PkBudg500_2050 2025-09-04;market for carbon disulfide;;8c3f424f308fea51a15db8431bbd4d3a;kilogram;carbon disulfide;GLO;20110;Manufacture of basic chemicals;34231;"Chemical elements n.e.c.; inorganic acids except phosphoric, nitric and sulphonitric; inorganic oxygen compoun[…]";Chemical;Chemical products
;ei_cutoff_3.9_remind_SSP1-PkBudg500_2050 2025-09-04;market for sawlog and veneer log, hardwood, measured as solid wood under bark;;993e8ec377dbbcf4d690e4c58bc1d71b;cubic meter;sawlog and veneer log, hardwood, measured as solid wood under bark;RoW;2200;Logging;3100;Wood in the rough;AgriForeAnim;Agricultural & forestry products
;ei_cutoff_3.9_remind_SSP1-PkBudg500_2050 2025-09-04;market for nitrogen, liquid;;2ba127601085d3c181813d9d3c33b22a;kilogram;nitrogen, liquid;RoW;20110;Manufacture of basic chemicals;34210;"Hydrogen, nitrogen, oxygen, carbon dioxide and rare gases; inorganic oxygen compounds of non-metals n.e.c.";Chemical;Chemical products
;ei_cutoff_3.9_remind_SSP1-PkBudg500_2050 2025-09-04;market for lubricating oil;;d83acfba43458f2b1ace32123e313f79;kilogram;lubricating oil;RoW;19200;Manufacture of refined petroleum products;33380;Lubricants;OreMinFuel;Ores, minerals & fuels
;ei_cutoff_3.9_remind_SSP1-PkBudg500_2050 2025-09-04;market for sodium hydroxide, without water, in 50% solution state;;2f298d6798217ca204f60bdc1efe8ea1;kilogram;sodium hydroxide, without water, in 50% solution state;GLO;20110;Manufacture of basic chemicals;34231;"Chemical elements n.e.c.; inorganic acids except phosphoric, nitric and sulphonitric; inorganic oxygen compoun[…]";Chemical;Chemical products
;ei_cutoff_3.9_remind_SSP1-PkBudg500_2050 2025-09-04;market for pitch despergents, in paper production;;aebc8c6782d3f8c3fc83d0a512ad38f0;kilogram;pitch despergents, in paper production;RoW;20110;Manufacture of basic chemicals;34000;Basic chemicals;Chemical;Chemical products
;ei_cutoff_3.9_remind_SSP1-PkBudg500_2050 2025-09-04;market for allyl chloride;;21d0989c13226374f700264a51796945;kilogram;allyl chloride;RoW;20110;Manufacture of basic chemicals;34100;Basic organic chemicals;Chemical;Chemical products
;ei_cutoff_3.9_remind_SSP1-PkBudg500_2050 2025-09-04;market for cobalt carbonate;;6b5fbd50873691cd0c8e02114baa15a7;kilogram;cobalt carbonate;GLO;7290;Mining of other non-ferrous metal ores;41601;Tungsten, molybdenum, tantalum, magnesium, cobalt, cadmium, titanium, zirconium, beryllium, gallium, hafnium, […];MetalAlloy;Basic metals & alloys, their semi-finished products
;ei_cutoff_3.9_remind_SSP1-PkBudg500_2050 2025-09-04;market for sodium dichromate;;ae99303d22e45cb01f75b74d40883bd1;kilogram;sodium dichromate;GLO;20110;Manufacture of basic chemicals;34250;"Salts of oxometallic or peroxometallic acids; colloidal precious metals and compounds thereof; inorganic and o[…]";Chemical;Chemical products
;ei_cutoff_3.9_remind_SSP1-PkBudg500_2050 2025-09-04;market for metallization paste, back side, aluminium;;96782bcc5da89a1352eedf220a38708d;kilogram;metallization paste, back side, aluminium;RoW;20290;Manufacture of other chemical products n.e.c.;35499;Other chemical products n.e.c.;Chemical;Chemical products
;ei_cutoff_3.9_remind_SSP1-PkBudg500_2050 2025-09-04;market for chickpea;;8d51cd9b4fcdd6da75aa3cdb199e2f31;kilogram;chickpea;GLO;1110;Growing of cereals (except rice), leguminous crops and oil seeds;1703;Chick peas, dry;AgriForeAnim;Agricultural & forestry products
;ei_cutoff_3.9_remind_SSP1-PkBudg500_2050 2025-09-04;market for dimethyl ether;;28e8902c28c9c699e5c871a3f829e68e;kilogram;dimethyl ether;RoW;20110;Manufacture of basic chemicals;34100;Basic organic chemicals;Chemical;Chemical products
;ei_cutoff_3.9_remind_SSP1-PkBudg500_2050 2025-09-04;market for bamboo pole;;864dbb3e6898839ec94cbf2b56660bf8;kilogram;bamboo pole;RoW;16200;Manufacture of products of wood, cork, straw and plaiting materials;31212;Wood, continuously shaped along any of its edges or faces (including strips and friezes for parquet flooring, […];ProcBio;Wood, straw & cork
;ei_cutoff_3.9_remind_SSP1-PkBudg500_2050 2025-09-04;market for battery cell, Li-ion, LTO;1.0;eaaa5e0985434f13833cd9830a494bcc;kilogram;battery cell, Li-ion, LTO;GLO;-1;missing;-1;missing;;
;ei_cutoff_3.9_remind_SSP1-PkBudg500_2050 2025-09-04;market for integrated circuit, memory type;;cb8530747b22cf413b4a58bb4b8cdaa9;kilogram;integrated circuit, memory type;GLO;26100;Manufacture of electronic components and boards;47160;Electronic integrated circuits;MachElecTrans;Metal/electronic equipments & parts
;ei_cutoff_3.9_remind_SSP1-PkBudg500_2050 2025-09-04;market for printed wiring board, for power supply unit, desktop computer, Pb free;;dbf27bde9584b9ffff2fbfd00d5936a1;kilogram;printed wiring board, for power supply unit, desktop computer, Pb free;GLO;26100;Manufacture of electronic components and boards;47160;Electronic integrated circuits;MachElecTrans;Metal/electronic equipments & parts
;ei_cutoff_3.9_remind_SSP1-PkBudg500_2050 2025-09-04;market for dimethyl sulfide;;fbed425482ee773fb5e2910f71d8141e;kilogram;dimethyl sulfide;GLO;20110;Manufacture of basic chemicals;34160;"Organo-sulphur compounds and other organo-inorganic compounds; heterocyclic compounds n.e.c.; nucleic acids an[…]";Chemical;Chemical products
;ei_cutoff_3.9_remind_SSP1-PkBudg500_2050 2025-09-04;market for petrol;;d89413861dbb415dba2cac4249be76ea;kilogram;petrol;World;19200;Manufacture of refined petroleum products;33300;"Petroleum oils and oils obtained from bituminous materials, other than crude; preparations n.e.c. containing by […]";OreMinFuel;Ores, minerals & fuels
;ei_cutoff_3.9_remind_SSP1-PkBudg500_2050 2025-09-04;market for glued solid timber;;45f75757913743e095a46550e2b5c82c;cubic meter;glued solid timber;RoW;16210;Manufacture of veneer sheets and wood-based panels;31411;Plywood consisting solely of sheets, of coniferous wood;ProcBio;Wood, straw & cork
;ei_cutoff_3.9_remind_SSP1-PkBudg500_2050 2025-09-04;market for phosphorus pentachloride;;36f82a3bf8b75b019a64306fc3d7781d;kilogram;phosphorus pentachloride;GLO;20110;Manufacture of basic chemicals;34231;"Chemical elements n.e.c.; inorganic acids except phosphoric, nitric and sulphonitric; inorganic oxygen compoun[…]";Chemical;Chemical products
;ei_cutoff_3.9_remind_SSP1-PkBudg500_2050 2025-09-04;market for lime, hydrated, loose weight;;16df20c480f88cb7a2f27a335a2c5f04;kilogram;lime, hydrated, loose weight;RoW;23940;Manufacture of cement, lime and plaster;37420;Quicklime, slaked lime and hydraulic lime;GlasNonMetal;Glass & other non-metallic products
;ei_cutoff_3.9_remind_SSP1-PkBudg500_2050 2025-09-04;market for compressed air, 1000 kPa gauge;;ad5289e37c6d90f742c5f33e78facdf9;cubic meter;compressed air, 1000 kPa gauge;RoW;20110;Manufacture of basic chemicals;34250;"Salts of oxometallic or peroxometallic acids; colloidal precious metals and compounds thereof; inorganic and o[…]";Chemical;Chemical products
;ei_cutoff_3.9_remind_SSP1-PkBudg500_2050 2025-09-04;market for gold;;36312a62a043eb8374d232cf30167c22;kilogram;gold;GLO;7290;Mining of other non-ferrous metal ores;41320;Gold (including gold plated with platinum), unwrought or in semi-manufactured forms, or in powder form;MetalAlloy;Basic metals & alloys, their semi-finished products
;ei_cutoff_3.9_remind_SSP1-PkBudg500_2050 2025-09-04;market for compressed air, 1200 kPa gauge;;080869ab88c992462a1ae7991fb6e977;cubic meter;compressed air, 1200 kPa gauge;RoW;20110;Manufacture of basic chemicals;34250;"Salts of oxometallic or peroxometallic acids; colloidal precious metals and compounds thereof; inorganic and o[…]";Chemical;Chemical products
;ei_cutoff_3.9_remind_SSP1-PkBudg500_2050 2025-09-04;market for supplementary cementitious materials;;d7c279bf726f3a5b8df611c3193c5761;kilogram;supplementary cementitious materials;RoW;23940;Manufacture of cement, lime and plaster;15000;Stone, sand and clay;OreMinFuel;Ores, minerals & fuels
;ei_cutoff_3.9_remind_SSP1-PkBudg500_2050 2025-09-04;market for bulk lead-zinc concentrate;;5a52a1c5d59aaeff01a5b3923eae40ad;kilogram;bulk lead-zinc concentrate;GLO;7290;Mining of other non-ferrous metal ores;14290;Other non-ferrous metal ores and concentrates (other than uranium or thorium ores and concentrates);OreMinFuel;Ores, minerals & fuels
;ei_cutoff_3.9_remind_SSP1-PkBudg500_2050 2025-09-04;market for clover seed, Swiss integrated production, for sowing;;9ff8d96e7a110669df02491af311d934;kilogram;clover seed, Swiss integrated production, for sowing;GLO;1640;Seed processing for propagation;1919;Forage products, n.e.c.;AgriForeAnim;Agricultural & forestry products
;ei_cutoff_3.9_remind_SSP1-PkBudg500_2050 2025-09-04;market for lean concrete;;f090c0ac622e3fbbee68f5eb2b704d04;cubic meter;lean concrete;RoW;23950;Manufacture of articles of concrete, cement and plaster;37540;Tiles, flagstones, bricks and similar articles, of cement, concrete or artificial stone;GlasNonMetal;Glass & other non-metallic products
;ei_cutoff_3.9_remind_SSP1-PkBudg500_2050 2025-09-04;market for helium;;612a9183c7bac2685fb87a699974c8aa;kilogram;helium;GLO;20110;Manufacture of basic chemicals;34231;"Chemical elements n.e.c.; inorganic acids except phosphoric, nitric and sulphonitric; inorganic oxygen compoun[…]";Chemical;Chemical products
;ei_cutoff_3.9_remind_SSP1-PkBudg500_2050 2025-09-04;market for compressed air, 600 kPa gauge;;93126600401aae69a9a67a39be326607;cubic meter;compressed air, 600 kPa gauge;RoW;20110;Manufacture of basic chemicals;34250;"Salts of oxometallic or peroxometallic acids; colloidal precious metals and compounds thereof; inorganic and o[…]";Chemical;Chemical products
;ei_cutoff_3.9_remind_SSP1-PkBudg500_2050 2025-09-04;market for biomethane, high pressure;;4f192c25752e78ad78f492c8ca819a65;cubic meter;biomethane, high pressure;RoW;35200;"Manufacture of gas; distribution of gaseous fuels through mains";17200;Coal gas, water gas, producer gas and similar gases, other than petroleum gases and other gaseous hydrocarbons;OreMinFuel;Ores, minerals & fuels
;ei_cutoff_3.9_remind_SSP1-PkBudg500_2050 2025-09-04;market for wheat flour;;0982a449d98739d5d61cb7d81bf9cc36;kilogram;wheat flour;RoW;10610;Manufacture of grain mill products;23110;Wheat and meslin flour;ProcBio;Food & beverages, animal feed
;ei_cutoff_3.9_remind_SSP1-PkBudg500_2050 2025-09-04;market for methane sulfonic acid;;6899ab5c07e1107a0e7887b2b6c28dd5;kilogram;methane sulfonic acid;GLO;20110;Manufacture of basic chemicals;34160;"Organo-sulphur compounds and other organo-inorganic compounds; heterocyclic compounds n.e.c.; nucleic acids an[…]";Chemical;Chemical products
;ei_cutoff_3.9_remind_SSP1-PkBudg500_2050 2025-09-04;market for sewage sludge, dried;;ee00cbb70fdbb040f04ef43047405a93;kilogram;sewage sludge, dried;RoW;23940;Manufacture of cement, lime and plaster;39920;Sewage sludge;AgriForeAnim;Agricultural & forestry products
;ei_cutoff_3.9_remind_SSP1-PkBudg500_2050 2025-09-04;market for ferroniobium, 66% Nb;;e7e751b79636caff3689880ed4426e1b;kilogram;ferroniobium, 66% Nb;GLO;24100;Manufacture of basic iron and steel;41115;Other ferro-alloys;MetalAlloy;Basic metals & alloys, their semi-finished products
;ei_cutoff_3.9_remind_SSP1-PkBudg500_2050 2025-09-04;market for anionic resin;;f86de72e793c7df9e804fb9815a52029;kilogram;anionic resin;RoW;20130;Manufacture of plastics and synthetic rubber in primary forms;34790;"Other plastics in primary forms; ion exchangers";PlastRub;Plastics & rubber products
;ei_cutoff_3.9_remind_SSP1-PkBudg500_2050 2025-09-04;market for benzoic-compound;;2dc320a6b483c0f5868d3dc222dd2de6;kilogram;benzoic-compound;GLO;20210;Manufacture of pesticides and other agrochemical products;34663;Herbicides, anti-sprouting products and plant-growth regulators;Chemical;Chemical products
;ei_cutoff_3.9_remind_SSP1-PkBudg500_2050 2025-09-04;market for foaming agent;;739b62a416c112e2b66a6454e0ada1b5;kilogram;foaming agent;GLO;20230;Manufacture of soap and detergents, cleaning and polishing preparations, pe;35300;Soap, cleaning preparations, perfumes and toilet preparations;Chemical;Chemical products
;ei_cutoff_3.9_remind_SSP1-PkBudg500_2050 2025-09-04;market for transistor, surface-mounted;;b94a53eea3e5b0f0e33b1ade4ec901f4;kilogram;transistor, surface-mounted;GLO;26100;Manufacture of electronic components and boards;47150;"Diodes, transistors and similar semi-conductor devices; photosensitive semi-conductor devices; light emitting […]";MachElecTrans;Metal/electronic equipments & parts
;ei_cutoff_3.9_remind_SSP1-PkBudg500_2050 2025-09-04;market for flyash brick;;3b068c79e45729bbb6199825acd0cc98;kilogram;flyash brick;RoW;23950;Manufacture of articles of concrete, cement and plaster;37310;Bricks, blocks, tiles and other ceramic goods of siliceous earths;GlasNonMetal;Glass & other non-metallic products
;ei_cutoff_3.9_remind_SSP1-PkBudg500_2050 2025-09-04;market for inductor, auxilliaries and energy use;;96afb7730ca314cd03d4a8433025cbfd;kilogram;inductor, auxilliaries and energy use;GLO;26100;Manufacture of electronic components and boards;47100;"Electronic valves and tubes; electronic components; parts thereof";MachElecTrans;Metal/electronic equipments & parts
;ei_cutoff_3.9_remind_SSP1-PkBudg500_2050 2025-09-04;market for feldspar;;10e21d33c3cffcabb5a566c1a47aa060;kilogram;feldspar;GLO;8100;Quarrying of stone, sand and clay;16390;Other minerals n.e.c.;OreMinFuel;Ores, minerals & fuels
;ei_cutoff_3.9_remind_SSP1-PkBudg500_2050 2025-09-04;market for miscanthus, chopped;;e625b878c9a0f275c472f962ad8cfaf6;kilogram;miscanthus, chopped;GLO;1290;Growing of other perennial crops;1990;Other raw vegetable materials, n.e.c.;AgriForeAnim;Agricultural & forestry products
;ei_cutoff_3.9_remind_SSP1-PkBudg500_2050 2025-09-04;market for refractory, fireclay, packed;;6a05527ae9f3de399fa95bf7c5242096;kilogram;refractory, fireclay, packed;GLO;23910;Manufacture of refractory products;37300;Refractory products and structural non-refractory clay products;GlasNonMetal;Glass & other non-metallic products
;ei_cutoff_3.9_remind_SSP1-PkBudg500_2050 2025-09-04;market for nitrous dioxide;;b2618aec43046797a3a467473afa77b7;kilogram;nitrous dioxide;RoW;20110;Manufacture of basic chemicals;34200;Basic inorganic chemicals n.e.c.;Chemical;Chemical products
;ei_cutoff_3.9_remind_SSP1-PkBudg500_2050 2025-09-04;market for fava bean, organic;;afd9e5f03a4f8e1599d8f1a56edfbb9c;kilogram;fava bean, organic;GLO;1110;Growing of cereals (except rice), leguminous crops and oil seeds;1243;Broad beans and horse beans, green;AgriForeAnim;Agricultural & forestry products
;ei_cutoff_3.9_remind_SSP1-PkBudg500_2050 2025-09-04;market for powertrain, for electric passenger car;;e56e73e2509e29d118cff4d782cc563a;kilogram;powertrain, for electric passenger car;GLO;27100;Manufacture of electric motors, generators, transformers and electricity di;46960;"Parts for the goods of subclasses 46910, 46921 and 46929; electrical parts n.e.c. of machinery or apparatus";MachElecTrans;Metal/electronic equipments & parts
;ei_cutoff_3.9_remind_SSP1-PkBudg500_2050 2025-09-04;market for 1,1-dimethylcyclopentane;;e33da62b067e242385e4e3c3e4a83422;kilogram;1,1-dimethylcyclopentane;GLO;19200;Manufacture of refined petroleum products;34100;Basic organic chemicals;Chemical;Chemical products
;ei_cutoff_3.9_remind_SSP1-PkBudg500_2050 2025-09-04;market for dried roughage store, air dried, solar;;4759ac630b8982975b11cf4d2d210a04;cubic meter;dried roughage store, air dried, solar;GLO;41000;Construction of buildings;53121;Industrial buildings;Construction;Construction
;ei_cutoff_3.9_remind_SSP1-PkBudg500_2050 2025-09-04;market for packaging glass, white;;15414a588fab4d021e0c1f1d74ba5e36;kilogram;packaging glass, white;GLO;23100;Manufacture of glass and glass products;37191;Bottles, jars, phials and other containers, of glass, of a kind used for the conveyance or packing of goods, e[…];GlasNonMetal;Glass & other non-metallic products
;ei_cutoff_3.9_remind_SSP1-PkBudg500_2050 2025-09-04;market for barium oxide;;25732b5e2ffc14ebb8ed8eee500862b6;kilogram;barium oxide;GLO;20110;Manufacture of basic chemicals;34231;"Chemical elements n.e.c.; inorganic acids except phosphoric, nitric and sulphonitric; inorganic oxygen compoun[…]";Chemical;Chemical products
;ei_cutoff_3.9_remind_SSP1-PkBudg500_2050 2025-09-04;market for de-icer;;13af8e238ec848222f67f5b228371424;kilogram;de-icer;GLO;20110;Manufacture of basic chemicals;34000;Basic chemicals;Chemical;Chemical products
;ei_cutoff_3.9_remind_SSP1-PkBudg500_2050 2025-09-04;market for rosin size, for paper production;;89c6fb85e02af51aeb9e212c7d9fb41f;kilogram;rosin size, for paper production;RoW;20290;Manufacture of other chemical products n.e.c.;35499;Other chemical products n.e.c.;Chemical;Chemical products
;ei_cutoff_3.9_remind_SSP1-PkBudg500_2050 2025-09-04;market for sawnwood, board, softwood, raw, dried (u=20%);;76b946a1f4a9477cad37a8977445d47d;cubic meter;sawnwood, board, softwood, raw, dried (u=20%);RoW;16100;Sawmilling and planing of wood;31101;Wood, sawn or chipped lengthwise, sliced or peeled, of a thickness exceeding 6 mm, of coniferous wood;ProcBio;Wood, straw & cork
;ei_cutoff_3.9_remind_SSP1-PkBudg500_2050 2025-09-04;market for synthetic gas;;883c2d13129897c1826ee3ca30bc7dc2;cubic meter;synthetic gas;RoW;35200;"Manufacture of gas; distribution of gaseous fuels through mains";17200;Coal gas, water gas, producer gas and similar gases, other than petroleum gases and other gaseous hydrocarbons;OreMinFuel;Ores, minerals & fuels
;ei_cutoff_3.9_remind_SSP1-PkBudg500_2050 2025-09-04;market for chlorine, for reuse in zirconium and hafnium tetrachloride production;;8bb44ba172bc548192be3621c85fce53;kilogram;chlorine, for reuse in zirconium and hafnium tetrachloride production;RoW;24200;Manufacture of basic precious and other non-ferrous metals;34231;"Chemical elements n.e.c.; inorganic acids except phosphoric, nitric and sulphonitric; inorganic oxygen compoun[…]";Chemical;Chemical products
;ei_cutoff_3.9_remind_SSP1-PkBudg500_2050 2025-09-04;market for silicon carbide;;ecddc793de057b056c38a2a378711ece;kilogram;silicon carbide;GLO;23910;Manufacture of refractory products;37300;Refractory products and structural non-refractory clay products;GlasNonMetal;Glass & other non-metallic products
;ei_cutoff_3.9_remind_SSP1-PkBudg500_2050 2025-09-04;market for hydroquinone;;775d4acf58ffc6164e5222323bbb0348;kilogram;hydroquinone;GLO;20110;Manufacture of basic chemicals;34139;Other alcohols, phenols, phenol-alcohols, and their halogenated, sulphonated, nitrated or nitrosated derivativ[…];Chemical;Chemical products
;ei_cutoff_3.9_remind_SSP1-PkBudg500_2050 2025-09-04;market for phosphorus, white, liquid;;2e8a37bef97d3c0329d871698831d467;kilogram;phosphorus, white, liquid;GLO;20110;Manufacture of basic chemicals;34231;"Chemical elements n.e.c.; inorganic acids except phosphoric, nitric and sulphonitric; inorganic oxygen compoun[…]";Chemical;Chemical products
;ei_cutoff_3.9_remind_SSP1-PkBudg500_2050 2025-09-04;market for isohexane;;7f94506cf1198efdfbd069a26f8ce1c6;kilogram;isohexane;GLO;20110;Manufacture of basic chemicals;34100;Basic organic chemicals;Chemical;Chemical products
;ei_cutoff_3.9_remind_SSP1-PkBudg500_2050 2025-09-04;market for tantalum powder, capacitor-grade;;e377a106b47e2561933462fdb23f9588;kilogram;tantalum powder, capacitor-grade;GLO;24200;Manufacture of basic precious and other non-ferrous metals;34231;"Chemical elements n.e.c.; inorganic acids except phosphoric, nitric and sulphonitric; inorganic oxygen compoun[…]";Chemical;Chemical products
;ei_cutoff_3.9_remind_SSP1-PkBudg500_2050 2025-09-04;market for dipropyl amine;;93a134499b20b7dc580434e50e5ed88a;kilogram;dipropyl amine;GLO;20110;Manufacture of basic chemicals;34150;"Amine-function compounds; oxygen-function amino-compounds, except lysine and its esters and salts thereof and […]";Chemical;Chemical products
;ei_cutoff_3.9_remind_SSP1-PkBudg500_2050 2025-09-04;market for banana;;68100fb44f8ad49379f1607967f495e0;kilogram;banana;GLO;1220;Growing of tropical and subtropical fruits;1312;Bananas;AgriForeAnim;Agricultural & forestry products
;ei_cutoff_3.9_remind_SSP1-PkBudg500_2050 2025-09-04;market for cement, CEM III/A;;8716c8b6f2df996ded54c67472212da9;kilogram;cement, CEM III/A;RoW;23940;Manufacture of cement, lime and plaster;37440;Portland cement, aluminous cement, slag cement and similar hydraulic cements, except in the form of clinkers;GlasNonMetal;Glass & other non-metallic products
;ei_cutoff_3.9_remind_SSP1-PkBudg500_2050 2025-09-04;market for light emitting diode;;fbbc45c575d6004d4ef2227855b434dd;kilogram;light emitting diode;GLO;26100;Manufacture of electronic components and boards;47150;"Diodes, transistors and similar semi-conductor devices; photosensitive semi-conductor devices; light emitting […]";MachElecTrans;Metal/electronic equipments & parts
;ei_cutoff_3.9_remind_SSP1-PkBudg500_2050 2025-09-04;market for wheat flour mix;;9fda4cfc1ae56b872cadfa2aa449f078;kilogram;wheat flour mix;GLO;10610;Manufacture of grain mill products;23110;Wheat and meslin flour;ProcBio;Food & beverages, animal feed
;ei_cutoff_3.9_remind_SSP1-PkBudg500_2050 2025-09-04;market for fish canning, small fish;;ae64b2926d090b95aa8cc762c98e7c27;kilogram;fish canning, small fish;GLO;10200;Processing and preserving of fish, crustaceans and molluscs;21200;Prepared and preserved fish, crustaceans, molluscs and other aquatic invertebrates;ProcBio;Food & beverages, animal feed
;ei_cutoff_3.9_remind_SSP1-PkBudg500_2050 2025-09-04;market for potassium perchlorate;;de109d428c6adc495f23ecd1b116aa7a;kilogram;potassium perchlorate;GLO;20110;Manufacture of basic chemicals;34240;"Phosphates of triammonium; salts and peroxysalts of inorganic acids and metals n.e.c.";Chemical;Chemical products
;ei_cutoff_3.9_remind_SSP1-PkBudg500_2050 2025-09-04;market for NMC811 hydroxide;;f81abe2a383b675a23d300859d4ee45e;kilogram;NMC811 hydroxide;RoW;20110;Manufacture of basic chemicals;34220;"Zinc oxide; zinc peroxide; chromium oxides and hydroxides; manganese oxides; iron oxides and hydroxides; earth[…]";Chemical;Chemical products
;ei_cutoff_3.9_remind_SSP1-PkBudg500_2050 2025-09-04;market for sodium hypochlorite, without water, in 15% solution state;;2ec10b1b64e70e51c42f3cadf61b7271;kilogram;sodium hypochlorite, without water, in 15% solution state;RoW;20110;Manufacture of basic chemicals;34240;"Phosphates of triammonium; salts and peroxysalts of inorganic acids and metals n.e.c.";Chemical;Chemical products
;ei_cutoff_3.9_remind_SSP1-PkBudg500_2050 2025-09-04;market for paper, newsprint;;b10c8d3b948cbca3a5b2bda0e9b6a409;kilogram;paper, newsprint;RoW;17010;Manufacture of pulp, paper and paperboard;32121;Newsprint;ProcBio;Pulp & paper
;ei_cutoff_3.9_remind_SSP1-PkBudg500_2050 2025-09-04;market for polycarboxylates, 40% active substance;;c11620e1b7d02fe44af9ef879acd0c82;kilogram;polycarboxylates, 40% active substance;RoW;20230;Manufacture of soap and detergents, cleaning and polishing preparations, pe;35300;Soap, cleaning preparations, perfumes and toilet preparations;Chemical;Chemical products
;ei_cutoff_3.9_remind_SSP1-PkBudg500_2050 2025-09-04;market for dimethylamine;;a37c5cb5a0b59c20939157f6314e66b4;kilogram;dimethylamine;RoW;20110;Manufacture of basic chemicals;34150;"Amine-function compounds; oxygen-function amino-compounds, except lysine and its esters and salts thereof and […]";Chemical;Chemical products
;ei_cutoff_3.9_remind_SSP1-PkBudg500_2050 2025-09-04;market for cement, CEM III/A;;ba4801b0300342309c2083564f30116f;kilogram;cement, CEM III/A;World;23940;Manufacture of cement, lime and plaster;37440;Portland cement, aluminous cement, slag cement and similar hydraulic cements, except in the form of clinkers;GlasNonMetal;Glass & other non-metallic products
;ei_cutoff_3.9_remind_SSP1-PkBudg500_2050 2025-09-04;market for indium rich leaching residues, from zinc production;;6f4a7c6dcf21fff64aa1589a8212659b;kilogram;indium rich leaching residues, from zinc production;GLO;24200;Manufacture of basic precious and other non-ferrous metals;41601;Tungsten, molybdenum, tantalum, magnesium, cobalt, cadmium, titanium, zirconium, beryllium, gallium, hafnium, […];MetalAlloy;Basic metals & alloys, their semi-finished products
;ei_cutoff_3.9_remind_SSP1-PkBudg500_2050 2025-09-04;market for steel, low-alloyed;;a81ce0e882f1b0ef617462fc8e7472e4;kilogram;steel, low-alloyed;GLO;24100;Manufacture of basic iron and steel;41122;Alloy steel in ingots or other primary forms and semi-finished products of alloy steel;MetalAlloy;Basic metals & alloys, their semi-finished products
