activity type;database;name;production amount;code;unit;reference product;location;ISIC_num;ISIC_name;CPC_num;CPC_name;prod_category;prod_sub_category
;ei_cutoff_3.9_remind_SSP1-PkBudg500_2050 2025-09-04;market for yarn, kenaf;;1deb8c6691c4448d10b7c83adde3db1c;kilogram;yarn, kenaf;GLO;13110;Preparation and spinning of textile fibres;26380;"Yarn of vegetable textile fibres other than cotton (including flax, jute, coir and true hemp); paper yarn";ProcBio;Textile
;ei_cutoff_3.9_remind_SSP1-PkBudg500_2050 2025-09-04;market for polymethyl methacrylate, sheet;;033fe693337b46380d8b7ff5dbd457c4;kilogram;polymethyl methacrylate, sheet;GLO;22200;Manufacture of plastics products;36330;Plates, sheets, film, foil and strip, of plastics, not self-adhesive, non-cellular and not reinforced, laminat[…];PlastRub;Plastics & rubber products
;ei_cutoff_3.9_remind_SSP1-PkBudg500_2050 2025-09-04;market for toner, black, powder;;a6fe2b775ef47b88a11912e04ba7494d;kilogram;toner, black, powder;GLO;20220;Manufacture of paints, varnishes and similar coatings, printing ink and mas;35130;Printing ink;Chemical;Chemical products
;ei_cutoff_3.9_remind_SSP1-PkBudg500_2050 2025-09-04;market for transistor, wired, small size, through-hole mounting;;6c59302ba1c9c21630aa6137d163fb27;kilogram;transistor, wired, small size, through-hole mounting;GLO;26100;Manufacture of electronic components and boards;47150;"Diodes, transistors and similar semi-conductor devices; photosensitive semi-conductor devices; light emitting […]";MachElecTrans;Metal/electronic equipments & parts
;ei_cutoff_3.9_remind_SSP1-PkBudg500_2050 2025-09-04;market for hydrogen peroxide, without water, in 50% solution state;;39028b49f6d6245996caaa0a615111eb;kilogram;hydrogen peroxide, without water, in 50% solution state;RoW;20110;Manufacture of basic chemicals;34280;"Hydrogen peroxide; phosphides; carbides; hydrides, nitrides, azides, silicides and borides";Chemical;Chemical products
;ei_cutoff_3.9_remind_SSP1-PkBudg500_2050 2025-09-04;market for internal combustion engine, passenger car;;590bd21d709544178a116528f0180e33;kilogram;internal combustion engine, passenger car;GLO;29100;Manufacture of motor vehicles;43120;Internal combustion engines of a kind used for motor vehicles;MachElecTrans;Metal/electronic equipments & parts
;ei_cutoff_3.9_remind_SSP1-PkBudg500_2050 2025-09-04;market for silicone product;;cb548144c56921cd851d7c490fd4187f;kilogram;silicone product;RoW;20130;Manufacture of plastics and synthetic rubber in primary forms;34800;Synthetic rubber and factice derived from oils, and mixtures thereof with natural rubber and similar natural g[…];Chemical;Chemical products
;ei_cutoff_3.9_remind_SSP1-PkBudg500_2050 2025-09-04;market for cobalt;;e00cbb03fdc5efbd82cb393eb7edeecf;kilogram;cobalt;GLO;24200;Manufacture of basic precious and other non-ferrous metals;41601;Tungsten, molybdenum, tantalum, magnesium, cobalt, cadmium, titanium, zirconium, beryllium, gallium, hafnium, […];MetalAlloy;Basic metals & alloys, their semi-finished products
;ei_cutoff_3.9_remind_SSP1-PkBudg500_2050 2025-09-04;market for tube insulation, elastomere;;938a376b236e5cda14feeecfe289a875;kilogram;tube insulation, elastomere;GLO;22190;Manufacture of other rubber products;36230;Tubes, pipes and hoses of vulcanized rubber other than hard rubber;PlastRub;Plastics & rubber products
;ei_cutoff_3.9_remind_SSP1-PkBudg500_2050 2025-09-04;market for melamine;;75d72d912fff9a45a1d276a776b75932;kilogram;melamine;GLO;20110;Manufacture of basic chemicals;35230;Lactones n.e.c., heterocyclic compounds with nitrogen hetero-atom(s) only, containing an unfused pyrazole ring[…];Chemical;Chemical products
;ei_cutoff_3.9_remind_SSP1-PkBudg500_2050 2025-09-04;market for electronic component, active, unspecified;;03bdcafa6ca2fbbb6ba2ed5a03d0a4b5;kilogram;electronic component, active, unspecified;GLO;26100;Manufacture of electronic components and boards;47100;"Electronic valves and tubes; electronic components; parts thereof";MachElecTrans;Metal/electronic equipments & parts
;ei_cutoff_3.9_remind_SSP1-PkBudg500_2050 2025-09-04;market for isopropyl acetate;;46c32f73e7f1c285a27fb598ed41bc1a;kilogram;isopropyl acetate;RoW;20110;Manufacture of basic chemicals;34140;Carboxylic acids and their anhydrides, halides, peroxides and peroxyacids and their halogenated, sulphonated, […];Chemical;Chemical products
;ei_cutoff_3.9_remind_SSP1-PkBudg500_2050 2025-09-04;market for refractory, basic, packed;;f26980d768519c377a7ec264b866e732;kilogram;refractory, basic, packed;GLO;23910;Manufacture of refractory products;37300;Refractory products and structural non-refractory clay products;GlasNonMetal;Glass & other non-metallic products
;ei_cutoff_3.9_remind_SSP1-PkBudg500_2050 2025-09-04;market for glass fibre;;3ac7d8478a14a894284730281431383d;kilogram;glass fibre;GLO;23100;Manufacture of glass and glass products;37120;Glass fibres and articles thereof, except woven fabrics;GlasNonMetal;Glass & other non-metallic products
;ei_cutoff_3.9_remind_SSP1-PkBudg500_2050 2025-09-04;market for acetone cyanohydrin;;9bb1afb4319dc8b8e27b49ca18b7a32a;kilogram;acetone cyanohydrin;RoW;20130;Manufacture of plastics and synthetic rubber in primary forms;34100;Basic organic chemicals;Chemical;Chemical products
;ei_cutoff_3.9_remind_SSP1-PkBudg500_2050 2025-09-04;market for cerium oxide;;61327023f95070243f6f2fc9d8f01a2b;kilogram;cerium oxide;GLO;7290;Mining of other non-ferrous metal ores;34290;Compounds of rare earth metals, of yttrium or of scandium;Chemical;Chemical products
;ei_cutoff_3.9_remind_SSP1-PkBudg500_2050 2025-09-04;market for formic acid;;0890915c95f79fa6a7f1c6a7843c30cb;kilogram;formic acid;RoW;20110;Manufacture of basic chemicals;34120;"Industrial monocarboxylic fatty acids; acid oils from refining";Chemical;Chemical products
;ei_cutoff_3.9_remind_SSP1-PkBudg500_2050 2025-09-04;market for printed wiring board, mounted mainboard, desktop computer, Pb free;;3d2a7b0214c46d4d1d9f0797306ac627;kilogram;printed wiring board, mounted mainboard, desktop computer, Pb free;GLO;26100;Manufacture of electronic components and boards;47160;Electronic integrated circuits;MachElecTrans;Metal/electronic equipments & parts
;ei_cutoff_3.9_remind_SSP1-PkBudg500_2050 2025-09-04;market for trimethylamine;;36e9a5f8e6f110b1f50a2427e0c3373c;kilogram;trimethylamine;RoW;20110;Manufacture of basic chemicals;34150;"Amine-function compounds; oxygen-function amino-compounds, except lysine and its esters and salts thereof and […]";Chemical;Chemical products
;ei_cutoff_3.9_remind_SSP1-PkBudg500_2050 2025-09-04;market for silicon, multi-Si, casted;;73a4483e483a28e471ceffb1e6ef8b0d;kilogram;silicon, multi-Si, casted;RoW;20110;Manufacture of basic chemicals;34200;Basic inorganic chemicals n.e.c.;Chemical;Chemical products
;ei_cutoff_3.9_remind_SSP1-PkBudg500_2050 2025-09-04;market for pea seed, for sowing;;a551bec6813032b341f4d9cbb1419a19;kilogram;pea seed, for sowing;GLO;1640;Seed processing for propagation;1260;Vegetable seeds, except beet seeds;AgriForeAnim;Agricultural & forestry products
;ei_cutoff_3.9_remind_SSP1-PkBudg500_2050 2025-09-04;market for straw, organic;;e1d2a7d5751f8635806666d8964a3b60;kilogram;straw, organic;RoW;1110;Growing of cereals (except rice), leguminous crops and oil seeds;1913;Cereal straw, husks, unprepared, ground, pressed, or in the form of pellets;AgriForeAnim;Agricultural & forestry products
;ei_cutoff_3.9_remind_SSP1-PkBudg500_2050 2025-09-04;market for electrolyte, for Li-ion battery;;b49d257658eed532094d68babcecf2e1;kilogram;electrolyte, for Li-ion battery;GLO;20000;Manufacture of chemicals and chemical products;35470;Chemical elements and compounds doped for use in electronics;Chemical;Chemical products
;ei_cutoff_3.9_remind_SSP1-PkBudg500_2050 2025-09-04;market for gold-silver, ingot;;e06eed9912af66347d920075212adc8c;kilogram;gold-silver, ingot;GLO;24200;Manufacture of basic precious and other non-ferrous metals;41320;Gold (including gold plated with platinum), unwrought or in semi-manufactured forms, or in powder form;MetalAlloy;Basic metals & alloys, their semi-finished products
;ei_cutoff_3.9_remind_SSP1-PkBudg500_2050 2025-09-04;market for potato starch;;8ce68e5f71f8f8c5dc50edb913e9cea1;kilogram;potato starch;GLO;10620;Manufacture of starches and starch products;23220;"Starches; inulin; wheat gluten; dextrins and other modified starches";ProcBio;Food & beverages, animal feed
;ei_cutoff_3.9_remind_SSP1-PkBudg500_2050 2025-09-04;market for octabenzone;;9cd35727b22ad07961e63ada69aeee8d;kilogram;octabenzone;GLO;20290;Manufacture of other chemical products n.e.c.;35499;Other chemical products n.e.c.;Chemical;Chemical products
;ei_cutoff_3.9_remind_SSP1-PkBudg500_2050 2025-09-04;market for aluminium, wrought alloy;;d25c8e0755ee9899fb4e892990397a68;kilogram;aluminium, wrought alloy;GLO;24200;Manufacture of basic precious and other non-ferrous metals;41530;Semi-finished products of aluminium or aluminium alloys;MetalAlloy;Basic metals & alloys, their semi-finished products
;ei_cutoff_3.9_remind_SSP1-PkBudg500_2050 2025-09-04;market for hay;;d0599b36cb901382d8cea9968512739e;kilogram;hay;GLO;1190;Growing of other non-perennial crops;1919;Forage products, n.e.c.;AgriForeAnim;Agricultural & forestry products
;ei_cutoff_3.9_remind_SSP1-PkBudg500_2050 2025-09-04;market for sawnwood, beam, hardwood, dried (u=20%), planed;;1c793ef5070bf904a9b5942014826747;cubic meter;sawnwood, beam, hardwood, dried (u=20%), planed;RoW;16100;Sawmilling and planing of wood;31102;Wood, sawn or chipped lengthwise, sliced or peeled, of a thickness exceeding 6 mm, of non-coniferous wood;ProcBio;Wood, straw & cork
;ei_cutoff_3.9_remind_SSP1-PkBudg500_2050 2025-09-04;market for cement, CP III;;90f450c4b0aa447ab46e3e0692384afe;kilogram;cement, CP III;World;23940;Manufacture of cement, lime and plaster;37440;Portland cement, aluminous cement, slag cement and similar hydraulic cements, except in the form of clinkers;GlasNonMetal;Glass & other non-metallic products
;ei_cutoff_3.9_remind_SSP1-PkBudg500_2050 2025-09-04;market for benzoic acid;;b243372acdb48c25339f1e9b6f877489;kilogram;benzoic acid;RoW;20110;Manufacture of basic chemicals;34120;"Industrial monocarboxylic fatty acids; acid oils from refining";Chemical;Chemical products
;ei_cutoff_3.9_remind_SSP1-PkBudg500_2050 2025-09-04;market for prochloraz;;a7349cf63913eb32029552c1c9a9a20e;kilogram;prochloraz;GLO;20110;Manufacture of basic chemicals;34662;Fungicides;Chemical;Chemical products
;ei_cutoff_3.9_remind_SSP1-PkBudg500_2050 2025-09-04;market for butene, mixed;;f31332c3601535bf2bfee086aca44c68;kilogram;butene, mixed;RoW;19200;Manufacture of refined petroleum products;33421;Ethylene, propylene, butylene, butadiene;OreMinFuel;Ores, minerals & fuels
;ei_cutoff_3.9_remind_SSP1-PkBudg500_2050 2025-09-04;market for cadmium chloride, semiconductor-grade;;492bc562567c44952ccfd3f031c1e433;kilogram;cadmium chloride, semiconductor-grade;GLO;20110;Manufacture of basic chemicals;34200;Basic inorganic chemicals n.e.c.;Chemical;Chemical products
;ei_cutoff_3.9_remind_SSP1-PkBudg500_2050 2025-09-04;market for printed wiring board, for power supply unit, desktop computer, Pb containing;;778605d9e88a6f5d07504035aacd5a20;kilogram;printed wiring board, for power supply unit, desktop computer, Pb containing;GLO;26100;Manufacture of electronic components and boards;47160;Electronic integrated circuits;MachElecTrans;Metal/electronic equipments & parts
;ei_cutoff_3.9_remind_SSP1-PkBudg500_2050 2025-09-04;market for electrode, negative, LiC6;;8aeca673cf07d3ada8ffee43541c3688;kilogram;electrode, negative, LiC6;GLO;27200;Manufacture of batteries and accumulators;46430;Parts of primary cells, primary batteries and electric accumulators (including separators);MachElecTrans;Metal/electronic equipments & parts
;ei_cutoff_3.9_remind_SSP1-PkBudg500_2050 2025-09-04;market for ammonium bicarbonate;;7b9fc672c256b4bf825fe423670daae2;kilogram;ammonium bicarbonate;RoW;20120;Manufacture of fertilizers and nitrogen compounds;34240;"Phosphates of triammonium; salts and peroxysalts of inorganic acids and metals n.e.c.";Chemical;Chemical products
;ei_cutoff_3.9_remind_SSP1-PkBudg500_2050 2025-09-04;market for oxygen, liquid;;43ac81fd8d214649a88949b561b81538;kilogram;oxygen, liquid;World;20110;Manufacture of basic chemicals;34210;"Hydrogen, nitrogen, oxygen, carbon dioxide and rare gases; inorganic oxygen compounds of non-metals n.e.c.";Chemical;Chemical products
;ei_cutoff_3.9_remind_SSP1-PkBudg500_2050 2025-09-04;market for carbon tetrachloride;;3a734413223553f6e2336c00506e0370;kilogram;carbon tetrachloride;RoW;20110;Manufacture of basic chemicals;34110;Hydrocarbons and their halogenated, sulphonated, nitrated or nitrosated derivatives;Chemical;Chemical products
;ei_cutoff_3.9_remind_SSP1-PkBudg500_2050 2025-09-04;market for diborane;;15116df79892d14740b43df85b81e7e8;kilogram;diborane;GLO;20110;Manufacture of basic chemicals;34000;Basic chemicals;Chemical;Chemical products
;ei_cutoff_3.9_remind_SSP1-PkBudg500_2050 2025-09-04;market for battery, Li-ion, NMC811, rechargeable, prismatic;;a6340d3ae1622f5fea25af16af07bbc0;kilogram;battery, Li-ion, NMC811, rechargeable, prismatic;GLO;27200;Manufacture of batteries and accumulators;46410;Primary cells and primary batteries;MachElecTrans;Metal/electronic equipments & parts
;ei_cutoff_3.9_remind_SSP1-PkBudg500_2050 2025-09-04;market for fluorescent whitening agent, distyrylbiphenyl type;;203449e2f4a62d5e07e1ead9daff6c3d;kilogram;fluorescent whitening agent, distyrylbiphenyl type;GLO;20110;Manufacture of basic chemicals;34310;"Synthetic organic colouring matter and preparations based thereon; synthetic organic products of a kind used a[…]";Chemical;Chemical products
;ei_cutoff_3.9_remind_SSP1-PkBudg500_2050 2025-09-04;market for NPK (15-15-15) fertiliser;;47b9b9e5f4259513798eea1b4b183ac4;kilogram;NPK (15-15-15) fertiliser;RoW;20120;Manufacture of fertilizers and nitrogen compounds;34641;Fertilizers containing three nutrients: nitrogen, phosphorus and potassium;Chemical;Chemical products
;ei_cutoff_3.9_remind_SSP1-PkBudg500_2050 2025-09-04;market for cathode, LFP, for Li-ion battery;;de9d213ce13f4f537837dea3b4f9faf7;kilogram;cathode, LFP, for Li-ion battery;RoW;20110;Manufacture of basic chemicals;46430;Parts of primary cells, primary batteries and electric accumulators (including separators);MachElecTrans;Metal/electronic equipments & parts
;ei_cutoff_3.9_remind_SSP1-PkBudg500_2050 2025-09-04;market for metal working machine, unspecified;;bb0287f06c11d715c1a01c7d040a5901;kilogram;metal working machine, unspecified;RoW;28220;Manufacture of metal-forming machinery and machine tools;44210;"Machine-tools for working metal; machine-tools for working any material by laser or similar process";MachElecTrans;Metal/electronic equipments & parts
;ei_cutoff_3.9_remind_SSP1-PkBudg500_2050 2025-09-04;market for orange, processing grade;;508d6c44859f3fae6d4ff0c38a75b87e;kilogram;orange, processing grade;GLO;1230;Growing of citrus fruits;1323;Oranges;AgriForeAnim;Agricultural & forestry products
;ei_cutoff_3.9_remind_SSP1-PkBudg500_2050 2025-09-04;market for petrol, 15% ETBE additive by volume, with ethanol from biomass;;058862075ffa269d2102b4269409735a;kilogram;petrol, 15% ETBE additive by volume, with ethanol from biomass;GLO;19200;Manufacture of refined petroleum products;33300;"Petroleum oils and oils obtained from bituminous materials, other than crude; preparations n.e.c. containing by […]";OreMinFuel;Ores, minerals & fuels
;ei_cutoff_3.9_remind_SSP1-PkBudg500_2050 2025-09-04;market for packaging, for fertilisers or pesticides;;e987717e5aa26678fd989b2768e8ad12;kilogram;packaging, for fertilisers or pesticides;GLO;22200;Manufacture of plastics products;36400;Packaging products of plastics;PlastRub;Plastics & rubber products
;ei_cutoff_3.9_remind_SSP1-PkBudg500_2050 2025-09-04;market for disodium disulphite;;3f67014b8e14d9835fb8ebbdfb733ecc;kilogram;disodium disulphite;GLO;20110;Manufacture of basic chemicals;34240;"Phosphates of triammonium; salts and peroxysalts of inorganic acids and metals n.e.c.";Chemical;Chemical products
;ei_cutoff_3.9_remind_SSP1-PkBudg500_2050 2025-09-04;market for tris(2,4-ditert-butylphenyl) phosphite;;92b184ae6a650b649c79cfdafe5c6400;kilogram;tris(2,4-ditert-butylphenyl) phosphite;GLO;20110;Manufacture of basic chemicals;34180;Phosphoric esters and their salts or esters of other inorganic acids (excluding esters of hydrogen halides) an[…];Chemical;Chemical products
;ei_cutoff_3.9_remind_SSP1-PkBudg500_2050 2025-09-04;market for expanded vermiculite;;aa15592df343a631cf04260bc4baca76;kilogram;expanded vermiculite;GLO;23990;Manufacture of other non-metallic mineral products n.e.c.;37990;Non-metallic mineral products n.e.c. (including mineral wool, expanded mineral materials, worked mica, article[…];GlasNonMetal;Glass & other non-metallic products
;ei_cutoff_3.9_remind_SSP1-PkBudg500_2050 2025-09-04;market for thionyl chloride;;409afb5908f288ee39a2ce264595580e;kilogram;thionyl chloride;RoW;20110;Manufacture of basic chemicals;34240;"Phosphates of triammonium; salts and peroxysalts of inorganic acids and metals n.e.c.";Chemical;Chemical products
;ei_cutoff_3.9_remind_SSP1-PkBudg500_2050 2025-09-04;market for silicon, single crystal, Czochralski process, electronics;;4c47fb2e57f28bb0ec8f613c349a16d5;kilogram;silicon, single crystal, Czochralski process, electronics;RoW;20110;Manufacture of basic chemicals;34200;Basic inorganic chemicals n.e.c.;Chemical;Chemical products
;ei_cutoff_3.9_remind_SSP1-PkBudg500_2050 2025-09-04;market for capacitor, auxilliaries and energy use;;567bd2e111ed763a1ede56ffafc2cf01;kilogram;capacitor, auxilliaries and energy use;GLO;26100;Manufacture of electronic components and boards;47110;Electrical capacitors;MachElecTrans;Metal/electronic equipments & parts
;ei_cutoff_3.9_remind_SSP1-PkBudg500_2050 2025-09-04;market for sawnwood, lath, softwood, raw, dried (u=20%);;bffc4169632245b14852bead436245c4;cubic meter;sawnwood, lath, softwood, raw, dried (u=20%);RoW;16100;Sawmilling and planing of wood;31101;Wood, sawn or chipped lengthwise, sliced or peeled, of a thickness exceeding 6 mm, of coniferous wood;ProcBio;Wood, straw & cork
;ei_cutoff_3.9_remind_SSP1-PkBudg500_2050 2025-09-04;market for fishmeal, 65-67% protein;;d0d77072e7d32a9dfcea2713e4a4733d;kilogram;fishmeal, 65-67% protein;GLO;10200;Processing and preserving of fish, crustaceans and molluscs;21291;Flours, meals and pellets, inedible, of fish, crustaceans, molluscs or other aquatic invertebrates;ProcBio;Food & beverages, animal feed
;ei_cutoff_3.9_remind_SSP1-PkBudg500_2050 2025-09-04;market for hydrogen, gaseous, 20-year period;;0a3ebeee1a2d48fcb0d95db6566e62a5;kilogram;hydrogen, gaseous;World;19200;Manufacture of refined petroleum products;34210;"Hydrogen, nitrogen, oxygen, carbon dioxide and rare gases; inorganic oxygen compounds of non-metals n.e.c.";Chemical;Chemical products
;ei_cutoff_3.9_remind_SSP1-PkBudg500_2050 2025-09-04;market for uranium, in yellowcake;;a845aee228e8267b9b7b6c6fdcd9d13a;kilogram;uranium, in yellowcake;GLO;7210;Mining of uranium and thorium ores;13000;Uranium and thorium ores and concentrates;OreMinFuel;Ores, minerals & fuels
;ei_cutoff_3.9_remind_SSP1-PkBudg500_2050 2025-09-04;market for monoethanolamine;;1d95a9865e5ecb049eb64f6823865078;kilogram;monoethanolamine;GLO;20110;Manufacture of basic chemicals;34150;"Amine-function compounds; oxygen-function amino-compounds, except lysine and its esters and salts thereof and […]";Chemical;Chemical products
;ei_cutoff_3.9_remind_SSP1-PkBudg500_2050 2025-09-04;market for [thio]carbamate-compound;;ef7cbf15acc1429268635955de825e54;kilogram;[thio]carbamate-compound;GLO;20210;Manufacture of pesticides and other agrochemical products;34663;Herbicides, anti-sprouting products and plant-growth regulators;Chemical;Chemical products
;ei_cutoff_3.9_remind_SSP1-PkBudg500_2050 2025-09-04;market for navy bean;;1b8a30f238981b93f41c4e994cf56214;kilogram;navy bean;GLO;1110;Growing of cereals (except rice), leguminous crops and oil seeds;1243;Broad beans and horse beans, green;AgriForeAnim;Agricultural & forestry products
;ei_cutoff_3.9_remind_SSP1-PkBudg500_2050 2025-09-04;market for sodium tetrafluoroborate;;add234d9bd0210d2090f0a2eaff1ea6b;kilogram;sodium tetrafluoroborate;GLO;20110;Manufacture of basic chemicals;34200;Basic inorganic chemicals n.e.c.;Chemical;Chemical products
;ei_cutoff_3.9_remind_SSP1-PkBudg500_2050 2025-09-04;market for cement, unspecified;;7eba4555668563087546d146e049957d;kilogram;cement, unspecified;RoW;23940;Manufacture of cement, lime and plaster;37400;Plaster, lime and cement;GlasNonMetal;Glass & other non-metallic products
;ei_cutoff_3.9_remind_SSP1-PkBudg500_2050 2025-09-04;market for bipyridylium-compound;;c97f5eca2e11a0ac434d8d3d5fce732a;kilogram;bipyridylium-compound;GLO;20210;Manufacture of pesticides and other agrochemical products;34663;Herbicides, anti-sprouting products and plant-growth regulators;Chemical;Chemical products
;ei_cutoff_3.9_remind_SSP1-PkBudg500_2050 2025-09-04;market for magnesium chloride, from hafnium sponge production;;88f3a80f97d250998bbdb1fb71d3cdaa;kilogram;magnesium chloride, from hafnium sponge production;GLO;24200;Manufacture of basic precious and other non-ferrous metals;34200;Basic inorganic chemicals n.e.c.;Chemical;Chemical products
;ei_cutoff_3.9_remind_SSP1-PkBudg500_2050 2025-09-04;market for rice, basmati;;0f9dc9d51dc64358635aa88e7fc29016;kilogram;rice, basmati;GLO;1120;Growing of rice;1130;Rice;AgriForeAnim;Agricultural & forestry products
;ei_cutoff_3.9_remind_SSP1-PkBudg500_2050 2025-09-04;market for bisphenol A epoxy based vinyl ester resin;;1aa3a7558cc8db1a76a3770661632ffb;kilogram;bisphenol A epoxy based vinyl ester resin;GLO;20130;Manufacture of plastics and synthetic rubber in primary forms;34790;"Other plastics in primary forms; ion exchangers";PlastRub;Plastics & rubber products
;ei_cutoff_3.9_remind_SSP1-PkBudg500_2050 2025-09-04;market for coconut husk;;94c1cb9e760faf73987ffea6c08cfcf1;kilogram;coconut husk;GLO;1610;Support activities for crop production;1913;Cereal straw, husks, unprepared, ground, pressed, or in the form of pellets;AgriForeAnim;Agricultural & forestry products
;ei_cutoff_3.9_remind_SSP1-PkBudg500_2050 2025-09-04;market for ytterbium oxide;;2ef0513b4dcd2fee2bd298f5e30fe0b6;kilogram;ytterbium oxide;GLO;7290;Mining of other non-ferrous metal ores;34290;Compounds of rare earth metals, of yttrium or of scandium;Chemical;Chemical products
;ei_cutoff_3.9_remind_SSP1-PkBudg500_2050 2025-09-04;market for lime, packed;;ce3836ce533841646352e6e52e5aec46;kilogram;lime, packed;RoW;8100;Quarrying of stone, sand and clay;37420;Quicklime, slaked lime and hydraulic lime;GlasNonMetal;Glass & other non-metallic products
;ei_cutoff_3.9_remind_SSP1-PkBudg500_2050 2025-09-04;market for purse seiner, steel;;476db8d5d12f571bca72bb11b3081de7;kilogram;purse seiner, steel;GLO;3110;Marine fishing;49315;"Fishing vessels; factory ships and other vessels for processing or preserving fishery products";MachElecTrans;Transport vehicles
;ei_cutoff_3.9_remind_SSP1-PkBudg500_2050 2025-09-04;market for rape seed, organic, for sowing;;3f6e423141bbf2e023ee3c2adf3394d3;kilogram;rape seed, organic, for sowing;GLO;1640;Seed processing for propagation;1443;Rape or colza seed;AgriForeAnim;Agricultural & forestry products
;ei_cutoff_3.9_remind_SSP1-PkBudg500_2050 2025-09-04;market for oat seed, Swiss integrated production, at farm;;c8d7ec0c8ddf1f114dfa10a5958b24f2;kilogram;oat seed, Swiss integrated production, at farm;GLO;1110;Growing of cereals (except rice), leguminous crops and oil seeds;1171;Oats, seed;AgriForeAnim;Agricultural & forestry products
;ei_cutoff_3.9_remind_SSP1-PkBudg500_2050 2025-09-04;market for white spirit;;7286549def54a52605a3aed9ef6b8e4e;kilogram;white spirit;GLO;19200;Manufacture of refined petroleum products;33350;White spirit and special boiling point industrial spirits;OreMinFuel;Ores, minerals & fuels
;ei_cutoff_3.9_remind_SSP1-PkBudg500_2050 2025-09-04;market for esters of versatic acid;;1fe1d43e8f135ba76719266dfe3f36db;kilogram;esters of versatic acid;RoW;20110;Manufacture of basic chemicals;34100;Basic organic chemicals;Chemical;Chemical products
;ei_cutoff_3.9_remind_SSP1-PkBudg500_2050 2025-09-04;market for sand-lime brick;;2706c72e9fd70ec905b3b3c565410e6e;kilogram;sand-lime brick;GLO;23950;Manufacture of articles of concrete, cement and plaster;37540;Tiles, flagstones, bricks and similar articles, of cement, concrete or artificial stone;GlasNonMetal;Glass & other non-metallic products
;ei_cutoff_3.9_remind_SSP1-PkBudg500_2050 2025-09-04;market for cement mortar;;1fcb1c7c6c6545719897f0fb141a4162;kilogram;cement mortar;World;23940;Manufacture of cement, lime and plaster;37000;Glass and glass products and other non-metallic products n.e.c.;GlasNonMetal;Glass & other non-metallic products
;ei_cutoff_3.9_remind_SSP1-PkBudg500_2050 2025-09-04;market for cocamide diethanolamine;;ef57ea33889bf8b7d17b4a1f16464d83;kilogram;cocamide diethanolamine;GLO;20230;Manufacture of soap and detergents, cleaning and polishing preparations, pe;35310;Organic surface active agents, except soap;Chemical;Chemical products
;ei_cutoff_3.9_remind_SSP1-PkBudg500_2050 2025-09-04;market for propanal;;3fab21eed5e555b78c82464739676d23;kilogram;propanal;RoW;20110;Manufacture of basic chemicals;34100;Basic organic chemicals;Chemical;Chemical products
;ei_cutoff_3.9_remind_SSP1-PkBudg500_2050 2025-09-04;market for hydrogen, gaseous;;bb25455088b24965b7bc0eb35c92ad49;kilogram;hydrogen, gaseous;World;19200;Manufacture of refined petroleum products;34210;"Hydrogen, nitrogen, oxygen, carbon dioxide and rare gases; inorganic oxygen compounds of non-metals n.e.c.";Chemical;Chemical products
