activity type;database;name;production amount;code;unit;reference product;location;ISIC_num;ISIC_name;CPC_num;CPC_name;prod_category;prod_sub_category
;ei_cutoff_3.9_remind_SSP1-PkBudg500_2050 2025-09-04;market for polyester-complexed starch biopolymer;;05b8a4dd04554d1e45e050e26cfe0c96;kilogram;polyester-complexed starch biopolymer;GLO;10620;Manufacture of starches and starch products;23220;"Starches; inulin; wheat gluten; dextrins and other modified starches";ProcBio;Food & beverages, animal feed
;ei_cutoff_3.9_remind_SSP1-PkBudg500_2050 2025-09-04;market for silicon, electronics grade;;e44d6f6a676cdfff45f5b9eece638152;kilogram;silicon, electronics grade;GLO;20110;Manufacture of basic chemicals;34200;Basic inorganic chemicals n.e.c.;Chemical;Chemical products
;ei_cutoff_3.9_remind_SSP1-PkBudg500_2050 2025-09-04;market for expanded clay;;7afc4f3a48f77acf9906be359744e632;kilogram;expanded clay;GLO;23990;Manufacture of other non-metallic mineral products n.e.c.;37990;Non-metallic mineral products n.e.c. (including mineral wool, expanded mineral materials, worked mica, article[…];GlasNonMetal;Glass & other non-metallic products
;ei_cutoff_3.9_remind_SSP1-PkBudg500_2050 2025-09-04;market for carrot;;7e0b03342cb90ee6053113e8c84ad4d4;kilogram;carrot;GLO;1130;Growing of vegetables and melons, roots and tubers;1251;Carrots and turnips;AgriForeAnim;Agricultural & forestry products
;ei_cutoff_3.9_remind_SSP1-PkBudg500_2050 2025-09-04;market for methylcyclopentane;;2c6782a682494e89f2916a0304a7c50a;kilogram;methylcyclopentane;GLO;19200;Manufacture of refined petroleum products;34100;Basic organic chemicals;Chemical;Chemical products
;ei_cutoff_3.9_remind_SSP1-PkBudg500_2050 2025-09-04;market for hafnium sponge;;fc220c73a8fd0b18427b8906c0583178;kilogram;hafnium sponge;GLO;24200;Manufacture of basic precious and other non-ferrous metals;41601;Tungsten, molybdenum, tantalum, magnesium, cobalt, cadmium, titanium, zirconium, beryllium, gallium, hafnium, […];MetalAlloy;Basic metals & alloys, their semi-finished products
;ei_cutoff_3.9_remind_SSP1-PkBudg500_2050 2025-09-04;market for organic potassium fertiliser, as K2O;;c00acfadda185ef372bf9524bb0c6a33;kilogram;organic potassium fertiliser, as K2O;GLO;1610;Support activities for crop production;34659;Fertilizers n.e.c.;Chemical;Chemical products
;ei_cutoff_3.9_remind_SSP1-PkBudg500_2050 2025-09-04;market for petrol, 4% ETBE additive by volume, with ethanol from biomass;;ef4ce0dd882a0aa383bfeee65c03abf7;kilogram;petrol, 4% ETBE additive by volume, with ethanol from biomass;GLO;19200;Manufacture of refined petroleum products;33300;"Petroleum oils and oils obtained from bituminous materials, other than crude; preparations n.e.c. containing by […]";OreMinFuel;Ores, minerals & fuels
;ei_cutoff_3.9_remind_SSP1-PkBudg500_2050 2025-09-04;market for uranium ore, as U;;14d101d34f42188d4b78945f55579c0f;kilogram;uranium ore, as U;GLO;7210;Mining of uranium and thorium ores;13000;Uranium and thorium ores and concentrates;OreMinFuel;Ores, minerals & fuels
;ei_cutoff_3.9_remind_SSP1-PkBudg500_2050 2025-09-04;market for sheet rolling, aluminium;;acf665d13787149d4c1e71a8ae475b41;kilogram;sheet rolling, aluminium;GLO;24200;Manufacture of basic precious and other non-ferrous metals;41530;Semi-finished products of aluminium or aluminium alloys;MetalAlloy;Basic metals & alloys, their semi-finished products
;ei_cutoff_3.9_remind_SSP1-PkBudg500_2050 2025-09-04;market for sunflower silage;;b3f293a2369ba1887e88d28c2acc3137;kilogram;sunflower silage;GLO;1610;Support activities for crop production;1919;Forage products, n.e.c.;AgriForeAnim;Agricultural & forestry products
;ei_cutoff_3.9_remind_SSP1-PkBudg500_2050 2025-09-04;market for electric scooter, without battery;;e087ea045e7a335315d5bf1132b034d3;kilogram;electric scooter, without battery;GLO;30910;Manufacture of motorcycles;49913;Motorcycles and cycles fitted with an auxiliary motor, other than those with reciprocating internal combustion[…];MachElecTrans;Transport vehicles
;ei_cutoff_3.9_remind_SSP1-PkBudg500_2050 2025-09-04;market for tomato, processing grade;;e5008c3d707688112dc1bd2d309b4bdd;kilogram;tomato, processing grade;GLO;1130;Growing of vegetables and melons, roots and tubers;1234;Tomatoes;AgriForeAnim;Agricultural & forestry products
;ei_cutoff_3.9_remind_SSP1-PkBudg500_2050 2025-09-04;market for corrugated board box;;b429b7efad1f2d6f493e1fbefce87d38;kilogram;corrugated board box;RoW;17020;Manufacture of corrugated paper and paperboard and of containers of paper a;32153;Cartons, boxes, cases, record sleeves and other packing containers (except bags) of paper, paperboard, cellulo[…];ProcBio;Pulp & paper
;ei_cutoff_3.9_remind_SSP1-PkBudg500_2050 2025-09-04;market for naphtha;;9d6d08d5fd9a3978808fba0caab907a2;kilogram;naphtha;RoW;19200;Manufacture of refined petroleum products;33330;Naphtha;OreMinFuel;Ores, minerals & fuels
;ei_cutoff_3.9_remind_SSP1-PkBudg500_2050 2025-09-04;market for linseed;;c2da04479af6f089181a94c6e4cda05d;kilogram;linseed;GLO;1110;Growing of cereals (except rice), leguminous crops and oil seeds;1441;Linseed;AgriForeAnim;Agricultural & forestry products
;ei_cutoff_3.9_remind_SSP1-PkBudg500_2050 2025-09-04;market for dolomite;;664abb18d8a9519808223f7797e972b7;kilogram;dolomite;RoW;8910;Mining of chemical and fertilizer minerals;16330;Chalk and dolomite;OreMinFuel;Ores, minerals & fuels
;ei_cutoff_3.9_remind_SSP1-PkBudg500_2050 2025-09-04;market for iron pellet;;0409a01e5c245a0dc2ae585a86d38efc;kilogram;iron pellet;GLO;24100;Manufacture of basic iron and steel;41116;Ferrous products obtained by direct reduction of iron ore and other spongy ferrous products, in lumps, pellets[…];MetalAlloy;Basic metals & alloys, their semi-finished products
;ei_cutoff_3.9_remind_SSP1-PkBudg500_2050 2025-09-04;market for NMC111 hydroxide;;c32636169ae0313a362cfda7255c9d9e;kilogram;NMC111 hydroxide;RoW;20110;Manufacture of basic chemicals;34220;"Zinc oxide; zinc peroxide; chromium oxides and hydroxides; manganese oxides; iron oxides and hydroxides; earth[…]";Chemical;Chemical products
;ei_cutoff_3.9_remind_SSP1-PkBudg500_2050 2025-09-04;market for hard coal, run-of-mine;;a618878275594be40595ef331189707b;kilogram;hard coal, run-of-mine;RoW;5100;Mining of hard coal;11010;Hard coal;OreMinFuel;Ores, minerals & fuels
;ei_cutoff_3.9_remind_SSP1-PkBudg500_2050 2025-09-04;market for sodium nitrate;;e5e39733e93e6d0dd9f39ac6ebfdc76b;kilogram;sodium nitrate;GLO;20110;Manufacture of basic chemicals;34240;"Phosphates of triammonium; salts and peroxysalts of inorganic acids and metals n.e.c.";Chemical;Chemical products
;ei_cutoff_3.9_remind_SSP1-PkBudg500_2050 2025-09-04;market for capacitor, film type, for through-hole mounting;;54f538c893808698cb3a89ae67c76c87;kilogram;capacitor, film type, for through-hole mounting;GLO;26100;Manufacture of electronic components and boards;47110;Electrical capacitors;MachElecTrans;Metal/electronic equipments & parts
;ei_cutoff_3.9_remind_SSP1-PkBudg500_2050 2025-09-04;market for triethylene glycol;;257250402e340a213b2785ad88262aaf;kilogram;triethylene glycol;RoW;20110;Manufacture of basic chemicals;34170;Ethers, alcohol peroxides, ether peroxides, epoxides, acetals and hemiacetals, and their halogenated, sulphona[…];Chemical;Chemical products
;ei_cutoff_3.9_remind_SSP1-PkBudg500_2050 2025-09-04;market for dioctyl adipate;;9864ce2172e511f3ed194ce8a75b9022;kilogram;dioctyl adipate;GLO;20110;Manufacture of basic chemicals;34140;Carboxylic acids and their anhydrides, halides, peroxides and peroxyacids and their halogenated, sulphonated, […];Chemical;Chemical products
;ei_cutoff_3.9_remind_SSP1-PkBudg500_2050 2025-09-04;market for anode slime from electrorefining of copper, anode;;6e7076c9b4d3775468047d1bee36d4b3;kilogram;anode slime from electrorefining of copper, anode;GLO;24200;Manufacture of basic precious and other non-ferrous metals;40000;Metal products, machinery and equipment;MetalAlloy;Basic metals & alloys, their semi-finished products
;ei_cutoff_3.9_remind_SSP1-PkBudg500_2050 2025-09-04;market for retention aid, for paper production;;06cef0e50c8d3a495db73945c9a683bb;kilogram;retention aid, for paper production;RoW;20110;Manufacture of basic chemicals;34000;Basic chemicals;Chemical;Chemical products
;ei_cutoff_3.9_remind_SSP1-PkBudg500_2050 2025-09-04;market for tilapia feed, 24-28% protein;;fb3e1542af3742d3c552922bc5243917;kilogram;tilapia feed, 24-28% protein;GLO;10800;Manufacture of prepared animal feeds;23310;Preparations used in animal feeding;ProcBio;Food & beverages, animal feed
;ei_cutoff_3.9_remind_SSP1-PkBudg500_2050 2025-09-04;market for lithium;;66426d32b54bb1c84aa437f9dedf7d23;kilogram;lithium;GLO;20110;Manufacture of basic chemicals;34231;"Chemical elements n.e.c.; inorganic acids except phosphoric, nitric and sulphonitric; inorganic oxygen compoun[…]";Chemical;Chemical products
;ei_cutoff_3.9_remind_SSP1-PkBudg500_2050 2025-09-04;market for metolachlor;;c15ae9d816cf6db461c9a87e7ca7a47f;kilogram;metolachlor;GLO;20210;Manufacture of pesticides and other agrochemical products;34663;Herbicides, anti-sprouting products and plant-growth regulators;Chemical;Chemical products
;ei_cutoff_3.9_remind_SSP1-PkBudg500_2050 2025-09-04;market for lightweight concrete block, expanded clay;;6c4431bcd798012add1f8a3d6b6cbf2b;kilogram;lightweight concrete block, expanded clay;RoW;23990;Manufacture of other non-metallic mineral products n.e.c.;37900;Other non-metallic mineral products n.e.c.;GlasNonMetal;Glass & other non-metallic products
;ei_cutoff_3.9_remind_SSP1-PkBudg500_2050 2025-09-04;market for phenyl acetic acid;;5dc11bfa4bf1247f83847e5dae499c87;kilogram;phenyl acetic acid;GLO;20110;Manufacture of basic chemicals;34140;Carboxylic acids and their anhydrides, halides, peroxides and peroxyacids and their halogenated, sulphonated, […];Chemical;Chemical products
;ei_cutoff_3.9_remind_SSP1-PkBudg500_2050 2025-09-04;market for nylon 6-6;;a29e9b49ad04ac016ff07431b2f842ae;kilogram;nylon 6-6;RoW;20130;Manufacture of plastics and synthetic rubber in primary forms;34700;Plastics in primary forms;PlastRub;Plastics & rubber products
;ei_cutoff_3.9_remind_SSP1-PkBudg500_2050 2025-09-04;market for ethanol, without water, in 99.7% solution state, from fermentation;;4644b33e432d216ad9539c04cb879a11;kilogram;ethanol, without water, in 99.7% solution state, from fermentation;GLO;20110;Manufacture of basic chemicals;35491;Biodiesel;Chemical;Chemical products
;ei_cutoff_3.9_remind_SSP1-PkBudg500_2050 2025-09-04;market for tetrafluoroethylene;;241dbdff1d770af53dc3727e431c7d5e;kilogram;tetrafluoroethylene;GLO;20130;Manufacture of plastics and synthetic rubber in primary forms;34730;Polymers of vinyl chloride or other halogenated olefins, in primary forms;PlastRub;Plastics & rubber products
;ei_cutoff_3.9_remind_SSP1-PkBudg500_2050 2025-09-04;market for dichloropropene;;73cf15ee2cdadaa9a07c6840c1765570;kilogram;dichloropropene;GLO;20110;Manufacture of basic chemicals;34100;Basic organic chemicals;Chemical;Chemical products
;ei_cutoff_3.9_remind_SSP1-PkBudg500_2050 2025-09-04;market for chlormequat chloride;;618b557dec53b00ba78e0c2cc9e11c2b;kilogram;chlormequat chloride;GLO;20110;Manufacture of basic chemicals;34663;Herbicides, anti-sprouting products and plant-growth regulators;Chemical;Chemical products
;ei_cutoff_3.9_remind_SSP1-PkBudg500_2050 2025-09-04;market for battery, Li-ion, LFP, rechargeable, prismatic;;f22991a7a4e1d7ecfa81cdd7453e83d2;kilogram;battery, Li-ion, LFP, rechargeable, prismatic;GLO;20110;Manufacture of basic chemicals;46410;Primary cells and primary batteries;MachElecTrans;Metal/electronic equipments & parts
;ei_cutoff_3.9_remind_SSP1-PkBudg500_2050 2025-09-04;market for atrazine;;aa4064688a55d2ab6dba34727ba8bb9a;kilogram;atrazine;GLO;20210;Manufacture of pesticides and other agrochemical products;34663;Herbicides, anti-sprouting products and plant-growth regulators;Chemical;Chemical products
;ei_cutoff_3.9_remind_SSP1-PkBudg500_2050 2025-09-04;market for chemi-thermomechanical pulp;;b407d4e67d75198d37b65d50ecba0349;kilogram;chemi-thermomechanical pulp;GLO;17010;Manufacture of pulp, paper and paperboard;32100;Pulp, paper and paperboard;ProcBio;Pulp & paper
;ei_cutoff_3.9_remind_SSP1-PkBudg500_2050 2025-09-04;market for non-ionic surfactant;;1c9c3b06f03a9bf7db52b080f3fe8e25;kilogram;non-ionic surfactant;GLO;20230;Manufacture of soap and detergents, cleaning and polishing preparations, pe;35310;Organic surface active agents, except soap;Chemical;Chemical products
;ei_cutoff_3.9_remind_SSP1-PkBudg500_2050 2025-09-04;market for citric acid;;db6db4cff0259b6f843098f57ea18be0;kilogram;citric acid;GLO;20110;Manufacture of basic chemicals;34140;Carboxylic acids and their anhydrides, halides, peroxides and peroxyacids and their halogenated, sulphonated, […];Chemical;Chemical products
;ei_cutoff_3.9_remind_SSP1-PkBudg500_2050 2025-09-04;market for cellulose fibre;;fccf40a4114750cb83ec1111105bb80f;kilogram;cellulose fibre;RoW;17090;Manufacture of other articles of paper and paperboard;32113;"Mechanical wood pulp; semi-chemical wood pulp; pulps of fibrous cellulosic material other than wood";ProcBio;Pulp & paper
;ei_cutoff_3.9_remind_SSP1-PkBudg500_2050 2025-09-04;market for anode, graphite, for Li-ion battery;;f598011ad327f7382fcad4b120caeb36;kilogram;anode, graphite, for Li-ion battery;RoW;27200;Manufacture of batteries and accumulators;46950;Carbon electrodes, carbon brushes, lamp carbons, battery carbons and other articles of graphite or other carbo[…];MachElecTrans;Metal/electronic equipments & parts
;ei_cutoff_3.9_remind_SSP1-PkBudg500_2050 2025-09-04;market for cadmium;;e792832186cc7dd78939132f03d8d615;kilogram;cadmium;GLO;24200;Manufacture of basic precious and other non-ferrous metals;34200;Basic inorganic chemicals n.e.c.;Chemical;Chemical products
;ei_cutoff_3.9_remind_SSP1-PkBudg500_2050 2025-09-04;market for stearic acid;;dbbf167ae70acbeea514d5f26c351b87;kilogram;stearic acid;GLO;20110;Manufacture of basic chemicals;34140;Carboxylic acids and their anhydrides, halides, peroxides and peroxyacids and their halogenated, sulphonated, […];Chemical;Chemical products
;ei_cutoff_3.9_remind_SSP1-PkBudg500_2050 2025-09-04;market for bitumen seal, Alu80;;47e73c27032b5ae3ca32f76a90a262bc;kilogram;bitumen seal, Alu80;GLO;23990;Manufacture of other non-metallic mineral products n.e.c.;37940;Bituminous mixtures based on natural and artificial stone materials and bitumen, natural asphalt or related su[…];GlasNonMetal;Glass & other non-metallic products
;ei_cutoff_3.9_remind_SSP1-PkBudg500_2050 2025-09-04;market for propionic acid;;9ac653e7afabf2c2bb6026f22f7edc8d;kilogram;propionic acid;GLO;20110;Manufacture of basic chemicals;34120;"Industrial monocarboxylic fatty acids; acid oils from refining";Chemical;Chemical products
;ei_cutoff_3.9_remind_SSP1-PkBudg500_2050 2025-09-04;market for textile, kenaf;;14cef19bdae1d765494c60b83267703e;kilogram;textile, kenaf;GLO;13120;Weaving of textiles;26570;Woven fabrics of jute and other textile bast fibres (except flax, true hemp and ramie);ProcBio;Textile
;ei_cutoff_3.9_remind_SSP1-PkBudg500_2050 2025-09-04;market for paraffin;;1d6a7a2564e48f07081b637f6fd3b5d4;kilogram;paraffin;GLO;19200;Manufacture of refined petroleum products;33500;"Petroleum jelly; paraffin wax, micro- crystalline petroleum wax, slack wax, ozokerite, lignite wax, peat wax, […]";OreMinFuel;Ores, minerals & fuels
;ei_cutoff_3.9_remind_SSP1-PkBudg500_2050 2025-09-04;market for anode, silicon coated graphite, for Li-ion battery;;fb1f00e0217d22678f267c677bc98633;kilogram;anode, silicon coated graphite, for Li-ion battery;RoW;27200;Manufacture of batteries and accumulators;46950;Carbon electrodes, carbon brushes, lamp carbons, battery carbons and other articles of graphite or other carbo[…];MachElecTrans;Metal/electronic equipments & parts
;ei_cutoff_3.9_remind_SSP1-PkBudg500_2050 2025-09-04;market for copper collector foil, for Li-ion battery;;c5059c3786878afc19540e313b8a69dc;kilogram;copper collector foil, for Li-ion battery;GLO;27900;Manufacture of other electrical equipment;46430;Parts of primary cells, primary batteries and electric accumulators (including separators);MachElecTrans;Metal/electronic equipments & parts
;ei_cutoff_3.9_remind_SSP1-PkBudg500_2050 2025-09-04;market for butter, from cow milk;;d3c6cf164accab27da5e7696595dd1ae;kilogram;butter, from cow milk;GLO;10500;Manufacture of dairy products;22241;Butter and other fats and oils derived from milk of cattle;ProcBio;Food & beverages, animal feed
;ei_cutoff_3.9_remind_SSP1-PkBudg500_2050 2025-09-04;market for whey;;82bcd67307aa7d775b264e32dd185e3d;kilogram;whey;GLO;10500;Manufacture of dairy products;22130;Whey;ProcBio;Food & beverages, animal feed
;ei_cutoff_3.9_remind_SSP1-PkBudg500_2050 2025-09-04;market for capacitor, electrolyte type, > 2cm height;;8365d8ebdc32cb51795f874fef220c90;kilogram;capacitor, electrolyte type, > 2cm height;GLO;26100;Manufacture of electronic components and boards;47110;Electrical capacitors;MachElecTrans;Metal/electronic equipments & parts
;ei_cutoff_3.9_remind_SSP1-PkBudg500_2050 2025-09-04;market for ammonium thiocyanate;;19491c1e22a309caedebc2cf3bd5f053;kilogram;ammonium thiocyanate;GLO;20110;Manufacture of basic chemicals;34270;"Cyanides, cyanide oxides and complex cyanides; fulminates, cyanates and thiocyanates; silicates; borates; perb[…]";Chemical;Chemical products
;ei_cutoff_3.9_remind_SSP1-PkBudg500_2050 2025-09-04;market for solder, paste, Sn95.5Ag3.9Cu0.6, for electronics industry;;af8a701caab7340a6cc03989a1148924;kilogram;solder, paste, Sn95.5Ag3.9Cu0.6, for electronics industry;GLO;20290;Manufacture of other chemical products n.e.c.;42950;Wire, rods, tubes, plates, electrodes and similar products, of base metal or of metal carbides, coated or core[…];ProcBio;Food & beverages, animal feed
;ei_cutoff_3.9_remind_SSP1-PkBudg500_2050 2025-09-04;market for helium, crude stockpiling;;a4531fb9d1ff97ceb529addd3bc8f6f7;kilogram;helium, crude stockpiling;GLO;20110;Manufacture of basic chemicals;34231;"Chemical elements n.e.c.; inorganic acids except phosphoric, nitric and sulphonitric; inorganic oxygen compoun[…]";Chemical;Chemical products
;ei_cutoff_3.9_remind_SSP1-PkBudg500_2050 2025-09-04;market for aluminium fluoride;;680c75ffbba966f1344cc492eb3bd8ca;kilogram;aluminium fluoride;GLO;20110;Manufacture of basic chemicals;34240;"Phosphates of triammonium; salts and peroxysalts of inorganic acids and metals n.e.c.";Chemical;Chemical products
;ei_cutoff_3.9_remind_SSP1-PkBudg500_2050 2025-09-04;market for sawnwood, softwood, raw, dried (u=10%);;3a6ef130f69301451623f07c681afe8c;cubic meter;sawnwood, softwood, raw, dried (u=10%);RoW;16100;Sawmilling and planing of wood;31101;Wood, sawn or chipped lengthwise, sliced or peeled, of a thickness exceeding 6 mm, of coniferous wood;ProcBio;Wood, straw & cork
;ei_cutoff_3.9_remind_SSP1-PkBudg500_2050 2025-09-04;market for lithium iron phosphate;;dc24aacb81956b23d97cf04fae5f19dc;kilogram;lithium iron phosphate;RoW;20110;Manufacture of basic chemicals;34240;"Phosphates of triammonium; salts and peroxysalts of inorganic acids and metals n.e.c.";Chemical;Chemical products
;ei_cutoff_3.9_remind_SSP1-PkBudg500_2050 2025-09-04;market for electrode, negative, Ni;;6a447e19f2814b98f974c2c5aebfaa10;kilogram;electrode, negative, Ni;GLO;27200;Manufacture of batteries and accumulators;46430;Parts of primary cells, primary batteries and electric accumulators (including separators);MachElecTrans;Metal/electronic equipments & parts
;ei_cutoff_3.9_remind_SSP1-PkBudg500_2050 2025-09-04;market for pumice;;62ef173cba81e1972e31e39b0afba433;kilogram;pumice;GLO;8100;Quarrying of stone, sand and clay;16320;"Industrial diamonds, unworked or simply sawn, cleaved or bruted; pumice stone; emery; natural corundum, natura[…]";OreMinFuel;Ores, minerals & fuels
;ei_cutoff_3.9_remind_SSP1-PkBudg500_2050 2025-09-04;market for titanium zinc plate, without pre-weathering;;eb4550e16c6b7cbaae5c8dc6dfae3a2b;kilogram;titanium zinc plate, without pre-weathering;GLO;24200;Manufacture of basic precious and other non-ferrous metals;41000;Basic metals;MetalAlloy;Basic metals & alloys, their semi-finished products
;ei_cutoff_3.9_remind_SSP1-PkBudg500_2050 2025-09-04;market for hydrazine sulfate;;90ac1c25d24832dcdbe1d8fc959e0ed8;kilogram;hydrazine sulfate;GLO;20110;Manufacture of basic chemicals;34231;"Chemical elements n.e.c.; inorganic acids except phosphoric, nitric and sulphonitric; inorganic oxygen compoun[…]";Chemical;Chemical products
;ei_cutoff_3.9_remind_SSP1-PkBudg500_2050 2025-09-04;market for lightweight concrete block, expanded vermiculite;;5bfcf5c41aafd5a0d8c2df1b65755d9c;kilogram;lightweight concrete block, expanded vermiculite;RoW;23990;Manufacture of other non-metallic mineral products n.e.c.;37900;Other non-metallic mineral products n.e.c.;GlasNonMetal;Glass & other non-metallic products
;ei_cutoff_3.9_remind_SSP1-PkBudg500_2050 2025-09-04;market for cement, CEM V/A;;57fe1cebd6be2d1b02727ed2e1997e57;kilogram;cement, CEM V/A;RoW;23940;Manufacture of cement, lime and plaster;37440;Portland cement, aluminous cement, slag cement and similar hydraulic cements, except in the form of clinkers;GlasNonMetal;Glass & other non-metallic products
;ei_cutoff_3.9_remind_SSP1-PkBudg500_2050 2025-09-04;market for cyclohexane;;f25b4ed397e8a0de8630025f4c4ae927;kilogram;cyclohexane;GLO;20110;Manufacture of basic chemicals;34110;Hydrocarbons and their halogenated, sulphonated, nitrated or nitrosated derivatives;Chemical;Chemical products
;ei_cutoff_3.9_remind_SSP1-PkBudg500_2050 2025-09-04;market for wheat grain, organic;;223f6be222ab4d6aec8ac4ea00f2d1b7;kilogram;wheat grain, organic;GLO;1110;Growing of cereals (except rice), leguminous crops and oil seeds;1112;Wheat, other;AgriForeAnim;Agricultural & forestry products
;ei_cutoff_3.9_remind_SSP1-PkBudg500_2050 2025-09-04;market for coconut, dehusked;;e41066820ea7f396130d0a4f061352eb;kilogram;coconut, dehusked;GLO;1260;Growing of oleaginous fruits;21429;Other shelled nuts;ProcBio;Food & beverages, animal feed
;ei_cutoff_3.9_remind_SSP1-PkBudg500_2050 2025-09-04;market for maize grain, organic;;4ccc5f6d91c28ea32355fdbd29bac2da;kilogram;maize grain, organic;GLO;1110;Growing of cereals (except rice), leguminous crops and oil seeds;1122;Maize (corn), other;AgriForeAnim;Agricultural & forestry products
;ei_cutoff_3.9_remind_SSP1-PkBudg500_2050 2025-09-04;market for ferrite;;f10bd33eb6618cb469ca7eb46bbfc490;kilogram;ferrite;GLO;23930;Manufacture of other porcelain and ceramic products;41110;Primary materials of the iron and steel industry;MetalAlloy;Basic metals & alloys, their semi-finished products
;ei_cutoff_3.9_remind_SSP1-PkBudg500_2050 2025-09-04;market for maleic unsaturated polyester resin;;253c2a33c1fc5a2548ed3a1e32aa9a8c;kilogram;maleic unsaturated polyester resin;GLO;20130;Manufacture of plastics and synthetic rubber in primary forms;34740;"Polyacetals, other polyethers and epoxide resins, in primary forms; polycarbonates, alkyd resins, polyallyl es[…]";PlastRub;Plastics & rubber products
;ei_cutoff_3.9_remind_SSP1-PkBudg500_2050 2025-09-04;market for tubular particleboard;;f43a560fc8a59cd824517f85afc6655e;cubic meter;tubular particleboard;RoW;16210;Manufacture of veneer sheets and wood-based panels;31431;Particle board;ProcBio;Wood, straw & cork
;ei_cutoff_3.9_remind_SSP1-PkBudg500_2050 2025-09-04;market for sawlog and veneer log, meranti, measured as solid wood under bark;;6a75c2e5815af212589613fca0468c2b;cubic meter;sawlog and veneer log, meranti, measured as solid wood under bark;RoW;2200;Logging;3100;Wood in the rough;AgriForeAnim;Agricultural & forestry products
;ei_cutoff_3.9_remind_SSP1-PkBudg500_2050 2025-09-04;market for protein pea, organic;;23cd14ef7f57ad273d649977124985aa;kilogram;protein pea, organic;GLO;1110;Growing of cereals (except rice), leguminous crops and oil seeds;1240;Green leguminous vegetables;AgriForeAnim;Agricultural & forestry products
;ei_cutoff_3.9_remind_SSP1-PkBudg500_2050 2025-09-04;market for para-phenylene diamine;;574c4a367f0fd183345b478a529e20e6;kilogram;para-phenylene diamine;GLO;20110;Manufacture of basic chemicals;34150;"Amine-function compounds; oxygen-function amino-compounds, except lysine and its esters and salts thereof and […]";Chemical;Chemical products
;ei_cutoff_3.9_remind_SSP1-PkBudg500_2050 2025-09-04;market for 1-pentanol;;13705a7a97897a11dd78a92c87903fc8;kilogram;1-pentanol;GLO;20110;Manufacture of basic chemicals;34139;Other alcohols, phenols, phenol-alcohols, and their halogenated, sulphonated, nitrated or nitrosated derivativ[…];Chemical;Chemical products
;ei_cutoff_3.9_remind_SSP1-PkBudg500_2050 2025-09-04;market for steel, chromium steel 18/8;;d80aeb87159841df80a3e27993c63d5d;kilogram;steel, chromium steel 18/8;World;24100;Manufacture of basic iron and steel;41122;Alloy steel in ingots or other primary forms and semi-finished products of alloy steel;MetalAlloy;Basic metals & alloys, their semi-finished products
;ei_cutoff_3.9_remind_SSP1-PkBudg500_2050 2025-09-04;market for 1-butanol;;20624759f7a188d885855b620a3ec399;kilogram;1-butanol;GLO;20110;Manufacture of basic chemicals;34139;Other alcohols, phenols, phenol-alcohols, and their halogenated, sulphonated, nitrated or nitrosated derivativ[…];Chemical;Chemical products
;ei_cutoff_3.9_remind_SSP1-PkBudg500_2050 2025-09-04;market for nitrile-compound;;77efbd2113e3c5c9945e7a4a5518cc8b;kilogram;nitrile-compound;GLO;20210;Manufacture of pesticides and other agrochemical products;34660;Insecticides, fungicides, herbicides and disinfectants;Chemical;Chemical products
;ei_cutoff_3.9_remind_SSP1-PkBudg500_2050 2025-09-04;market for anhydrite, burned;;bcdc073df248f8e2056607c2d2b53b53;kilogram;anhydrite, burned;GLO;23940;Manufacture of cement, lime and plaster;15200;"Gypsum; anhydrite; limestone flux; limestone and other calcareous stone, of a kind used for the manufacture of[…]";OreMinFuel;Ores, minerals & fuels
