"33100: Coke and semi-coke of coal, of lignite or of peat; retort carbon";hard coal/fuels;1910:Manufacture of coke oven products;402b722aa4a63d94ac64b2ea9e9e1054;ecoinvent-3.9.1-cutoff;GLO;coke;market for coke;coke;megajoule
"4160: Other non-ferrous metals and articles thereof (including waste and scrap of some metals); cermets and articles […]";metals/extraction;2420:Manufacture of basic precious and other non-ferrous metals;0edf3a3e46a7b5860372df55f7c99872;ecoinvent-3.9.1-cutoff;GLO;palladium;market for palladium;palladium;kilogram
16190: Other chemical minerals;chemicals/inorganics;0891:Mining of chemical and fertilizer minerals;de03d27ded836711c700f636845168d5;ecoinvent-3.9.1-cutoff;GLO;borates;market for sodium borates;sodium borates;kilogram
12020: Natural gas, liquefied or in the gaseous state;;"3520:Manufacture of gas; distribution of gaseous fuels through mains";906119ef526cfb1c3d88757f685884e2;ecoinvent-3.9.1-cutoff;DZ;natural gas;market for natural gas, high pressure;natural gas, high pressure;cubic meter
41601: Tungsten, molybdenum, tantalum, magnesium, cobalt, cadmium, titanium, zirconium, beryllium, gallium, hafnium, […];metals/extraction;2420:Manufacture of basic precious and other non-ferrous metals;b58e366aa745755d69e7aeb815267fbe;ecoinvent-3.9.1-cutoff;GLO;indium;market for indium rich leaching residues, from zinc production stockpiling;indium rich leaching residues, from zinc production stockpiling;kilogram
69120: Gas distribution through mains (on own account);;"3520:Manufacture of gas; distribution of gaseous fuels through mains";d314b1e29068be2ad3e1618ab5d43077;ecoinvent-3.9.1-cutoff;FR;natural gas;market for natural gas, low pressure;natural gas, low pressure;cubic meter
88731: Metal treatment and coating services;metals/processing;"2592:Treatment and coating of metals; machining";db9e5e06dd00495440b2c5eea65b1deb;ecoinvent-3.9.1-cutoff;GLO;tin;market for tin plating, pieces;tin plating, pieces;square meter
4153: Semi-finished products of aluminium or aluminium alloys;metals/processing;2599:Manufacture of other fabricated metal products n.e.c.;c7ea2533db5d06aca18994542525b8ae;ecoinvent-3.9.1-cutoff;GLO;aluminium;market for aluminium around steel bi-metal wire, 3.67mm external diameter;aluminium around steel bi-metal wire, 3.67mm external diameter;meter
"34231: Chemical elements n.e.c.; inorganic acids except phosphoric, nitric and sulphonitric; inorganic oxygen compoun[…]";chemicals/inorganics;2011:Manufacture of basic chemicals;7cca70f33622d6e8d71523a339f7e104;ecoinvent-3.9.1-cutoff;GLO;aluminium;market for aluminium hydroxide;aluminium hydroxide;kilogram
37440: Portland cement, aluminous cement, slag cement and similar hydraulic cements, except in the form of clinkers;;2394:Manufacture of cement, lime and plaster;d4d1029b141ebc5c9064bf196a373e52;ecoinvent-3.9.1-cutoff;BR;cement;market for cement, CP IV;cement, CP IV;kilogram
37440: Portland cement, aluminous cement, slag cement and similar hydraulic cements, except in the form of clinkers;;2394:Manufacture of cement, lime and plaster;f4d6160152a3d70eab69549bad7b8a1e;ecoinvent-3.9.1-cutoff;Europe without Switzerland;cement;market for cement, CEM V/B;cement, CEM V/B;kilogram
41601: Tungsten, molybdenum, tantalum, magnesium, cobalt, cadmium, titanium, zirconium, beryllium, gallium, hafnium, […];;2420:Manufacture of basic precious and other non-ferrous metals;a95e73c5622370cce548444988aa3b8c;ecoinvent-3.9.1-cutoff;US;magnesium;market for magnesium, for reuse in zirconium sponge production;magnesium, for reuse in zirconium sponge production;kilogram
37440: Portland cement, aluminous cement, slag cement and similar hydraulic cements, except in the form of clinkers;;2394:Manufacture of cement, lime and plaster;1b173c0e61fb3897e735bf28562b714c;ecoinvent-3.9.1-cutoff;Europe without Switzerland;cement;market for cement, CEM III/B;cement, CEM III/B;kilogram
41320: Gold (including gold plated with platinum), unwrought or in semi-manufactured forms, or in powder form;metals/extraction;2420:Manufacture of basic precious and other non-ferrous metals;e06eed9912af66347d920075212adc8c;ecoinvent-3.9.1-cutoff;GLO;gold;market for gold-silver, ingot;gold-silver, ingot;kilogram
12020: Natural gas, liquefied or in the gaseous state;;"3520:Manufacture of gas; distribution of gaseous fuels through mains";8bbfb16c26702eeb206094df6b7d01fc;ecoinvent-3.9.1-cutoff;CO;natural gas;market for natural gas, high pressure;natural gas, high pressure;cubic meter
41601: Tungsten, molybdenum, tantalum, magnesium, cobalt, cadmium, titanium, zirconium, beryllium, gallium, hafnium, […];;2420:Manufacture of basic precious and other non-ferrous metals;fc220c73a8fd0b18427b8906c0583178;ecoinvent-3.9.1-cutoff;GLO;hafnium;market for hafnium sponge;hafnium sponge;kilogram
39364: Waste and scrap of lead;waste management/residual material landfill;3822:Treatment and disposal of hazardous waste;467e2807c618b1740f07d06dd20282dc;ecoinvent-3.9.1-cutoff;GLO;lead;market for lead smelter slag;lead smelter slag;kilogram
37440: Portland cement, aluminous cement, slag cement and similar hydraulic cements, except in the form of clinkers;;2394:Manufacture of cement, lime and plaster;92af6228440f2e5259ea92e7e1ddf1e2;ecoinvent-3.9.1-cutoff;BR;cement;market for cement, CP II-E;cement, CP II-E;kilogram
41: Basic metals;metals/extraction;2420:Manufacture of basic precious and other non-ferrous metals;eb4550e16c6b7cbaae5c8dc6dfae3a2b;ecoinvent-3.9.1-cutoff;GLO;titanium;market for titanium zinc plate, without pre-weathering;titanium zinc plate, without pre-weathering;kilogram
342: Basic inorganic chemicals n.e.c.;chemicals/inorganics;2011:Manufacture of basic chemicals;d971937192fae29417d670b40a21f603;ecoinvent-3.9.1-cutoff;GLO;lithium;market for lithium hexafluorophosphate;lithium hexafluorophosphate;kilogram
37440: Portland cement, aluminous cement, slag cement and similar hydraulic cements, except in the form of clinkers;;2394:Manufacture of cement, lime and plaster;95bf4801f2dfa177f66277b395f27677;ecoinvent-3.9.1-cutoff;PE;cement;market for cement, type IP;cement, type IP;kilogram
15310: Natural sands;construction materials/others;0810:Quarrying of stone, sand and clay;07825e16eaf1c4bbcf13bc56420aee28;ecoinvent-3.9.1-cutoff;IN;sand;market for sand;sand;kilogram
"33620: Uranium enriched in U235 and its compounds; plutonium and its compounds; alloys, dispersions, ceramic products[…]";nuclear power/production;2011:Manufacture of basic chemicals;140a3121847f8490119337cfc2da6e3b;ecoinvent-3.9.1-cutoff;GLO;uranium;market for uranium, enriched 4.2%, in fuel element for light water reactor;uranium, enriched 4.2%, in fuel element for light water reactor;kilogram
39310: Slag, dross, scalings and other waste from the manufacture of iron or steel;metals/chipping;"2592:Treatment and coating of metals; machining";389830f86cc0e0c2333167bdb9c57037;ecoinvent-3.9.1-cutoff;GLO;chromium;market for chromium steel removed by drilling, conventional;chromium steel removed by drilling, conventional;kilogram
53269: Other constructions for manufacturing;metals/extraction;4100:Construction of buildings;e8d657e5131f6518ec076ed4462eaf83;ecoinvent-3.9.1-cutoff;GLO;magnesium;market for magnesium factory;magnesium factory;unit
37440: Portland cement, aluminous cement, slag cement and similar hydraulic cements, except in the form of clinkers;;2394:Manufacture of cement, lime and plaster;b613a0b81feac8d2681dbae87afaf18f;ecoinvent-3.9.1-cutoff;US;cement;market for cement, type I-PM;cement, type I-PM;kilogram
53269: Other constructions for manufacturing;metals/extraction;4100:Construction of buildings;dc74cf748d0a8cfb8a76429444d0fd6b;ecoinvent-3.9.1-cutoff;GLO;aluminium;market for aluminium casting facility;aluminium casting facility;unit
374: Plaster, lime and cement;;2394:Manufacture of cement, lime and plaster;d64be106f6801c2c9d6a94bed1e4f893;ecoinvent-3.9.1-cutoff;ZA;cement;market for cement, unspecified;cement, unspecified;kilogram
39361: Waste and scrap of copper;;3821:Treatment and disposal of non-hazardous waste;4a8d0a80fc332ab236715697202dd052;ecoinvent-3.9.1-cutoff;CH;copper;market for copper in car shredder residue;copper in car shredder residue;kilogram
41431: Unwrought aluminium;metals/extraction;2420:Manufacture of basic precious and other non-ferrous metals;11a252f4506e7a68b98e220ee64ffeea;ecoinvent-3.9.1-cutoff;RoW;aluminium;market for aluminium, primary, ingot;aluminium, primary, ingot;kilogram
37440: Portland cement, aluminous cement, slag cement and similar hydraulic cements, except in the form of clinkers;;2394:Manufacture of cement, lime and plaster;d0db6dde11f015e6ef67fa0bd6394adc;ecoinvent-3.9.1-cutoff;US;cement;market for cement, type IS;cement, type IS;kilogram
"41603: Bismuth, antimony, manganese, chromium and articles thereof; including waste and scrap of bismuth or manganese";metals/extraction;2420:Manufacture of basic precious and other non-ferrous metals;3de11ec49c2a8ff3ec0008303b75d475;ecoinvent-3.9.1-cutoff;GLO;chromium;market for chromium;chromium;kilogram
342: Basic inorganic chemicals n.e.c.;metals/refinement;2011:Manufacture of basic chemicals;e44d6f6a676cdfff45f5b9eece638152;ecoinvent-3.9.1-cutoff;GLO;silicon;market for silicon, electronics grade;silicon, electronics grade;kilogram
39364: Waste and scrap of lead;waste management/municipal incineration;3821:Treatment and disposal of non-hazardous waste;7ba3db3ab4d071cfd4ba6a9e83c0741e;ecoinvent-3.9.1-cutoff;RoW;lead;market for lead in car shredder residue;lead in car shredder residue;kilogram
12020: Natural gas, liquefied or in the gaseous state;;"3520:Manufacture of gas; distribution of gaseous fuels through mains";e88d630d212aae3e62d77689310ee8de;ecoinvent-3.9.1-cutoff;SK;natural gas;market for natural gas, high pressure;natural gas, high pressure;cubic meter
"34231: Chemical elements n.e.c.; inorganic acids except phosphoric, nitric and sulphonitric; inorganic oxygen compoun[…]";chemicals/inorganics;2011:Manufacture of basic chemicals;612a9183c7bac2685fb87a699974c8aa;ecoinvent-3.9.1-cutoff;GLO;helium;market for helium;helium;kilogram
342: Basic inorganic chemicals n.e.c.;chemicals/inorganics;2011:Manufacture of basic chemicals;d8df5bd8a8623ef92ee10dd07f6ee7de;ecoinvent-3.9.1-cutoff;GLO;graphite;market for graphite, battery grade;graphite, battery grade;kilogram
41431: Unwrought aluminium;;2420:Manufacture of basic precious and other non-ferrous metals;fe46c28da468b81defdd4f4d50915a9e;ecoinvent-3.9.1-cutoff;GLO;aluminium;market for aluminium, cast alloy;aluminium, cast alloy;kilogram
39365: Waste and scrap of zinc;metals/processing;"2592:Treatment and coating of metals; machining";2769f7d71e25d8e7204236366a55486e;ecoinvent-3.9.1-cutoff;GLO;zinc;market for zinc coat, pieces;zinc coat, pieces;square meter
41441: Lead, unwrought;metals/extraction;2420:Manufacture of basic precious and other non-ferrous metals;084a22cf5bd15c0027be52d0202101b5;ecoinvent-3.9.1-cutoff;GLO;lead;market for lead concentrate stockpiling;lead concentrate stockpiling;kilogram
69120: Gas distribution through mains (on own account);;"3520:Manufacture of gas; distribution of gaseous fuels through mains";63c1ac90c04ce17ee2378c39a2ce6849;ecoinvent-3.9.1-cutoff;RoW;natural gas;market for natural gas, low pressure;natural gas, low pressure;cubic meter
37440: Portland cement, aluminous cement, slag cement and similar hydraulic cements, except in the form of clinkers;;2394:Manufacture of cement, lime and plaster;4515b897230bf5a672ab547a9b655c41;ecoinvent-3.9.1-cutoff;RoW;cement;market for cement, Portland;cement, Portland;kilogram
39310: Slag, dross, scalings and other waste from the manufacture of iron or steel;metals/chipping;"2592:Treatment and coating of metals; machining";847212a1dbb1ee03105e30f1061799a6;ecoinvent-3.9.1-cutoff;GLO;chromium;market for chromium steel removed by milling, average;chromium steel removed by milling, average;kilogram
37440: Portland cement, aluminous cement, slag cement and similar hydraulic cements, except in the form of clinkers;;2394:Manufacture of cement, lime and plaster;3eca85ab277c4e62088f3b25d881c6a2;ecoinvent-3.9.1-cutoff;CH;cement;market for cement, Portland;cement, Portland;kilogram
14290: Other non-ferrous metal ores and concentrates (other than uranium or thorium ores and concentrates);metals/extraction;0729:Mining of other non-ferrous metal ores;e76a52ecf45f7c635de6b7f78afbe562;ecoinvent-3.9.1-cutoff;GLO;copper;market for copper concentrate, sulfide ore;copper concentrate, sulfide ore;kilogram
34290: Compounds of rare earth metals, of yttrium or of scandium;;0729:Mining of other non-ferrous metal ores;975770f48967d9f9ea82f1ac4648f7c5;ecoinvent-3.9.1-cutoff;GLO;dysprosium;market for dysprosium oxide;dysprosium oxide;kilogram
53262: Power plants;hard coal/power plants;4220:Construction of utility projects;4e17793f5a3e79c60591d0374da2611a;ecoinvent-3.9.1-cutoff;GLO;coal(black);market for hard coal power plant;hard coal power plant;unit
342: Basic inorganic chemicals n.e.c.;;2011:Manufacture of basic chemicals;cec024864618ea49a63f58f855feedb4;ecoinvent-3.9.1-cutoff;DE;silicon;market for silicon tetrachloride;silicon tetrachloride;kilogram
12010: Petroleum oils and oils obtained from bituminous minerals, crude;;4661:Wholesale of solid, liquid and gaseous fuels and related products;ffa4308820ee99e0ed078d95d529d837;ecoinvent-3.9.1-cutoff;Europe without Switzerland;petroleum;market for petroleum;petroleum;kilogram
"41413: Refined copper and copper alloys, unwrought; master alloys of copper";metals/extraction;2420:Manufacture of basic precious and other non-ferrous metals;8b62f30ed586a5f23611ef196cc97b93;ecoinvent-3.9.1-cutoff;GLO;copper;market for copper, cathode;copper, cathode;kilogram
"34220: Zinc oxide; zinc peroxide; chromium oxides and hydroxides; manganese oxides; iron oxides and hydroxides; earth[…]";chemicals/inorganics;2011:Manufacture of basic chemicals;055f5a895f60a9d0bd0bb5d0b487ba28;ecoinvent-3.9.1-cutoff;GLO;chromium;market for chromium oxide, flakes;chromium oxide, flakes;kilogram
342: Basic inorganic chemicals n.e.c.;metals/extraction;2420:Manufacture of basic precious and other non-ferrous metals;e792832186cc7dd78939132f03d8d615;ecoinvent-3.9.1-cutoff;GLO;cadmium;market for cadmium;cadmium;kilogram
39363: Waste and scrap of aluminium;;3830:Materials recovery;902e279c853fa30e5448ae7946eacf9c;ecoinvent-3.9.1-cutoff;CH;aluminium;market for aluminium, in mixed metal scrap;aluminium, in mixed metal scrap;kilogram
37440: Portland cement, aluminous cement, slag cement and similar hydraulic cements, except in the form of clinkers;;2394:Manufacture of cement, lime and plaster;72a8bbdbee50f329b7ba642f429722ba;ecoinvent-3.9.1-cutoff;CH;cement;market for cement, CEM IV/A;cement, CEM IV/A;kilogram
37440: Portland cement, aluminous cement, slag cement and similar hydraulic cements, except in the form of clinkers;;2394:Manufacture of cement, lime and plaster;291bdf73544cc33171ae7fca0da8fbd7;ecoinvent-3.9.1-cutoff;BR;cement;market for cement, Portland;cement, Portland;kilogram
12020: Natural gas, liquefied or in the gaseous state;oil/production;0610:Extraction of crude petroleum;f36892589470efa9b2e856c9e41a6fd7;ecoinvent-3.9.1-cutoff;GLO;natural gas;market for natural gas, vented;natural gas, vented;cubic meter
41601: Tungsten, molybdenum, tantalum, magnesium, cobalt, cadmium, titanium, zirconium, beryllium, gallium, hafnium, […];metals/extraction;2420:Manufacture of basic precious and other non-ferrous metals;8e596b319aaf5c68cea00d74bd18d908;ecoinvent-3.9.1-cutoff;GLO;magnesium;market for magnesium-alloy, AZ91;magnesium-alloy, AZ91;kilogram
4128: Tubes, pipes and hollow profiles, of steel;;2410:Manufacture of basic iron and steel;875d6b7361b90d6f1bdaf781c51d3ac6;ecoinvent-3.9.1-cutoff;GLO;chromium;market for chromium steel pipe;chromium steel pipe;kilogram
11010: Hard coal;hard coal/fuels;0510:Mining of hard coal;c336c9036ef5990c91dc9ba8215a7017;ecoinvent-3.9.1-cutoff;RU;coal(black);market for hard coal;hard coal;kilogram
14220: Nickel ores and concentrates;metals/extraction;2420:Manufacture of basic precious and other non-ferrous metals;20d3342cb434fbdc7be4f54ee6148dc5;ecoinvent-3.9.1-cutoff;GLO;nickel;market for nickel concentrate, 16% Ni;nickel concentrate, 16% Ni;kilogram
39363: Waste and scrap of aluminium;metals/chipping;"2592:Treatment and coating of metals; machining";1ce941ebffd0f8a255bfdf419e79d230;ecoinvent-3.9.1-cutoff;GLO;aluminium;market for aluminium removed by milling, large parts;aluminium removed by milling, large parts;kilogram
41330: Platinum, unwrought or in semi-manufactured forms, or in powder form;;2420:Manufacture of basic precious and other non-ferrous metals;90aa1cf7ab6b25320d33a20c3150da18;ecoinvent-3.9.1-cutoff;GLO;platinum;market for platinum;platinum;kilogram
4133: Platinum, unwrought or in semi-manufactured forms, or in powder form;metals/extraction;0729:Mining of other non-ferrous metal ores;8a602aa2a9a1d98898748d90d172fcda;ecoinvent-3.9.1-cutoff;ZA;platinum;market for platinum group metal concentrate;platinum group metal concentrate;kilogram
39310: Slag, dross, scalings and other waste from the manufacture of iron or steel;metals/chipping;"2592:Treatment and coating of metals; machining";4bbbc8e9d6e314598f886a7968c26b90;ecoinvent-3.9.1-cutoff;GLO;chromium;market for chromium steel removed by milling, large parts;chromium steel removed by milling, large parts;kilogram
37: Glass and glass products and other non-metallic products n.e.c.;mortar and plaster/production;2394:Manufacture of cement, lime and plaster;c6c585a0084b646f19600510cde8dae8;ecoinvent-3.9.1-cutoff;CH;cement;market for cement mortar;cement mortar;kilogram
12020: Natural gas, liquefied or in the gaseous state;;"3520:Manufacture of gas; distribution of gaseous fuels through mains";092939308f558fa5308f5dc1d9f34451;ecoinvent-3.9.1-cutoff;JP;natural gas;market for natural gas, high pressure;natural gas, high pressure;cubic meter
12020: Natural gas, liquefied or in the gaseous state;;"3520:Manufacture of gas; distribution of gaseous fuels through mains";6058937a9068fbcffaf6ad7f5a15e9bc;ecoinvent-3.9.1-cutoff;RoE;natural gas;market for natural gas, high pressure;natural gas, high pressure;cubic meter
"33620: Uranium enriched in U235 and its compounds; plutonium and its compounds; alloys, dispersions, ceramic products[…]";nuclear power/production;2011:Manufacture of basic chemicals;144a8b0d13ced3b2c6974045fa91eaa5;ecoinvent-3.9.1-cutoff;GLO;uranium;market for uranium, enriched 3.0%, per separative work unit;uranium, enriched 3.0%, per separative work unit;unit
374: Plaster, lime and cement;;2394:Manufacture of cement, lime and plaster;1bbba12eca72ea717fd60042ce70ab5e;ecoinvent-3.9.1-cutoff;CH;cement;market for cement, CEM II/A;cement, CEM II/A;kilogram
69120: Gas distribution through mains (on own account);;"3520:Manufacture of gas; distribution of gaseous fuels through mains";e92569a9c76900b1e3f270eeac725bb5;ecoinvent-3.9.1-cutoff;DE;natural gas;market for natural gas, low pressure;natural gas, low pressure;cubic meter
342: Basic inorganic chemicals n.e.c.;;2420:Manufacture of basic precious and other non-ferrous metals;a947a6fbd36a6d46728f905616a73842;ecoinvent-3.9.1-cutoff;GLO;zirconium;market for zirconium tetrachloride;zirconium tetrachloride;kilogram
37440: Portland cement, aluminous cement, slag cement and similar hydraulic cements, except in the form of clinkers;;2394:Manufacture of cement, lime and plaster;cee987e95f684885de5800c7bec364b5;ecoinvent-3.9.1-cutoff;Europe without Switzerland;cement;market for cement, CEM IV/A;cement, CEM IV/A;kilogram
53269: Other constructions for manufacturing;metals/extraction;4100:Construction of buildings;4ed1eab80cbb6feafc97b38663e17d55;ecoinvent-3.9.1-cutoff;GLO;aluminium;market for aluminium electrolysis facility;aluminium electrolysis facility;unit
12020: Natural gas, liquefied or in the gaseous state;;"3520:Manufacture of gas; distribution of gaseous fuels through mains";af6145a3bdd771885af82434140d1b0e;ecoinvent-3.9.1-cutoff;QA;natural gas;market for natural gas, high pressure;natural gas, high pressure;cubic meter
41432: Alumina (aluminium oxide), except artificial corundum;chemicals/inorganics;2420:Manufacture of basic precious and other non-ferrous metals;1de1557745b5a6c04efe732661089f69;ecoinvent-3.9.1-cutoff;RoW;aluminium;market for aluminium oxide, non-metallurgical;aluminium oxide, non-metallurgical;kilogram
34800: Synthetic rubber and factice derived from oils, and mixtures thereof with natural rubber and similar natural g[…];;2013:Manufacture of plastics and synthetic rubber in primary forms;532362afd52c647cc4b7872b4d5a3fd9;ecoinvent-3.9.1-cutoff;RER;silicon;market for silicone product;silicone product;kilogram
46430: Parts of primary cells, primary batteries and electric accumulators (including separators);;2790:Manufacture of other electrical equipment;1b4804dc622a6983fcefc016372d5a38;ecoinvent-3.9.1-cutoff;GLO;aluminium;market for aluminium collector foil, for Li-ion battery;aluminium collector foil, for Li-ion battery;kilogram
37440: Portland cement, aluminous cement, slag cement and similar hydraulic cements, except in the form of clinkers;;2394:Manufacture of cement, lime and plaster;9b671ec044f9424c65befd65ca0c765c;ecoinvent-3.9.1-cutoff;BR;cement;market for cement, CP V RS;cement, CP V RS;kilogram
"34220: Zinc oxide; zinc peroxide; chromium oxides and hydroxides; manganese oxides; iron oxides and hydroxides; earth[…]";;2011:Manufacture of basic chemicals;94f4e6f35af7a78eaaa5a5b7e9624dbc;ecoinvent-3.9.1-cutoff;GLO;tin;market for tin dioxide;tin dioxide;kilogram
34290: Compounds of rare earth metals, of yttrium or of scandium;;0729:Mining of other non-ferrous metal ores;4ad0d1c39071582c4f0126a465493e35;ecoinvent-3.9.1-cutoff;GLO;holmium;market for holmium oxide;holmium oxide;kilogram
37440: Portland cement, aluminous cement, slag cement and similar hydraulic cements, except in the form of clinkers;;2394:Manufacture of cement, lime and plaster;e4ef1f44399e24c8fa269ccd7fb76ccc;ecoinvent-3.9.1-cutoff;Europe without Switzerland;cement;market for cement, CEM IV/B;cement, CEM IV/B;kilogram
373: Refractory products and structural non-refractory clay products;chemicals/inorganics;2391:Manufacture of refractory products;ecddc793de057b056c38a2a378711ece;ecoinvent-3.9.1-cutoff;GLO;silicon;market for silicon carbide;silicon carbide;kilogram
39366: Waste and scrap of tin;;3830:Materials recovery;e93a21cf06f4b0255746ca686c16d5b6;ecoinvent-3.9.1-cutoff;Europe without Switzerland;tin;market for tinplate scrap, sorted;tinplate scrap, sorted;kilogram
37540: Tiles, flagstones, bricks and similar articles, of cement, concrete or artificial stone;construction materials/concrete;2395:Manufacture of articles of concrete, cement and plaster;02be5225269656c23401a6c824af1cfb;ecoinvent-3.9.1-cutoff;GLO;cement;market for cement cast plaster floor;cement cast plaster floor;kilogram
"33620: Uranium enriched in U235 and its compounds; plutonium and its compounds; alloys, dispersions, ceramic products[…]";nuclear power/production;2011:Manufacture of basic chemicals;5a07b5c0a0c70e0c2725623d538d4aa1;ecoinvent-3.9.1-cutoff;GLO;uranium;market for uranium, enriched 4%, in fuel element for light water reactor;uranium, enriched 4%, in fuel element for light water reactor;kilogram
"34231: Chemical elements n.e.c.; inorganic acids except phosphoric, nitric and sulphonitric; inorganic oxygen compoun[…]";metals/extraction;2011:Manufacture of basic chemicals;66426d32b54bb1c84aa437f9dedf7d23;ecoinvent-3.9.1-cutoff;GLO;lithium;market for lithium;lithium;kilogram
37440: Portland cement, aluminous cement, slag cement and similar hydraulic cements, except in the form of clinkers;;2394:Manufacture of cement, lime and plaster;46cbc3b4656bd1ee37a7f4bac4335c73;ecoinvent-3.9.1-cutoff;CH;cement;market for cement, CEM III/B;cement, CEM III/B;kilogram
37440: Portland cement, aluminous cement, slag cement and similar hydraulic cements, except in the form of clinkers;;2394:Manufacture of cement, lime and plaster;6349a7ad374eb2a24b5a2fafbf08fc2d;ecoinvent-3.9.1-cutoff;RoW;cement;market for cement, CEM V/B;cement, CEM V/B;kilogram
39363: Waste and scrap of aluminium;metals/extraction;2420:Manufacture of basic precious and other non-ferrous metals;f1a65e37d64e0d15c6275f566334e6d2;ecoinvent-3.9.1-cutoff;RoW;aluminium;market for aluminium scrap, new;aluminium scrap, new;kilogram
11030: Brown coal;lignite/production;0520:Mining of lignite;112536ead217cfbb8c7b9b299a37e07c;ecoinvent-3.9.1-cutoff;RER;coal(brown);market for lignite;lignite;kilogram
"33620: Uranium enriched in U235 and its compounds; plutonium and its compounds; alloys, dispersions, ceramic products[…]";nuclear power/production;2011:Manufacture of basic chemicals;fe3eb2c1ad14f5832bd6ebd74b557433;ecoinvent-3.9.1-cutoff;GLO;uranium;market for uranium, enriched 3.8%, per separative work unit;uranium, enriched 3.8%, per separative work unit;unit
"34240: Phosphates of triammonium; salts and peroxysalts of inorganic acids and metals n.e.c.";;2011:Manufacture of basic chemicals;718568284e773545641da6efa1418af0;ecoinvent-3.9.1-cutoff;CN;lithium;market for lithium iron phosphate;lithium iron phosphate;kilogram
17100: Electrical energy;;3510:Electric power generation, transmission and distribution;0699034e098d6cbeddee51d51c5a0154;ecoinvent-3.9.1-cutoff;GLO;natural gas;market for natural gas, burned in gas turbine;natural gas, burned in gas turbine;megajoule
37440: Portland cement, aluminous cement, slag cement and similar hydraulic cements, except in the form of clinkers;;2394:Manufacture of cement, lime and plaster;c72cc1b339840b1ed9b640052a2dd157;ecoinvent-3.9.1-cutoff;ZA;cement;market for cement, CEM II/B-S;cement, CEM II/B-S;kilogram
