;location;database;code;name;reference product;unit;Total (kg);Total (m3);Hazardous (kg);Hazardous (m3);ecosystem quality;human health;natural resources;parameters full;emptied;log parameters
70c530b2e72de1a0092caa4873ee87f0;GLO;SSP5-Base-2040;70c530b2e72de1a0092caa4873ee87f0;market for peach;peach;kilogram;1.4498720964953282;0.0004752535907764806;0.0010281424150674727;1.7713339076231926e-09;8.010665767828336e-09;1.9915283394169277e-06;0.030516904358554295;"[{'description': 'fraction, time to transfer the reefer between different modes of transport', 'id': '68f592ea-ec5e-40c3-8c86-c952c0763fc4', 'unit': 'dimensionless', 'comment': 'Estimated value.\n\nThe time the reefer is in operation is calculated using different average speed of all the different modes of transport (train, lorry, ship, etc.). This parameter presents an additional time during which the reefer is in operation, but is not being transported; the time when the reefer is being transfered from one type of transport to another. ', 'amount': 0.2, 'uncertainty type': 0, 'loc': 0.2, 'name': 'fraction_time_reefer_transfer'}, {'description': 'losses', 'id': '67d91564-dd27-4166-9796-689b78ff86ff', 'unit': 'dimensionless', 'comment': 'Calculated value based on literature.\n\nFAO suggest, that 1/3 of food produced for human consumption is lost or waste globally, which amounts in 1.3 billion tons per year (FAO, 2011, Global food losses and food waste).\n\nThe food losses vary heavily depending on the type of food and geographic location. The food losses/waste occurs in five basic stages of the lifecycle of the product;\n\n1) Agricultural production\n2) Post-harvest handling and storage\n3) Processing\n4) Distribution\n5) Consumption\n\nThe losses during the forth stage - the distribution - are recorded in the market.\n\nLiterature suggest (FAO, 2011, Global food losses and food waste), that the losses of fruits and vegetable distribution are approximately 12%. This value is rather rough estimate and it is assumed, that in the future this value will be replaced by more precise, product specific data.', 'amount': 0.12, 'uncertainty type': 0, 'loc': 0.12, 'name': 'losses'}, {'description': 'speed, average, aircraft, freight', 'id': 'e831114b-6445-4cbd-a1d6-9e6c4366fb5c', 'unit': 'km/hour', 'comment': 'Expert judgement.\n\nAverage velocity including stops.', 'amount': 700.0, 'uncertainty type': 0, 'loc': 700.0, 'name': 'speed_aircraft'}, {'description': 'speed, average, barge, freight', 'id': '16a175c6-27fe-4453-aefb-4604ea30a75d', 'unit': 'km/hour', 'comment': 'Expert judgement. The barge is in general slower than transoceanic ship.\n\nAverage velocity including stops.\n\nCross reference;\n10 km/hour (Lopez-Ruiz, H.G., 2007, Sustainable freight transport: A transport time and logistical organization approach, University of Lyon)\n\n26 km/hour (Rodrigue, J-P., Notteboom, T., Slack, B., 2013, Transport Systems, Chapter 3, Maritime Transport, http://people.hofstra.edu/geotrans/eng/ch3en/conc3en/ch3c4en.html, accessed 20150206)', 'amount': 20.0, 'uncertainty type': 0, 'loc': 20.0, 'name': 'speed_barge'}, {'description': 'speed, average, lorry, freight', 'id': '3819b90e-0c78-4ad8-9cf9-58b415446628', 'unit': 'km/hour', 'comment': 'Expert judgement.\n\nAverage velocity including stops.\n\nReference;\n45 km/hour is the default speed of lorries and trucks used to calculate delivery distances  (www.searates.com, accessed 20141201).', 'amount': 45.0, 'uncertainty type': 0, 'loc': 45.0, 'name': 'speed_lorry'}, {'description': 'speed, average, train, freight', 'id': '00c99a4c-33c7-4d15-b668-edcf67a9485c', 'unit': 'km/hour', 'comment': 'Expert judgement.\n\nAverage velocity including stops.\n\nCross reference;\n40 km/hour (Lopez-Ruiz, H.G., 2007, Sustainable freight transport: A transport time and logistical organization approach, University of Lyon)\n\n33.2 km/hour was the average speed of freight train in China in 2007 (http://www.statista.com/statistics/278404/speed-of-freight-trains-in-china/, accessed 20150206)', 'amount': 40.0, 'uncertainty type': 0, 'loc': 40.0, 'name': 'speed_train'}, {'description': 'speed, average, transoceanic ship, freight', 'id': 'fb887cc6-8e4e-4243-96a4-f177655316ca', 'unit': 'km/hour', 'comment': 'Expert judgement.\n\nAverage velocity including stops.\n\nReference;\n26 km/hour (Rodrigue, J-P., Notteboom, T., Slack, B., 2013, Transport Systems, Chapter 3, Maritime Transport, http://people.hofstra.edu/geotrans/eng/ch3en/conc3en/ch3c4en.html, accessed 20150206)', 'amount': 26.0, 'uncertainty type': 0, 'loc': 26.0, 'name': 'speed_ship'}]";;
c52fd3aad9cb8921c70e21a0206414f6;GLO;SSP5-Base-2040;c52fd3aad9cb8921c70e21a0206414f6;market for carbon fibre reinforced plastic, injection moulded;carbon fibre reinforced plastic, injection moulded;kilogram;13.298454178631065;0.01857695027975892;2.228321952798603;8.536358207180813e-07;3.222288742423579e-07;0.0001552403319799318;4.365393848969457;;;
5298254fa3c87afd6b7e4e8dd48f1635;GLO;SSP5-Base-2040;5298254fa3c87afd6b7e4e8dd48f1635;market for zirconium oxide;zirconium oxide;kilogram;2.995869556743054;0.03994985764146826;0.007812426265894683;5.743033763835975e-08;2.029686126116641e-08;6.942787428007515e-06;0.8050814420887912;;;
cf0f60252ff224f502c4821637299d35;GLO;SSP5-Base-2040;cf0f60252ff224f502c4821637299d35;market for ethylene glycol dimethyl ether;ethylene glycol dimethyl ether;kilogram;0.953337512618275;0.001150329167594013;0.005827832847932354;2.208996431061255e-08;8.803953993892395e-09;3.999465420232725e-06;0.526733245417347;;;
83688436c0c23932481625cbfd01aba0;RoW;SSP5-Base-2040;83688436c0c23932481625cbfd01aba0;market for petrol, low-sulfur;petrol, low-sulfur;kilogram;0.38475084703964024;0.0013992904270694767;0.005652136701762594;4.0422134486458426e-09;1.3773636789413119e-08;3.2435570786047854e-06;0.4825258129389712;;True;{'fossil CO2 per kg fuel': 2.664181757960726, 'non-fossil CO2 per kg fuel': 0.476728440796504, 'lower heating value': 42.6}
3933e1727cffbfaf57e071eb7fd9ae73;RoW;SSP5-Base-2040;3933e1727cffbfaf57e071eb7fd9ae73;market for lignite;lignite;kilogram;0.003965678177841002;9.947884971618444e-06;2.5882104519851918e-05;3.161140351876836e-10;1.6868971964250534e-09;8.260646924050137e-07;0.0010273900783466811;;;
00b4dc2977ce99664967210dfb501e20;RoW;SSP5-Base-2040;00b4dc2977ce99664967210dfb501e20;market for EUR-flat pallet;EUR-flat pallet;unit;11.426704798267274;0.01628416586109644;0.024433927560208527;5.946050721886681e-08;3.86592958472133e-07;2.8791485952616888e-05;0.8166416593886137;;;
c32636169ae0313a362cfda7255c9d9e;RoW;SSP5-Base-2040;c32636169ae0313a362cfda7255c9d9e;market for NMC111 hydroxide;NMC111 hydroxide;kilogram;135.42543504659426;1.1206204391592864;5.004731235591587;2.8307243628294624e-06;1.2424974416012262e-07;8.899931344118716e-05;3.5844588647684894;;;
657972e2d1cad01e6badc08a079ef38a;GLO;SSP5-Base-2040;657972e2d1cad01e6badc08a079ef38a;market for refractory material, acid;refractory material, acid;kilogram;0.2650650966970503;0.000557332262619376;0.001167672780106334;4.736646989506539e-09;4.262516295886665e-09;4.344368851776569e-06;0.06510774062325518;;;
56bcfbadb1e9ddbb4ec76584efdc9653;GLO;SSP5-Base-2040;56bcfbadb1e9ddbb4ec76584efdc9653;market for transistor, wired, big size, through-hole mounting;transistor, wired, big size, through-hole mounting;kilogram;50.03945185218679;0.7006477955903401;0.13744984690953316;3.1447706140318343e-06;9.561654441034221e-07;0.000761404445636858;9.447573429460741;;;
27f701452be69ef529a87361bcf2e5a6;GLO;SSP5-Base-2040;27f701452be69ef529a87361bcf2e5a6;market for funnel glass, for cathode ray tube display;funnel glass, for cathode ray tube display;kilogram;0.9063704450721224;0.0032292520489717487;0.001907150553888549;6.571908907224056e-09;5.489648719673002e-09;3.749470821787388e-06;0.12158547582917063;;;
9f5d213ee7d8a03752aaf531fa1a7bcd;RoW;SSP5-Base-2040;9f5d213ee7d8a03752aaf531fa1a7bcd;market for ethoxylated alcohol (AE7);ethoxylated alcohol (AE7);kilogram;1.1641871819014424;0.001270312791790531;0.00699001647578711;1.410550982086029e-08;1.1871302208408729e-08;5.073167022129844e-06;0.5691275631991635;;;
15bc9af41ae15098d9fa3e9fd1fa69c6;GLO;SSP5-Base-2040;15bc9af41ae15098d9fa3e9fd1fa69c6;market for cobalt hydroxide;cobalt hydroxide;kilogram;309.42407248221997;2.6142382499444707;0.19736177136284455;6.758711539176687e-06;1.9828379008603915e-07;0.0001594358716340722;7.036908581810671;;;
0654fa2a94bae92b96257ca44dc238ed;GLO;SSP5-Base-2040;0654fa2a94bae92b96257ca44dc238ed;market for poultry manure, fresh;poultry manure, fresh;kilogram;0.012450450347745591;6.654609530827446e-06;1.1413184664790076e-05;1.864184110248398e-11;1.827277193035553e-11;8.246350791283603e-09;0.00043466894733682;;;
29b9fa28dd3aa02152b3864899031e0d;RoW;SSP5-Base-2040;29b9fa28dd3aa02152b3864899031e0d;market for mango;mango;kilogram;0.26888403825447466;0.00018022833944354006;0.00027909505335768246;9.699545906305527e-10;2.5257918561335906e-09;9.004532178257685e-07;0.009513667793484384;;;
9291eac91d350e0a56be6f433a25ad3a;GLO;SSP5-Base-2040;9291eac91d350e0a56be6f433a25ad3a;market for electrostatic paint;electrostatic paint;kilogram;3.9588525800357988;0.04667253133277141;0.011662061985742118;2.91461584794057e-08;1.8477082548419284e-08;9.602473966650999e-06;0.6296517814078001;;;
30e6f0cb8e8bb4a3f4af5b5ad885f89a;GLO;SSP5-Base-2040;30e6f0cb8e8bb4a3f4af5b5ad885f89a;market for ethylamine;ethylamine;kilogram;1.1862543775730767;0.04528923182973671;0.007320868175110725;1.2989681025779557e-08;1.5737117245269502e-08;6.964586297481628e-06;0.5922578183725047;;;
e48b43af66fe1564ea0402c209878322;RoW;SSP5-Base-2040;e48b43af66fe1564ea0402c209878322;market for lime, hydraulic;lime, hydraulic;kilogram;0.058195375728343275;0.00011495912942150331;0.00035461172183692054;1.4388222504580609e-09;3.066082338236577e-09;1.2655081323175644e-06;0.028162819246379346;;;
342baff30ae57e0573e84257026d5e2e;GLO;SSP5-Base-2040;342baff30ae57e0573e84257026d5e2e;market for polyvinylchloride, bulk polymerised;polyvinylchloride, bulk polymerised;kilogram;1.6974509741990558;0.20508263341902136;0.03785712332318166;2.6333483477864483e-08;9.577411952984592e-09;4.562276600164436e-06;0.4363656551471848;;;
af93b929cb25eef21b55f57ae4dfe199;GLO;SSP5-Base-2040;af93b929cb25eef21b55f57ae4dfe199;market for nuclear fuel factory;nuclear fuel factory;unit;286978895.4012472;268231.76429825474;399473.74458498985;0.289854874777765;0.48343419338446103;387.08059102309693;9485671.043233672;;;
f090c0ac622e3fbbee68f5eb2b704d04;RoW;SSP5-Base-2040;f090c0ac622e3fbbee68f5eb2b704d04;market for lean concrete;lean concrete;cubic meter;215.41765792590377;0.13666465663362984;0.25041978655000524;6.120336753064075e-07;7.224274306554607e-07;0.0003061731972300133;10.143389581706991;;;
f26980d768519c377a7ec264b866e732;GLO;SSP5-Base-2040;f26980d768519c377a7ec264b866e732;market for refractory, basic, packed;refractory, basic, packed;kilogram;0.5083250350740688;0.0006077281519937496;0.0026281715852073794;5.91295899525551e-09;1.0605445941908839e-08;5.960048791565558e-06;0.5751743897056774;;;
455b2215d53fb94619c5a5d278f79ad2;GLO;SSP5-Base-2040;455b2215d53fb94619c5a5d278f79ad2;market for pyridazine-compound;pyridazine-compound;kilogram;5.446649591481586;0.02355492202191064;0.013368503684329715;1.2503335812073963e-07;5.56006835490714e-08;3.205750018627814e-05;1.2128217730763207;;;
bcf5049a187400db6daa0690b47d5e6d;RoW;SSP5-Base-2040;bcf5049a187400db6daa0690b47d5e6d;market for mandarin;mandarin;kilogram;1.6983070705831598;0.00045250747064626843;0.0008722200218199824;1.9890675815493664e-09;1.2866063424057742e-08;2.691949750356283e-06;0.0346429166777485;"[{'description': 'fraction, time to transfer the reefer between different modes of transport', 'id': '68f592ea-ec5e-40c3-8c86-c952c0763fc4', 'unit': 'dimensionless', 'comment': 'Estimated value.', 'amount': 0.2, 'uncertainty type': 0, 'loc': 0.2, 'name': 'fraction_time_reefer_transfer'}, {'description': 'losses', 'id': '67d91564-dd27-4166-9796-689b78ff86ff', 'unit': 'dimensionless', 'comment': 'Calculated value based on literature.\n\nFAO suggest, that 1/3 of food produced for human consumption is lost or waste globally, which amounts in 1.3 billion tons per year (FAO, 2011, Global food losses and food waste).\n\nThe food losses vary heavily depending on the type of food and geographic location. The food losses/waste occurs in five basic stages of the lifecycle of the product;\n\n1) Agricultural production\n2) Post-harvest handling and storage\n3) Processing\n4) Distribution\n5) Consumption\n\nThe losses during the forth stage - the distribution - are recorded in the market.\n\nLiterature suggest (FAO, 2011, Global food losses and food waste), that the losses of fruits and vegetable distribution are approximately 12%. This value is rather rough estimate and it is assumed, that in the future this value will be replaced by more precise, product specific data.', 'amount': 0.12, 'uncertainty type': 0, 'loc': 0.12, 'name': 'losses'}, {'description': 'speed, average, aircraft, freight', 'id': 'e831114b-6445-4cbd-a1d6-9e6c4366fb5c', 'unit': 'km/hour', 'comment': 'Expert judgement.\n\nAverage velocity including stops.', 'amount': 700.0, 'uncertainty type': 0, 'loc': 700.0, 'name': 'speed_aircraft'}, {'description': 'speed, average, barge, freight', 'id': '16a175c6-27fe-4453-aefb-4604ea30a75d', 'unit': 'km/hour', 'comment': 'Expert judgement. The barge is in general slower than transoceanic ship.\n\nAverage velocity including stops.\n\nCross reference;\n10 km/hour (Lopez-Ruiz, H.G., 2007, Sustainable freight transport: A transport time and logistical organization approach, University of Lyon)\n\n26 km/hour (Rodrigue, J-P., Notteboom, T., Slack, B., 2013, Transport Systems, Chapter 3, Maritime Transport, http://people.hofstra.edu/geotrans/eng/ch3en/conc3en/ch3c4en.html, accessed 20150206)', 'amount': 20.0, 'uncertainty type': 0, 'loc': 20.0, 'name': 'speed_barge'}, {'description': 'speed, average, lorry, freight', 'id': '3819b90e-0c78-4ad8-9cf9-58b415446628', 'unit': 'km/hour', 'comment': 'Expert judgement.\n\nAverage velocity including stops.\n\nReference;\n45 km/hour is the default speed of lorries and trucks used to calculate delivery distances  (www.searates.com, accessed 20141201).', 'amount': 45.0, 'uncertainty type': 0, 'loc': 45.0, 'name': 'speed_lorry'}, {'description': 'speed, average, train, freight', 'id': '00c99a4c-33c7-4d15-b668-edcf67a9485c', 'unit': 'km/hour', 'comment': 'Expert judgement.\n\nAverage velocity including stops.\n\nCross reference;\n40 km/hour (Lopez-Ruiz, H.G., 2007, Sustainable freight transport: A transport time and logistical organization approach, University of Lyon)\n\n33.2 km/hour was the average speed of freight train in China in 2007 (http://www.statista.com/statistics/278404/speed-of-freight-trains-in-china/, accessed 20150206)', 'amount': 40.0, 'uncertainty type': 0, 'loc': 40.0, 'name': 'speed_train'}, {'description': 'speed, average, transoceanic ship, freight', 'id': 'fb887cc6-8e4e-4243-96a4-f177655316ca', 'unit': 'km/hour', 'comment': 'Expert judgement.\n\nAverage velocity including stops.\n\nReference;\n26 km/hour (Rodrigue, J-P., Notteboom, T., Slack, B., 2013, Transport Systems, Chapter 3, Maritime Transport, http://people.hofstra.edu/geotrans/eng/ch3en/conc3en/ch3c4en.html, accessed 20150206)', 'amount': 26.0, 'uncertainty type': 0, 'loc': 26.0, 'name': 'speed_ship'}]";;
d652929c4508093574e9e957c8535459;RoW;SSP5-Base-2040;d652929c4508093574e9e957c8535459;market for cathode, NCA, for Li-ion battery;cathode, NCA, for Li-ion battery;kilogram;118.17458856069427;0.8661304680024335;2.104470068257454;2.2761186766941372e-06;1.3245612005117452e-07;8.812977606826442e-05;5.8351773778718385;;;
7c29e5daa6f295974d0c68e107239770;GLO;SSP5-Base-2040;7c29e5daa6f295974d0c68e107239770;market for tomato seedling, for planting;tomato seedling, for planting;unit;0.00341582697266612;2.048199663457859e-06;5.0961335265795315e-06;3.5293398807351244e-11;1.903739486445722e-10;3.8358225381040584e-08;0.00019639074758081985;;;
bc62c5330286e6df8bfbcf7d03502b2c;RoW;SSP5-Base-2040;bc62c5330286e6df8bfbcf7d03502b2c;market for NMC811 oxide;NMC811 oxide;kilogram;105.28468745464963;0.7600530438984692;1.4350978859728327;2.00091611093304e-06;1.1763043943814855e-07;7.914288767551692e-05;5.310091546454184;;;
adf2ea43cb0ec0692d688a9c23e26505;GLO;SSP5-Base-2040;adf2ea43cb0ec0692d688a9c23e26505;market for liquid storage tank, chemicals, organics;liquid storage tank, chemicals, organics;unit;14681763.429098058;10914.997049930682;2644.286462905346;0.006701585093529151;0.007363067578504402;7.141825005150984;187749.74687510938;;;
c578b2b6b24a8fe94e2fabaae27942b9;RoW;SSP5-Base-2040;c578b2b6b24a8fe94e2fabaae27942b9;market for triple superphosphate;triple superphosphate;kilogram;1.0353887522349166;0.0010434843292355949;0.0014742500451829488;5.741681723998801e-09;7.635444116120059e-09;3.847255495147103e-06;0.07739884330331816;;;
eb5cd88e4206bdeebf5c74933fdea9fd;GLO;SSP5-Base-2040;eb5cd88e4206bdeebf5c74933fdea9fd;market for wood preservative, water-based, indoor use, occasionally wet;wood preservative, water-based, indoor use, occasionally wet;kilogram;1.232085242659462;0.002124562219793775;0.0126734920051726;1.1550541598281393e-08;2.4885345835187216e-08;5.166807576470619e-06;0.21037245249212347;;;
de09bd76fd0a2942041893fc210247d7;GLO;SSP5-Base-2040;de09bd76fd0a2942041893fc210247d7;market for pear;pear;kilogram;1.4944875537659001;0.000463475520432795;0.0010690152520243773;1.60226262910179e-09;8.939486792919754e-09;2.105693319738119e-06;0.030896673979667964;"[{'description': 'fraction, time to transfer the reefer between different modes of transport', 'id': '68f592ea-ec5e-40c3-8c86-c952c0763fc4', 'unit': 'dimensionless', 'comment': 'Estimated value.', 'amount': 0.2, 'uncertainty type': 0, 'loc': 0.2, 'name': 'fraction_time_reefer_transfer'}, {'description': 'losses', 'id': '67d91564-dd27-4166-9796-689b78ff86ff', 'unit': 'dimensionless', 'comment': 'Calculated value based on literature.\n\nFAO suggest, that 1/3 of food produced for human consumption is lost or waste globally, which amounts in 1.3 billion tons per year (FAO, 2011, Global food losses and food waste).\n\nThe food losses vary heavily depending on the type of food and geographic location. The food losses/waste occurs in five basic stages of the lifecycle of the product;\n\n1) Agricultural production\n2) Post-harvest handling and storage\n3) Processing\n4) Distribution\n5) Consumption\n\nThe losses during the forth stage - the distribution - are recorded in the market.\n\nLiterature suggest (FAO, 2011, Global food losses and food waste), that the losses of fruits and vegetable distribution are approximately 12%. This value is rather rough estimate and it is assumed, that in the future this value will be replaced by more precise, product specific data.', 'amount': 0.12, 'uncertainty type': 0, 'loc': 0.12, 'name': 'losses'}, {'description': 'speed, average, aircraft, freight', 'id': 'e831114b-6445-4cbd-a1d6-9e6c4366fb5c', 'unit': 'km/hour', 'comment': 'Expert judgement.\n\nAverage velocity including stops.', 'amount': 700.0, 'uncertainty type': 0, 'loc': 700.0, 'name': 'speed_aircraft'}, {'description': 'speed, average, barge, freight', 'id': '16a175c6-27fe-4453-aefb-4604ea30a75d', 'unit': 'km/hour', 'comment': 'Expert judgement. The barge is in general slower than transoceanic ship.\n\nAverage velocity including stops.\n\nCross reference;\n10 km/hour (Lopez-Ruiz, H.G., 2007, Sustainable freight transport: A transport time and logistical organization approach, University of Lyon)\n\n26 km/hour (Rodrigue, J-P., Notteboom, T., Slack, B., 2013, Transport Systems, Chapter 3, Maritime Transport, http://people.hofstra.edu/geotrans/eng/ch3en/conc3en/ch3c4en.html, accessed 20150206)', 'amount': 20.0, 'uncertainty type': 0, 'loc': 20.0, 'name': 'speed_barge'}, {'description': 'speed, average, lorry, freight', 'id': '3819b90e-0c78-4ad8-9cf9-58b415446628', 'unit': 'km/hour', 'comment': 'Expert judgement.\n\nAverage velocity including stops.\n\nReference;\n45 km/hour is the default speed of lorries and trucks used to calculate delivery distances  (www.searates.com, accessed 20141201).', 'amount': 45.0, 'uncertainty type': 0, 'loc': 45.0, 'name': 'speed_lorry'}, {'description': 'speed, average, train, freight', 'id': '00c99a4c-33c7-4d15-b668-edcf67a9485c', 'unit': 'km/hour', 'comment': 'Expert judgement.\n\nAverage velocity including stops.\n\nCross reference;\n40 km/hour (Lopez-Ruiz, H.G., 2007, Sustainable freight transport: A transport time and logistical organization approach, University of Lyon)\n\n33.2 km/hour was the average speed of freight train in China in 2007 (http://www.statista.com/statistics/278404/speed-of-freight-trains-in-china/, accessed 20150206)', 'amount': 40.0, 'uncertainty type': 0, 'loc': 40.0, 'name': 'speed_train'}, {'description': 'speed, average, transoceanic ship, freight', 'id': 'fb887cc6-8e4e-4243-96a4-f177655316ca', 'unit': 'km/hour', 'comment': 'Expert judgement.\n\nAverage velocity including stops.\n\nReference;\n26 km/hour (Rodrigue, J-P., Notteboom, T., Slack, B., 2013, Transport Systems, Chapter 3, Maritime Transport, http://people.hofstra.edu/geotrans/eng/ch3en/conc3en/ch3c4en.html, accessed 20150206)', 'amount': 26.0, 'uncertainty type': 0, 'loc': 26.0, 'name': 'speed_ship'}]";;
b243372acdb48c25339f1e9b6f877489;RoW;SSP5-Base-2040;b243372acdb48c25339f1e9b6f877489;market for benzoic acid;benzoic acid;kilogram;0.6470723137406927;0.0009037192391049859;0.006548599887759512;1.299104836577448e-08;8.103405642656174e-09;3.578740587728462e-06;0.5319744532482432;;;
add234d9bd0210d2090f0a2eaff1ea6b;GLO;SSP5-Base-2040;add234d9bd0210d2090f0a2eaff1ea6b;market for sodium tetrafluoroborate;sodium tetrafluoroborate;kilogram;4.593602341481576;0.02362779636592295;0.012812451136082965;1.5264153703418774e-07;4.366186008716511e-08;2.4650207331450266e-05;3.3632455768395912;;;
c0f67ff20334a36d326b2281fa72d3ea;GLO;SSP5-Base-2040;c0f67ff20334a36d326b2281fa72d3ea;market for packaging glass sorting facility;packaging glass sorting facility;unit;28238899.275611795;9718.55972846805;6938.157266278737;0.020225130038675806;0.015300907181829592;12.855819421841954;244898.979679187;;;
dd5dd245e75dc87e0219510c31f84652;GLO;SSP5-Base-2040;dd5dd245e75dc87e0219510c31f84652;market for tert-butyl amine;tert-butyl amine;kilogram;14.419814286178278;0.018279184393305906;0.018566650942904193;7.335539595690723e-08;3.116389648214232e-08;1.5745778841593394e-05;1.066763776025839;;;
2a83bda414e1adbc7fe1967a99f30491;GLO;SSP5-Base-2040;2a83bda414e1adbc7fe1967a99f30491;market for gallium, in Bayer liquor from aluminium production;gallium, in Bayer liquor from aluminium production;kilogram;0.14127407395186808;8.530380166214412e-05;0.00017551149208301073;2.749018449658965e-10;2.883524693399249e-10;1.344450034434685e-07;19.406323131866337;;;
a34f57fd2a52e6626cf5db9c6118f877;GLO;SSP5-Base-2040;a34f57fd2a52e6626cf5db9c6118f877;market for barge;barge;unit;476321.74184390955;4101.258604840352;1031.7776665991896;0.005820195766087161;0.004949166692647588;4.648788047972198;91081.41223880023;;;
ac49fd5603dd7fa13b766c8a3a191c97;GLO;SSP5-Base-2040;ac49fd5603dd7fa13b766c8a3a191c97;market for pomegranate;pomegranate;kilogram;0.3367603636631482;0.0005754214948198342;0.0006753120915084654;1.3314256676765536e-09;2.4032518456569388e-09;9.09591512931816e-06;0.02156913692515839;;;
0359b9f53c1748fac3950af176ff31bf;RoW;SSP5-Base-2040;0359b9f53c1748fac3950af176ff31bf;market for magnesium, for reuse in titanium sponge production;magnesium, for reuse in titanium sponge production;kilogram;4.902623483838812;0.002332166347561127;0.0036187603669644995;2.283360681586603e-07;2.1229998643101234e-08;9.87302806124658e-06;0.4246550896223732;;;
f1a65e37d64e0d15c6275f566334e6d2;RoW;SSP5-Base-2040;f1a65e37d64e0d15c6275f566334e6d2;market for aluminium scrap, new;aluminium scrap, new;kilogram;0.12510713893192146;6.879882681731743e-05;0.00012657875114821762;1.806411236570798e-10;2.107163521360465e-10;9.632600679624715e-08;0.004807466908363415;;;
a20be73eef30e9d555ae126bea5ca4f5;GLO;SSP5-Base-2040;a20be73eef30e9d555ae126bea5ca4f5;market for silver, unrefined;silver, unrefined;kilogram;713.5628231109051;267.83548547248927;3.3173448547836957;1.099112500742571e-05;1.17139420816998e-05;0.02220265629558442;478.14021070159697;;;
0d0be383a3fbe2cd5838635b801109e3;GLO;SSP5-Base-2040;0d0be383a3fbe2cd5838635b801109e3;market for organo-mineral nitrogen fertiliser, as N;organo-mineral nitrogen fertiliser, as N;kilogram;0.0;0.0;0.0;0.0;0.0;0.0;0.0;;;
4d5473bbb237606275ad372ddedf037f;GLO;SSP5-Base-2040;4d5473bbb237606275ad372ddedf037f;market for copper scrap, sorted, pressed;copper scrap, sorted, pressed;kilogram;0.12487281928173397;6.809158019239429e-05;0.00012528021934120196;1.9192696400657183e-10;2.0855221147263532e-10;9.515778478651765e-08;0.004725869526770576;;;
