;location;database;code;name;reference product;unit;Total (kg);Total (m3);Hazardous (kg);Hazardous (m3);ecosystem quality;human health;natural resources;parameters full;emptied;log parameters
0fcc7131b612b072f72a3fcd9b23ff26;GLO;SSP5-Base-2040;0fcc7131b612b072f72a3fcd9b23ff26;market for tilapia;tilapia;kilogram;1.637170396023996;0.001991385911774066;0.00319786549532629;7.472510824086107e-08;4.009656740391479e-08;1.7268647326946503e-05;0.21358942319363622;;;
36ee255c9326a9287812b59994bac393;GLO;SSP5-Base-2040;36ee255c9326a9287812b59994bac393;market for hafnium tetrachloride;hafnium tetrachloride;kilogram;11.897970607790707;0.05436494865564003;0.012430759478014485;0.00020994599620327583;6.953959764000811e-08;5.4725611192044826e-05;1.3507439803361496;;;
9bdb4174562fd2ccef633d627bcb6196;GLO;SSP5-Base-2040;9bdb4174562fd2ccef633d627bcb6196;market for heat and power co-generation unit, 6400kW thermal, building;heat and power co-generation unit, 6400kW thermal, building;unit;11083608.961228065;958.9695945685421;725.5339501875987;0.0013633142584769094;0.0037998963309132934;0.9765760680378895;27234.622311565956;;;
d3fdb6a6f34f19a64d390faf72e223d5;GLO;SSP5-Base-2040;d3fdb6a6f34f19a64d390faf72e223d5;market for hydropower plant, reservoir;hydropower plant, reservoir;unit;539737125531.423;30611431.84726314;22395606.8477921;93.44827448117425;63.9924334820345;45719.501887505634;995102820.4622097;;;
9de8bfc2817d1b3743646c6da6561607;RoW;SSP5-Base-2040;9de8bfc2817d1b3743646c6da6561607;market for coating powder;coating powder;kilogram;4.984641831364774;0.049380171579251654;0.02025666008392696;7.270365444771143e-08;3.131048606262715e-08;1.4687846484241532e-05;0.7687671378425415;;;
1c2c1112d2f701572ba1b0efd739eae0;RoW;SSP5-Base-2040;1c2c1112d2f701572ba1b0efd739eae0;market for slab and siding, hardwood, wet, measured as dry mass;slab and siding, hardwood, wet, measured as dry mass;kilogram;0.06488327083642177;6.633636423977838e-05;0.00010904774413576577;1.6736169228612462e-10;2.031888432057597e-09;5.656896335424358e-08;0.002820021572573538;;;
7d09be96b08495461b278bbf22fd5dfe;GLO;SSP5-Base-2040;7d09be96b08495461b278bbf22fd5dfe;market for lithium brine, 6.7 % Li;lithium brine, 6.7 % Li;kilogram;0.158142631795048;8.501569965617299e-05;0.0002146605066233484;3.018883109708723e-10;3.925231106986484e-10;1.2747195195005216e-07;0.08127283967784164;;;
848336823f7b6161cc7b39fff729c3ab;RoW;SSP5-Base-2040;848336823f7b6161cc7b39fff729c3ab;market for methylchloride;methylchloride;kilogram;0.2351464808935106;9.133416184857702e-05;0.0033903949308036817;2.764284547636428e-10;1.4848491168339221e-08;7.468074855471324e-06;0.3037655234649696;;;
043b307c3e9f84641c9228b9770c5469;RoW;SSP5-Base-2040;043b307c3e9f84641c9228b9770c5469;market for SOx retained, in hard coal flue gas desulfurisation;SOx retained, in hard coal flue gas desulfurisation;kilogram;11.648025508595914;0.015930752352082325;0.00045633728948106056;1.5799697877755616e-09;5.909360064823215e-09;3.974770116004636e-06;0.02267552080712286;;;
37a9409040114840de005d79be18f5e0;RoW;SSP5-Base-2040;37a9409040114840de005d79be18f5e0;market for sodium formate;sodium formate;kilogram;1.2022391456230286;0.006706837272700947;0.002673740018146899;5.317171399277448e-08;8.821630746111841e-09;4.251395475173795e-06;0.2688946415494058;;;
4d9da62dfbcd84bb1e6d011b4e3b7139;RoW;SSP5-Base-2040;4d9da62dfbcd84bb1e6d011b4e3b7139;market for brass;brass;kilogram;7.039184785336959;0.031564045303743175;0.027630726831115015;1.263295836446742e-07;1.5837268464567996e-07;0.00016320527352870084;0.6390501297184817;;;
5335ca05edd8d58c2e669f097830465f;RoW;SSP5-Base-2040;5335ca05edd8d58c2e669f097830465f;market for ethylene glycol monoethyl ether;ethylene glycol monoethyl ether;kilogram;0.914563554137257;0.018579008734863935;0.00687543357623132;1.4677693910303803e-08;1.0637085664483381e-08;4.8653630230837074e-06;0.5087381703460776;;;
3a2ce46223f8bc9ae688d157d5ce9264;GLO;SSP5-Base-2040;3a2ce46223f8bc9ae688d157d5ce9264;market for lorry with refrigeration machine, R134a as refrigerant, 16 metric ton;lorry with refrigeration machine, R134a as refrigerant, 16 metric ton;unit;20277.563387236383;157.7085502417936;183.1622825333066;0.000243051769055582;0.00014557871570656467;0.12487841753666394;3046.4131538820743;;;
bbb569bf643d66479116ca24bdc4b122;RoW;SSP5-Base-2040;bbb569bf643d66479116ca24bdc4b122;market for cationic resin;cationic resin;kilogram;0.8926316212019162;0.0017223228997471063;0.009549585214346387;9.019210429426598e-09;7.457656357395248e-09;3.807640873114021e-06;0.27957535641541154;;;
d971937192fae29417d670b40a21f603;GLO;SSP5-Base-2040;d971937192fae29417d670b40a21f603;market for lithium hexafluorophosphate;lithium hexafluorophosphate;kilogram;25.555868865574194;0.06911774426781031;0.0396316665301015;2.491606102341226e-07;1.1520700615749426e-07;6.787898958202006e-05;20.688265063669338;;;
9d3cb3d2efc331b6baa40a66386b4713;GLO;SSP5-Base-2040;9d3cb3d2efc331b6baa40a66386b4713;market for heat and power co-generation unit, 160kW electrical, components for electricity only;heat and power co-generation unit, 160kW electrical, components for electricity only;unit;8401.02840152388;38.989038200621785;15.786682894275666;0.00018032805581839643;0.00012718742784471952;0.11328493500895906;1202.758738782266;;;
c3b925989546c0cfacc4de7771eb9068;GLO;SSP5-Base-2040;c3b925989546c0cfacc4de7771eb9068;market for 2,4-dichlorophenol;2,4-dichlorophenol;kilogram;1.9089623376182425;0.012000195133052192;0.007849960646058047;5.4656653952896974e-08;1.468801844462578e-08;7.136503626785861e-06;0.5817310686508537;;;
976694b4c0b31641b846a89d2fbf6c4b;GLO;SSP5-Base-2040;976694b4c0b31641b846a89d2fbf6c4b;market for gas boiler;gas boiler;unit;345.05561078920795;3.7493131126383923;16.63976208206174;4.641946576214819e-06;3.133694067969773e-06;0.003428968256935379;47.307944392994315;;;
718e7075d4c0f2ec699ee9151572ce1e;RoW;SSP5-Base-2040;718e7075d4c0f2ec699ee9151572ce1e;market for bark chips, wet, measured as dry mass;bark chips, wet, measured as dry mass;kilogram;0.04160313296162743;4.4732967541564626e-05;9.515126487836273e-05;3.376019067051181e-10;1.5809131485728353e-09;7.310637724434988e-08;0.00475569567245742;;;
ff0b4d256f672f9de782b34a8467e5de;GLO;SSP5-Base-2040;ff0b4d256f672f9de782b34a8467e5de;market for furnace, wood chips, with silo, 1000kW;furnace, wood chips, with silo, 1000kW;unit;486906.70287470816;700.3861145451966;146.86068564754194;0.0006689989534809305;0.0004358826992776294;0.46808656483948147;9716.871005855513;;;
1372b74bf193f947f6ee656e846a575e;GLO;SSP5-Base-2040;1372b74bf193f947f6ee656e846a575e;market for metamitron;metamitron;kilogram;3.7883405864027306;0.022881141618373832;0.008432367701284717;1.0308002753447661e-07;2.7343338080947637e-08;1.2499819125905936e-05;0.678574786090581;;;
99336db2446b51b8f056be971845df59;GLO;SSP5-Base-2040;99336db2446b51b8f056be971845df59;market for polyphenylene sulfide;polyphenylene sulfide;kilogram;10.850231446459578;0.023599069512908938;0.012445772890192677;8.340871668689221e-08;2.6976144774753696e-08;1.450002187761464e-05;0.8936544125130933;;;
fd0a584ab20d704adaade56edcccc55a;GLO;SSP5-Base-2040;fd0a584ab20d704adaade56edcccc55a;market for 1-propanol;1-propanol;kilogram;1.4679342059467202;0.003242422034748585;0.007232724291346415;4.675576885587977e-08;2.7934421275763066e-08;1.288742020215505e-05;0.6759475436075097;;;
5654a1b5c1d011ad4201dc073f484d7b;GLO;SSP5-Base-2040;5654a1b5c1d011ad4201dc073f484d7b;market for apricot;apricot;kilogram;1.2885405298404096;0.00037196109690122806;0.0006927937954794894;1.3507425752381627e-09;6.065745388422634e-09;1.1446629687927571e-06;0.025166797406105404;"[{'description': 'fraction, time to transfer the reefer between different modes of transport', 'id': '68f592ea-ec5e-40c3-8c86-c952c0763fc4', 'unit': 'dimensionless', 'comment': 'Estimated value.\n\nThe time the reefer is in operation is calculated using different average speed of all the different modes of transport (train, lorry, ship, etc.). This parameter presents an additional time during which the reefer is in operation, but is not being transported; the time when the reefer is being transfered from one type of transport to another. ', 'amount': 0.2, 'uncertainty type': 0, 'loc': 0.2, 'name': 'fraction_time_reefer_transfer'}, {'description': 'losses', 'id': '67d91564-dd27-4166-9796-689b78ff86ff', 'unit': 'dimensionless', 'comment': 'Calculated value based on literature.\n\nFAO suggest, that 1/3 of food produced for human consumption is lost or waste globally, which amounts in 1.3 billion tons per year (FAO, 2011, Global food losses and food waste).\n\nThe food losses vary heavily depending on the type of food and geographic location. The food losses/waste occurs in five basic stages of the lifecycle of the product;\n\n1) Agricultural production\n2) Post-harvest handling and storage\n3) Processing\n4) Distribution\n5) Consumption\n\nThe losses during the forth stage - the distribution - are recorded in the market.\n\nLiterature suggest (FAO, 2011, Global food losses and food waste), that the losses of fruits and vegetable distribution are approximately 12%. This value is rather rough estimate and it is assumed, that in the future this value will be replaced by more precise, product specific data.', 'amount': 0.12, 'uncertainty type': 0, 'loc': 0.12, 'name': 'losses'}, {'description': 'speed, average, aircraft, freight', 'id': 'e831114b-6445-4cbd-a1d6-9e6c4366fb5c', 'unit': 'km/hour', 'comment': 'Expert judgement.\n\nAverage velocity including stops.', 'amount': 700.0, 'uncertainty type': 0, 'loc': 700.0, 'name': 'speed_aircraft'}, {'description': 'speed, average, barge, freight', 'id': '16a175c6-27fe-4453-aefb-4604ea30a75d', 'unit': 'km/hour', 'comment': 'Expert judgement. The barge is in general slower than transoceanic ship.\n\nAverage velocity including stops.\n\nCross reference;\n10 km/hour (Lopez-Ruiz, H.G., 2007, Sustainable freight transport: A transport time and logistical organization approach, University of Lyon)\n\n26 km/hour (Rodrigue, J-P., Notteboom, T., Slack, B., 2013, Transport Systems, Chapter 3, Maritime Transport, http://people.hofstra.edu/geotrans/eng/ch3en/conc3en/ch3c4en.html, accessed 20150206)', 'amount': 20.0, 'uncertainty type': 0, 'loc': 20.0, 'name': 'speed_barge'}, {'description': 'speed, average, lorry, freight', 'id': '3819b90e-0c78-4ad8-9cf9-58b415446628', 'unit': 'km/hour', 'comment': 'Expert judgement.\n\nAverage velocity including stops.\n\nReference;\n45 km/hour is the default speed of lorries and trucks used to calculate delivery distances  (www.searates.com, accessed 20141201).', 'amount': 45.0, 'uncertainty type': 0, 'loc': 45.0, 'name': 'speed_lorry'}, {'description': 'speed, average, train, freight', 'id': '00c99a4c-33c7-4d15-b668-edcf67a9485c', 'unit': 'km/hour', 'comment': 'Expert judgement.\n\nAverage velocity including stops.\n\nCross reference;\n40 km/hour (Lopez-Ruiz, H.G., 2007, Sustainable freight transport: A transport time and logistical organization approach, University of Lyon)\n\n33.2 km/hour was the average speed of freight train in China in 2007 (http://www.statista.com/statistics/278404/speed-of-freight-trains-in-china/, accessed 20150206)', 'amount': 40.0, 'uncertainty type': 0, 'loc': 40.0, 'name': 'speed_train'}, {'description': 'speed, average, transoceanic ship, freight', 'id': 'fb887cc6-8e4e-4243-96a4-f177655316ca', 'unit': 'km/hour', 'comment': 'Expert judgement.\n\nAverage velocity including stops.\n\nReference;\n26 km/hour (Rodrigue, J-P., Notteboom, T., Slack, B., 2013, Transport Systems, Chapter 3, Maritime Transport, http://people.hofstra.edu/geotrans/eng/ch3en/conc3en/ch3c4en.html, accessed 20150206)', 'amount': 26.0, 'uncertainty type': 0, 'loc': 26.0, 'name': 'speed_ship'}]";;
bd2032dac0eb286ae656cc8d7446818d;RoW;SSP5-Base-2040;bd2032dac0eb286ae656cc8d7446818d;market for rape oil, crude;rape oil, crude;kilogram;0.897039516821396;0.0010558593182988236;0.0025797695155366555;6.284063705003681e-09;7.214378333364574e-08;8.109453512513958e-06;0.09754247700856719;;;
85e0369591f9007f1380c2d4a944fe6f;RoW;SSP5-Base-2040;85e0369591f9007f1380c2d4a944fe6f;market for phosgene, liquid;phosgene, liquid;kilogram;0.922022118531888;0.005674802777454852;0.001946283847004956;3.7227394606769365e-08;7.247374805255045e-09;3.5256093659058e-06;0.19841077097917276;;;
4320d957a5e248bfffcf8bc3769dccc5;GLO;SSP5-Base-2040;4320d957a5e248bfffcf8bc3769dccc5;market for solder, bar, Sn95.5Ag3.9Cu0.6, for electronics industry;solder, bar, Sn95.5Ag3.9Cu0.6, for electronics industry;kilogram;9.38255245392752;1.1060476245406203;0.0814457414647987;4.2999609396406307e-07;2.4249081185648036e-07;0.00036450615230145574;4.310190845348109;;;
7abaca55d9266c3317eab654d748dd51;GLO;SSP5-Base-2040;7abaca55d9266c3317eab654d748dd51;market for organo-mineral potassium fertiliser, as K2O;organo-mineral potassium fertiliser, as K2O;kilogram;0.002083198175920749;1.038234908903536e-06;1.6340971141575853e-06;2.549133180183335e-12;2.662034064592148e-12;1.1829557057245312e-09;6.506267329559638e-05;;;
3a6586952eff793738eef72743703e90;RoW;SSP5-Base-2040;3a6586952eff793738eef72743703e90;market for fatty acid methyl ester;fatty acid methyl ester;kilogram;0.6842169901068158;0.0011878022394629995;0.0018103811485396684;5.562262420315087e-09;5.576960037430465e-08;6.43319734811491e-06;0.09819553467063391;;;
194c4261b5ac76aee18451f2109055ad;RoW;SSP5-Base-2040;194c4261b5ac76aee18451f2109055ad;market for lorry, 28 metric ton;lorry, 28 metric ton;unit;18702.366331085414;171.65776886307643;233.83881158224108;0.0002567389266893707;0.0001511018988764387;0.1815429136878726;3789.611050455036;;;
ea53e67a8db812c8db09922ef5aa73d2;RoW;SSP5-Base-2040;ea53e67a8db812c8db09922ef5aa73d2;market for acrylic varnish, with water, in 53% solution state;acrylic varnish, with water, in 53% solution state;kilogram;2.972248604040411;0.02553168664162918;0.008750694673517752;2.439953806038728e-08;1.3016796433399429e-08;6.818209685368127e-06;0.34693170467606077;;;
ddc93077ae8be725315752f6dbbc160c;GLO;SSP5-Base-2040;ddc93077ae8be725315752f6dbbc160c;market for stone groundwood pulp;stone groundwood pulp;kilogram;0.34750809064160076;0.0005895847800075576;0.0007926745710748857;3.107045649248991e-08;1.4522869524760097e-08;2.2132999047908574e-06;0.05637857980514434;;;
bfb5b92cc635472a79a03c702a79fd53;GLO;SSP5-Base-2040;bfb5b92cc635472a79a03c702a79fd53;market for neodymium oxide;neodymium oxide;kilogram;30.816108262345786;3.067709297277812;4.071694150003665;0.0002568945752350351;4.062931497604144e-07;0.00017573031092397556;1273.8498929016978;;;
5d05a333844f7667c0264d0b2b641f0a;GLO;SSP5-Base-2040;5d05a333844f7667c0264d0b2b641f0a;market for potassium nitrate, agricultural grade;potassium nitrate, agricultural grade;kilogram;17.046726011809305;0.001624174405729748;0.0012594183995209797;5.958557368851128e-09;2.9360488270322845e-08;2.1547903136624433e-06;0.1923432503072142;;;
5bab56a32812b0a290372823ca55d69d;GLO;SSP5-Base-2040;5bab56a32812b0a290372823ca55d69d;market for bitumen seal, polymer EP4 flame retardant;bitumen seal, polymer EP4 flame retardant;kilogram;0.5800237224194453;0.003722731185203299;0.004107604810185172;1.2221548401871036e-08;4.345253577368884e-09;2.1096556080177337e-06;0.3677576899897685;;;
04681bb9fe28b4408facb1d721820cd0;GLO;SSP5-Base-2040;04681bb9fe28b4408facb1d721820cd0;market for n-olefins;n-olefins;kilogram;0.617710447627398;0.0005416447789281069;0.00603804485357211;6.2565092592451505e-09;8.353959364986758e-09;3.6519692807101705e-06;0.6347257774803874;;;
2b4fb423557ff1bf236754634d4c7b73;GLO;SSP5-Base-2040;2b4fb423557ff1bf236754634d4c7b73;market for cucumber;cucumber;kilogram;0.9839209463163634;0.0005695725976377825;0.0012204865740276945;5.385048503431635e-09;1.5225131098579707e-08;7.048734500367077e-06;0.10683203476828068;"[{'description': 'fraction, time to transfer the reefer between different modes of transport', 'id': '68f592ea-ec5e-40c3-8c86-c952c0763fc4', 'unit': 'dimensionless', 'comment': 'Estimated value.', 'amount': 0.2, 'uncertainty type': 0, 'loc': 0.2, 'name': 'fraction_time_reefer_transfer'}, {'description': 'losses', 'id': '67d91564-dd27-4166-9796-689b78ff86ff', 'unit': 'dimensionless', 'comment': 'Calculated value based on literature.\n\nFAO suggest, that 1/3 of food produced for human consumption is lost or waste globally, which amounts in 1.3 billion tons per year (FAO, 2011, Global food losses and food waste).\n\nThe food losses vary heavily depending on the type of food and geographic location. The food losses/waste occurs in five basic stages of the lifecycle of the product;\n\n1) Agricultural production\n2) Post-harvest handling and storage\n3) Processing\n4) Distribution\n5) Consumption\n\nThe losses during the forth stage - the distribution - are recorded in the market.\n\nLiterature suggest (FAO, 2011, Global food losses and food waste), that the losses of fruits and vegetable distribution are approximately 12%. This value is rather rough estimate and it is assumed, that in the future this value will be replaced by more precise, product specific data.', 'amount': 0.12, 'uncertainty type': 0, 'loc': 0.12, 'name': 'losses'}, {'description': 'speed, average, aircraft, freight', 'id': 'e831114b-6445-4cbd-a1d6-9e6c4366fb5c', 'unit': 'km/hour', 'comment': 'Expert judgement.\n\nAverage velocity including stops.', 'amount': 700.0, 'uncertainty type': 0, 'loc': 700.0, 'name': 'speed_aircraft'}, {'description': 'speed, average, barge, freight', 'id': '16a175c6-27fe-4453-aefb-4604ea30a75d', 'unit': 'km/hour', 'comment': 'Expert judgement. The barge is in general slower than transoceanic ship.\n\nAverage velocity including stops.\n\nCross reference;\n10 km/hour (Lopez-Ruiz, H.G., 2007, Sustainable freight transport: A transport time and logistical organization approach, University of Lyon)\n\n26 km/hour (Rodrigue, J-P., Notteboom, T., Slack, B., 2013, Transport Systems, Chapter 3, Maritime Transport, http://people.hofstra.edu/geotrans/eng/ch3en/conc3en/ch3c4en.html, accessed 20150206)', 'amount': 20.0, 'uncertainty type': 0, 'loc': 20.0, 'name': 'speed_barge'}, {'description': 'speed, average, lorry, freight', 'id': '3819b90e-0c78-4ad8-9cf9-58b415446628', 'unit': 'km/hour', 'comment': 'Expert judgement.\n\nAverage velocity including stops.\n\nReference;\n45 km/hour is the default speed of lorries and trucks used to calculate delivery distances  (www.searates.com, accessed 20141201).', 'amount': 45.0, 'uncertainty type': 0, 'loc': 45.0, 'name': 'speed_lorry'}, {'description': 'speed, average, train, freight', 'id': '00c99a4c-33c7-4d15-b668-edcf67a9485c', 'unit': 'km/hour', 'comment': 'Expert judgement.\n\nAverage velocity including stops.\n\nCross reference;\n40 km/hour (Lopez-Ruiz, H.G., 2007, Sustainable freight transport: A transport time and logistical organization approach, University of Lyon)\n\n33.2 km/hour was the average speed of freight train in China in 2007 (http://www.statista.com/statistics/278404/speed-of-freight-trains-in-china/, accessed 20150206)', 'amount': 40.0, 'uncertainty type': 0, 'loc': 40.0, 'name': 'speed_train'}, {'description': 'speed, average, transoceanic ship, freight', 'id': 'fb887cc6-8e4e-4243-96a4-f177655316ca', 'unit': 'km/hour', 'comment': 'Expert judgement.\n\nAverage velocity including stops.\n\nReference;\n26 km/hour (Rodrigue, J-P., Notteboom, T., Slack, B., 2013, Transport Systems, Chapter 3, Maritime Transport, http://people.hofstra.edu/geotrans/eng/ch3en/conc3en/ch3c4en.html, accessed 20150206)', 'amount': 26.0, 'uncertainty type': 0, 'loc': 26.0, 'name': 'speed_ship'}]";;
1fe85490cbd0fa22f8b1f49aeb1378a2;GLO;SSP5-Base-2040;1fe85490cbd0fa22f8b1f49aeb1378a2;market for heat and power co-generation unit, 1MW electrical, components for electricity only;heat and power co-generation unit, 1MW electrical, components for electricity only;unit;29132.713961893394;146.18500194055503;52.32303861852053;0.0005792787353111593;0.0004729577445803103;0.4454921529341558;4257.668564790539;;;
6e7076c9b4d3775468047d1bee36d4b3;GLO;SSP5-Base-2040;6e7076c9b4d3775468047d1bee36d4b3;market for anode slime from electrorefining of copper, anode;anode slime from electrorefining of copper, anode;kilogram;13.647875811088515;0.08492075308594824;0.01845174324648044;2.9873398501290897e-07;3.954559822985049e-07;0.0003904227224346915;1.4428506422098506;;;
8d312624d4928b40d0613fd662b39004;RoW;SSP5-Base-2040;8d312624d4928b40d0613fd662b39004;market for acrylic dispersion, with water, in 58% solution;acrylic dispersion, with water, in 58% solution state;kilogram;3.3876271588049134;0.03136597625598167;0.009995552824123202;2.6862672499296172e-08;1.4751256061604585e-08;7.72170967061042e-06;0.38374055342807245;;;
e1d5aec1ddcd2f1e672fd45d47870cf3;RoW;SSP5-Base-2040;e1d5aec1ddcd2f1e672fd45d47870cf3;market for benzyl chloride;benzyl chloride;kilogram;0.8861018372990626;0.004515736854043331;0.006241355623137057;1.669353706118503e-08;9.701974430799833e-09;4.414391926932862e-06;0.5138164344076734;;;
816a0bf15e74b147cf6a7b7a363afdcb;GLO;SSP5-Base-2040;816a0bf15e74b147cf6a7b7a363afdcb;market for chipper, stationary, electric;chipper, stationary, electric;unit;82643.7942971766;62.023585362222846;8.770317258954877;3.7532405134483584e-05;3.1282600669172465e-05;0.03885341108749381;762.4371068550294;;;
d3ebe1c2d716e0131d5cc8d2b5b63f04;RoW;SSP5-Base-2040;d3ebe1c2d716e0131d5cc8d2b5b63f04;market for sulfur hexafluoride, liquid;sulfur hexafluoride, liquid;kilogram;2.9425639805766375;0.005990349204863427;0.009593110900898684;1.7566327440251547e-07;4.037031738701851e-07;0.0001423957073932717;5.239684591711129;;;
c2852822a428a4e0ba11ffc58d17e89f;GLO;SSP5-Base-2040;c2852822a428a4e0ba11ffc58d17e89f;market for toner, colour, powder;toner, colour, powder;kilogram;1.034862505476504;0.002782110400699105;0.003034878639328966;8.140644924120292e-08;2.405005413224854e-08;1.1266270914704482e-05;0.8724092090491399;;;
3f67014b8e14d9835fb8ebbdfb733ecc;GLO;SSP5-Base-2040;3f67014b8e14d9835fb8ebbdfb733ecc;market for disodium disulphite;disodium disulphite;kilogram;1.0326863419758365;0.004940051455191944;0.001960246987925016;2.6125680805093748e-08;1.2738991933651939e-08;9.481330192282018e-06;0.09608364939924374;;;
975770f48967d9f9ea82f1ac4648f7c5;GLO;SSP5-Base-2040;975770f48967d9f9ea82f1ac4648f7c5;market for dysprosium oxide;dysprosium oxide;kilogram;0.7962701299588852;0.0695971569264813;0.07406866942810339;6.395106442549234e-06;9.363788686358206e-09;3.851536387101909e-06;0.25987773790372193;;;
14e0227e764a4a098e5fd34525ccaf3f;GLO;SSP5-Base-2040;14e0227e764a4a098e5fd34525ccaf3f;market for hot water tank, 600l;hot water tank, 600l;unit;877.3848452560894;8.508711991680022;1.0210068749076189;7.1739928959159395e-06;3.750780740049731e-06;0.00519218439806425;81.591902441017;;;
087d2f214dbd5a86d7be12d8a921ef94;RoW;SSP5-Base-2040;087d2f214dbd5a86d7be12d8a921ef94;market for laterite, mineral;laterite, mineral;kilogram;0.02926430195546885;2.3368858952216304e-05;7.687350331636814e-05;3.514738081599087e-10;2.1089996071689546e-10;6.762960446288243e-08;0.002481416143106582;;;
d831c302d2613afe2d6c15cf0c45262f;GLO;SSP5-Base-2040;d831c302d2613afe2d6c15cf0c45262f;market for heat and power co-generation unit, 50kW electrical, components for electricity only;heat and power co-generation unit, 50kW electrical, components for electricity only;unit;2813.067472213488;12.045932893646121;5.509762012883258;6.462883896343475e-05;3.9637452300909095e-05;0.033067112609856814;394.7717866465649;;;
80310b5021efcb8abcf6d15a9f5ce58e;RoW;SSP5-Base-2040;80310b5021efcb8abcf6d15a9f5ce58e;market for cathode, NMC811, for Li-ion battery;cathode, NMC811, for Li-ion battery;kilogram;100.66500134533737;0.7228457320106592;1.3654068603223484;1.916310770572589e-06;1.1944586194895512e-07;7.842069533431638e-05;5.385893960652489;;;
7a7fb3150f108a6560bf657053d553b4;GLO;SSP5-Base-2040;7a7fb3150f108a6560bf657053d553b4;market for heat and power co-generation unit, 160kW electrical, components for heat only;heat and power co-generation unit, 160kW electrical, components for heat only;unit;11916.075126539381;161.55997893312443;29.088096698578873;0.00018358481057254318;8.311765679466615e-05;0.07945662047692605;1936.0126130895826;;;
afd9e5f03a4f8e1599d8f1a56edfbb9c;GLO;SSP5-Base-2040;afd9e5f03a4f8e1599d8f1a56edfbb9c;market for fava bean, organic;fava bean, organic;kilogram;0.3230449743988758;0.00032069968487976816;0.001123697746823981;1.572672104322438e-09;3.3285807127387554e-08;2.816758933990141e-06;0.032779820723410645;;;
63c1ac90c04ce17ee2378c39a2ce6849;RoW;SSP5-Base-2040;63c1ac90c04ce17ee2378c39a2ce6849;market for natural gas, low pressure;natural gas, low pressure;cubic meter;0.13509330145455675;0.00032048138520034385;0.00244193223652661;7.096584321937448e-10;1.906663411700799e-09;8.022009012738155e-07;0.3353305701302544;;;{'initial amount of fossil CO2': 5.81436e-05, 'new amount of fossil CO2': 4.2186960434693776e-05, 'new amount of biogenic CO2': 1.595663956530622e-05}
96afb7730ca314cd03d4a8433025cbfd;GLO;SSP5-Base-2040;96afb7730ca314cd03d4a8433025cbfd;market for inductor, auxilliaries and energy use;inductor, auxilliaries and energy use;kilogram;8.16464541965132;0.4698831334492056;0.8672119990169307;6.330788867134712e-07;1.1728548719487375e-07;5.1302303234055024e-05;1.762565418454578;;;
42129d6cdaa9c40096ba6af664717355;GLO;SSP5-Base-2040;42129d6cdaa9c40096ba6af664717355;market for catalytic converter, selective catalytic reduction, 200 litre;catalytic converter, selective catalytic reduction, 200 litre;unit;908.9354769762333;4.995514876112798;1.246971507111534;4.6859281313952716e-05;8.39513466258628e-06;0.010775184163398243;131.47714783105275;;;
4a22bc93a26f5eef2203d28b17abd501;RoW;SSP5-Base-2040;4a22bc93a26f5eef2203d28b17abd501;market for sodium perborate, tetrahydrate, powder;sodium perborate, tetrahydrate, powder;kilogram;0.32075640065870764;0.00016786043201605404;0.000314539237994676;4.640293058295242e-10;9.164806275130627e-09;5.056078472486176e-06;0.18619264271097796;;;
