;location;database;code;name;reference product;unit;Total (kg);Total (m3);Hazardous (kg);Hazardous (m3);ecosystem quality;human health;natural resources;parameters full;emptied;log parameters
2c27b8f0ec0b09c9831ebe8d75501621;GLO;SSP5-Base-2040;2c27b8f0ec0b09c9831ebe8d75501621;market for dimethyl carbonate;dimethyl carbonate;kilogram;1.1591878275183534;0.0011378883448286306;0.004936959330598074;2.057079426589371e-08;8.744136859826544e-09;4.041495066814368e-06;0.39780202524524133;;;
dfccfc6ac5add71bdc79f2b637b4fbf0;GLO;SSP5-Base-2040;dfccfc6ac5add71bdc79f2b637b4fbf0;market for 4-methyl-2-pentanone;4-methyl-2-pentanone;kilogram;1.1747623734885035;0.0012724714901480982;0.006919058653289648;2.506544026581581e-08;1.304649793572166e-08;5.866384021813565e-06;0.5045428531450041;;;
49946336299fce3d89a8e78a96ddedd4;GLO;SSP5-Base-2040;49946336299fce3d89a8e78a96ddedd4;market for copper cake;copper cake;kilogram;26.92326087866946;0.2257079793392308;0.0606896396014438;6.153757512631165e-07;2.768706797383438e-08;3.388147650470744e-05;0.7644145451705029;;;
5de4e6040341b76a45c93c671126ae7f;GLO;SSP5-Base-2040;5de4e6040341b76a45c93c671126ae7f;market for sanitary ceramics;sanitary ceramics;kilogram;2.113441172303749;0.0037614929190411617;0.0030774293273881197;1.6852986925012356e-08;7.428951722668064e-09;8.618207242744207e-06;0.20633200051302603;;;
e82e91c0b572e044b71a69b32bf53388;GLO;SSP5-Base-2040;e82e91c0b572e044b71a69b32bf53388;market for silver;silver;kilogram;114.6046007880588;0.4602830638212918;1.696096394959452;7.252959841200354e-06;4.105546857695598e-06;0.00444355084561758;47.92179493461672;;;
0935b911e932a1c7b2216f41f0409946;GLO;SSP5-Base-2040;0935b911e932a1c7b2216f41f0409946;market for insulated gate bipolar transistor, electric vehicle application;insulated gate bipolar transistor, electric vehicle application;kilogram;3.8480913539346515;0.038888716139951617;0.027073234071829988;2.7913952322400857e-07;7.254796109234868e-08;5.8626396192518785e-05;0.9337057976978324;;;
033147584df1e5cf6f81512cf623dccd;GLO;SSP5-Base-2040;033147584df1e5cf6f81512cf623dccd;market for maize seed, at farm;maize seed, at farm;kilogram;0.6354891719794915;0.0006372840230637496;0.0018674040542241404;8.474584546005524e-09;2.2862961487941904e-08;3.1639253839551823e-06;0.0737598852446007;;;
c054de9ed3aac8172ed3a4923ebbc274;GLO;SSP5-Base-2040;c054de9ed3aac8172ed3a4923ebbc274;market for fish residues;fish residues;kilogram;0.35548473296709154;0.00017834072822367304;0.00038073545475191483;5.001425671875999e-10;1.031077130741398e-09;4.138033120366003e-07;0.026836418733960546;;;
b94a53eea3e5b0f0e33b1ade4ec901f4;GLO;SSP5-Base-2040;b94a53eea3e5b0f0e33b1ade4ec901f4;market for transistor, surface-mounted;transistor, surface-mounted;kilogram;52.9890066553292;0.7026646730489597;0.12060846665161436;3.2456528183179447e-06;9.792736603688245e-07;0.0007797165932383847;9.464225242360929;;;
25e27cf66e6dd0dc5909e207dd2b1304;GLO;SSP5-Base-2040;25e27cf66e6dd0dc5909e207dd2b1304;market for infrastructure, for regional distribution of oil product;infrastructure, for regional distribution of oil product;unit;88746077.37597942;13592.141016020141;17142.89243639172;0.034086358475416696;0.06712307319608259;18.86606833759199;554967.8764464192;;;
0982a449d98739d5d61cb7d81bf9cc36;RoW;SSP5-Base-2040;0982a449d98739d5d61cb7d81bf9cc36;market for wheat flour;wheat flour;kilogram;0.5358615658483453;0.0005095990977539962;0.0013258491363599917;2.75611766120268e-09;3.4041487094223846e-08;2.7897450319711022e-06;0.05052500419417576;;;
8dae98bf86fa5271c78942d668f6948a;GLO;SSP5-Base-2040;8dae98bf86fa5271c78942d668f6948a;market for jute plant, harvested;jute plant, harvested;kilogram;0.24958184278931558;9.303597903233794e-05;0.00019236492258346982;4.845419496456629e-10;7.08537722277992e-09;6.045975875299198e-07;0.010255686931055608;;;
c122f81a86b251ca2e56c1b2b80a0a72;GLO;SSP5-Base-2040;c122f81a86b251ca2e56c1b2b80a0a72;market for toner module, laser printer, black/white;toner module, laser printer, black/white;unit;4.438035821975496;0.017771593089828085;0.05609896602928479;2.0482780154831347e-07;4.897730138405905e-08;2.5115315849844264e-05;0.9655389015064789;;;
f94c3e32ad3337471d91871ca21f8f64;GLO;SSP5-Base-2040;f94c3e32ad3337471d91871ca21f8f64;market for hydropower plant, reservoir, alpine region;hydropower plant, reservoir, alpine region;unit;537974807722.0602;30386762.420876727;22412827.50868706;105.17247547031957;61.77412651848013;44566.339354587224;969549039.7943243;;;
843565d2350c227b49c8a60ff4677524;GLO;SSP5-Base-2040;843565d2350c227b49c8a60ff4677524;market for weaving, synthetic fibre;weaving, synthetic fibre;kilogram;0.36726512380689924;0.00030378242744471173;0.00029518067908464537;1.0355050193920292e-08;1.866259121363706e-09;1.0188716764300217e-06;0.022781646082367317;;;
af0765000b37d1722b2ef084eae21783;GLO;SSP5-Base-2040;af0765000b37d1722b2ef084eae21783;market for electrolyte, for solid oxide fuel cell;electrolyte, for solid oxide fuel cell;kilogram;5.811700507989178;0.06642327288432114;0.01049820417548354;6.604563504130802e-08;3.516239881667781e-08;2.414126709838054e-05;1.0767921498989663;;;
7d91dbf0dda07e9b84eb6564e2a3c35d;GLO;SSP5-Base-2040;7d91dbf0dda07e9b84eb6564e2a3c35d;market for mischmetal;mischmetal;kilogram;23.267295532875345;2.308004536913331;2.8763653263095863;0.00019977069606738482;3.17603495554418e-07;0.0001649714831886611;1307.359232859637;;;
2a484ad3fb21bbebd8fb7fc24da60985;GLO;SSP5-Base-2040;2a484ad3fb21bbebd8fb7fc24da60985;market for nuclear fuel element, for pressure water reactor, UO2 4.0% & MOX;nuclear fuel element, for pressure water reactor, UO2 4.0% & MOX;kilogram;644.2554973853764;3.5806143119932905;1.9081971493398222;0.061295251293666184;9.31259644134249e-06;0.016235112898800363;207.62101211912005;;;
01d59f12e272b87bf58589cdb975fe97;GLO;SSP5-Base-2040;01d59f12e272b87bf58589cdb975fe97;market for alfalfa-grass silage;alfalfa-grass silage;kilogram;0.2245469298766033;0.0003752634331465457;0.0005757562897073067;7.573272217633279e-10;1.0275905862877468e-08;7.666799202568865e-07;0.01786399762258025;;;
aa207a18b9142782da5d7e2b7f485f28;GLO;SSP5-Base-2040;aa207a18b9142782da5d7e2b7f485f28;market for internet access equipment;internet access equipment;unit;2.8283304777409093;0.03807044632293012;0.07485715390308421;1.0880688088515704e-07;4.1326439188715764e-08;3.68288587060053e-05;0.42428361120203084;;;
2667b22e812aec557fefca4186c84496;GLO;SSP5-Base-2040;2667b22e812aec557fefca4186c84496;market for collector field area, solar tower power plant, 20 MW;collector field area, solar tower power plant, 20 MW;unit;75177365.32131064;86578.15989689091;24829.825667076206;0.09259787674316611;0.08650780385162793;97.07190773278121;2113470.89517398;;;
a8e38c246d88c9f2aff00eed34addb92;GLO;SSP5-Base-2040;a8e38c246d88c9f2aff00eed34addb92;market for sanitary landfill facility;sanitary landfill facility;unit;9347959.462908633;37973.71104384317;49375.75500689215;0.03899331792842938;0.06543219589718292;20.186854630132906;2992077.0579483476;;;
65558068053a6b90002c0bd52fbb898c;GLO;SSP5-Base-2040;65558068053a6b90002c0bd52fbb898c;market for cocoa bean;cocoa bean;kilogram;5.429253747795183;0.0025072736448746415;0.0036027636391221898;1.0104993157246326e-08;3.127720300432667e-07;3.6854839057930506e-05;0.13241833380891124;"[{'description': 'fraction, time to transfer the reefer between different modes of transport', 'id': '68f592ea-ec5e-40c3-8c86-c952c0763fc4', 'unit': 'dimensionless', 'comment': 'Estimated value.\n\nThe time the reefer is in operation is calculated using different average speed of all the different modes of transport (train, lorry, ship, etc.). This parameter presents an additional time during which the reefer is in operation, but is not being transported; the time when the reefer is being transfered from one type of transport to another. ', 'amount': 0.2, 'uncertainty type': 0, 'loc': 0.2, 'name': 'fraction_time_reefer_transfer'}, {'description': 'losses', 'id': '67d91564-dd27-4166-9796-689b78ff86ff', 'unit': 'dimensionless', 'comment': 'Calculated value based on literature.\n\nFAO suggest, that 1/3 of food produced for human consumption is lost or waste globally, which amounts in 1.3 billion tons per year (FAO, 2011, Global food losses and food waste).\n\nThe food losses vary heavily depending on the type of food and geographic location. The food losses/waste occurs in five basic stages of the lifecycle of the product;\n\n1) Agricultural production\n2) Post-harvest handling and storage\n3) Processing\n4) Distribution\n5) Consumption\n\nThe losses during the forth stage - the distribution - are recorded in the market.\n\nLiterature suggest (FAO, 2011, Global food losses and food waste), that the losses of fruits and vegetable distribution are approximately 12%. This value is rather rough estimate and it is assumed, that in the future this value will be replaced by more precise, product specific data.', 'amount': 0.12, 'uncertainty type': 0, 'loc': 0.12, 'name': 'losses'}, {'description': 'speed, average, aircraft, freight', 'id': 'e831114b-6445-4cbd-a1d6-9e6c4366fb5c', 'unit': 'km/hour', 'comment': 'Expert judgement.\n\nAverage velocity including stops.', 'amount': 700.0, 'uncertainty type': 0, 'loc': 700.0, 'name': 'speed_aircraft'}, {'description': 'speed, average, barge, freight', 'id': '16a175c6-27fe-4453-aefb-4604ea30a75d', 'unit': 'km/hour', 'comment': 'Expert judgement. The barge is in general slower than transoceanic ship.\n\nAverage velocity including stops.\n\nCross reference;\n10 km/hour (Lopez-Ruiz, H.G., 2007, Sustainable freight transport: A transport time and logistical organization approach, University of Lyon)\n\n26 km/hour (Rodrigue, J-P., Notteboom, T., Slack, B., 2013, Transport Systems, Chapter 3, Maritime Transport, http://people.hofstra.edu/geotrans/eng/ch3en/conc3en/ch3c4en.html, accessed 20150206)', 'amount': 20.0, 'uncertainty type': 0, 'loc': 20.0, 'name': 'speed_barge'}, {'description': 'speed, average, lorry, freight', 'id': '3819b90e-0c78-4ad8-9cf9-58b415446628', 'unit': 'km/hour', 'comment': 'Expert judgement.\n\nAverage velocity including stops.\n\nReference;\n45 km/hour is the default speed of lorries and trucks used to calculate delivery distances  (www.searates.com, accessed 20141201).', 'amount': 45.0, 'uncertainty type': 0, 'loc': 45.0, 'name': 'speed_lorry'}, {'description': 'speed, average, train, freight', 'id': '00c99a4c-33c7-4d15-b668-edcf67a9485c', 'unit': 'km/hour', 'comment': 'Expert judgement.\n\nAverage velocity including stops.\n\nCross reference;\n40 km/hour (Lopez-Ruiz, H.G., 2007, Sustainable freight transport: A transport time and logistical organization approach, University of Lyon)\n\n33.2 km/hour was the average speed of freight train in China in 2007 (http://www.statista.com/statistics/278404/speed-of-freight-trains-in-china/, accessed 20150206)', 'amount': 40.0, 'uncertainty type': 0, 'loc': 40.0, 'name': 'speed_train'}, {'description': 'speed, average, transoceanic ship, freight', 'id': 'fb887cc6-8e4e-4243-96a4-f177655316ca', 'unit': 'km/hour', 'comment': 'Expert judgement.\n\nAverage velocity including stops.\n\nReference;\n26 km/hour (Rodrigue, J-P., Notteboom, T., Slack, B., 2013, Transport Systems, Chapter 3, Maritime Transport, http://people.hofstra.edu/geotrans/eng/ch3en/conc3en/ch3c4en.html, accessed 20150206)', 'amount': 26.0, 'uncertainty type': 0, 'loc': 26.0, 'name': 'speed_ship'}]";;
bd7dddfe46e52010e6555a437bd04f4e;RoW;SSP5-Base-2040;bd7dddfe46e52010e6555a437bd04f4e;market for sulfuric acid;sulfuric acid;kilogram;0.300861477382729;0.0008026186072351182;0.0007651848847053114;2.6170164573251796e-09;3.1917987415204736e-09;2.914333977738801e-06;0.019066547791018462;;;
a153d28b2dc270ef389ce6385895c067;GLO;SSP5-Base-2040;a153d28b2dc270ef389ce6385895c067;market for metal catalyst for catalytic converter;metal catalyst for catalytic converter;kilogram;13118.768543914392;46.25179599379415;35.653491126112336;0.00010791248834483594;0.000605627330032693;0.5848275273302589;3354.6875073196784;;;
41fe72f5bcac61f3b2c25950e3da7e12;RoW;SSP5-Base-2040;41fe72f5bcac61f3b2c25950e3da7e12;market for concrete, medium strength;concrete, medium strength;cubic meter;455.14139917970783;0.3389432526021018;0.4086526482040451;1.0534160200908248e-06;1.3988895476474366e-06;0.0005851576168104029;17.360064652742473;;;
82ea1e2f9d6e77520740508c6ee4a646;RoW;SSP5-Base-2040;82ea1e2f9d6e77520740508c6ee4a646;market for diesel, low-sulfur;diesel, low-sulfur;kilogram;0.17219747145068562;0.0010248663852649392;0.005304395056162722;2.686404021400574e-09;4.969600018891012e-09;1.8192377281689947e-06;0.5180577516567832;;True;{'fossil CO2 per kg fuel': 3.012312623957081, 'non-fossil CO2 per kg fuel': 0.13545659835550675, 'lower heating value': 42.99999999999999}
89228ef0c848f289ebaab135ca2524a2;GLO;SSP5-Base-2040;89228ef0c848f289ebaab135ca2524a2;market for aluminium removed by turning, primarily dressing, computer numerical controlled;aluminium removed by turning, primarily dressing, computer numerical controlled;kilogram;9.389607449176646;0.17814653315357715;0.45095294621447973;2.045985486343423e-07;5.104583778071258e-08;3.215657216208551e-05;0.5813898602493972;;;
19a251c8ac9718ebb7d278134b06ed10;GLO;SSP5-Base-2040;19a251c8ac9718ebb7d278134b06ed10;market for EDTA, ethylenediaminetetraacetic acid;EDTA, ethylenediaminetetraacetic acid;kilogram;1.771713763896896;0.007852690674167988;0.009195238598817457;3.891939807787688e-08;1.630044342164077e-08;7.588500558109165e-06;0.5408932944260942;;;
12a471f5d5d497210a37edb01fb90936;GLO;SSP5-Base-2040;12a471f5d5d497210a37edb01fb90936;market for hexane;hexane;kilogram;0.3239771100722787;0.0004246101238210083;0.003703318525699251;2.7338366101404546e-09;3.7237117445595147e-09;1.6339175626334922e-06;0.39784148296887334;;;
a4e7a4dfb3c936e112491275acb5d2a5;GLO;SSP5-Base-2040;a4e7a4dfb3c936e112491275acb5d2a5;market for aluminium chloride;aluminium chloride;kilogram;1.3277851769707785;0.007152843421741001;0.002442278673800265;7.492750024320285e-08;1.710310862280144e-08;1.1025184539958678e-05;0.2349358819518096;;;
5099d24dacce1dac269899adf4665e28;GLO;SSP5-Base-2040;5099d24dacce1dac269899adf4665e28;market for cyclic N-compound;cyclic N-compound;kilogram;7.1896621631120095;0.02959964615645065;0.015685139157958296;1.6275181576812533e-07;6.328669379555488e-08;2.922131350105408e-05;1.8753179108133133;;;
e6ba5991b1ecab06c9e5ebc33af41364;GLO;SSP5-Base-2040;e6ba5991b1ecab06c9e5ebc33af41364;market for cast iron;cast iron;kilogram;1.004293960256842;0.0009344648222349229;0.0016238821819649562;1.0107533460002392e-08;7.150247406887553e-09;1.959012852227008e-05;0.22467145674094305;;;
2f298d6798217ca204f60bdc1efe8ea1;GLO;SSP5-Base-2040;2f298d6798217ca204f60bdc1efe8ea1;market for sodium hydroxide, without water, in 50% solution state;sodium hydroxide, without water, in 50% solution state;kilogram;0.8301700404942576;0.009668908403855307;0.0009111397880143118;2.9669776810797316e-08;4.269978074091231e-09;2.152501311030777e-06;0.08630031267532684;;;
f6fb46049966e320371657e358732f71;RoW;SSP5-Base-2040;f6fb46049966e320371657e358732f71;market for structural timber;structural timber;cubic meter;216.07021800188892;0.25380028965564894;0.7230810988122812;1.5214177037790055e-06;1.6044188312351533e-05;0.0005984491401835248;13.566923181464276;;;
5cba8c964b01b90b8acd19c7a023c464;GLO;SSP5-Base-2040;5cba8c964b01b90b8acd19c7a023c464;market for stibnite concentrate;stibnite concentrate;kilogram;4.072921841316112;0.008367614147720102;0.003819145594051299;7.592727983027381e-08;3.538031174001083e-08;5.087740006670166e-05;0.29339380061647863;;;
3b068c79e45729bbb6199825acd0cc98;RoW;SSP5-Base-2040;3b068c79e45729bbb6199825acd0cc98;market for flyash brick;flyash brick;kilogram;0.8191796946056664;0.006609175438023241;0.013039610869893959;4.560316741087656e-09;3.18007049567704e-09;4.144000925406229e-06;0.08333211825613115;;;
1ec43c5320e3681d56bd863434ff21ab;GLO;SSP5-Base-2040;1ec43c5320e3681d56bd863434ff21ab;market for basalt;basalt;kilogram;0.025725390235638218;1.813009139170603e-05;6.271196890120069e-05;1.551339952730772e-10;1.4001271775119782e-10;4.5056888286667854e-08;0.18470513948386041;;;
555483f89274428fecc646c962e26084;GLO;SSP5-Base-2040;555483f89274428fecc646c962e26084;market for vinyl acetate;vinyl acetate;kilogram;1.141115603538183;0.0013910403769244958;0.005678870502451562;3.347908696665428e-08;9.853970587267165e-09;4.54440678060962e-06;0.49629137355627645;;;
7ed77d4d0f84d19017e576d8237514af;GLO;SSP5-Base-2040;7ed77d4d0f84d19017e576d8237514af;market for radish;radish;kilogram;1.1754965166677112;0.0010303111571340888;0.0025432034407903946;1.0198453251655304e-08;3.5493147189762746e-08;1.6422636280067655e-05;0.2401162545319221;"[{'description': 'fraction, time to transfer the reefer between different modes of transport', 'id': '68f592ea-ec5e-40c3-8c86-c952c0763fc4', 'unit': 'dimensionless', 'comment': 'Estimated value.', 'amount': 0.2, 'uncertainty type': 0, 'loc': 0.2, 'name': 'fraction_time_reefer_transfer'}, {'description': 'losses', 'id': '67d91564-dd27-4166-9796-689b78ff86ff', 'unit': 'dimensionless', 'comment': 'Calculated value based on literature.\n\nFAO suggest, that 1/3 of food produced for human consumption is lost or waste globally, which amounts in 1.3 billion tons per year (FAO, 2011, Global food losses and food waste).\n\nThe food losses vary heavily depending on the type of food and geographic location. The food losses/waste occurs in five basic stages of the lifecycle of the product;\n\n1) Agricultural production\n2) Post-harvest handling and storage\n3) Processing\n4) Distribution\n5) Consumption\n\nThe losses during the forth stage - the distribution - are recorded in the market.\n\nLiterature suggest (FAO, 2011, Global food losses and food waste), that the losses of fruits and vegetable distribution are approximately 12%. This value is rather rough estimate and it is assumed, that in the future this value will be replaced by more precise, product specific data.', 'amount': 0.12, 'uncertainty type': 0, 'loc': 0.12, 'name': 'losses'}, {'description': 'speed, average, aircraft, freight', 'id': 'e831114b-6445-4cbd-a1d6-9e6c4366fb5c', 'unit': 'km/hour', 'comment': 'Expert judgement.\n\nAverage velocity including stops.', 'amount': 700.0, 'uncertainty type': 0, 'loc': 700.0, 'name': 'speed_aircraft'}, {'description': 'speed, average, barge, freight', 'id': '16a175c6-27fe-4453-aefb-4604ea30a75d', 'unit': 'km/hour', 'comment': 'Expert judgement. The barge is in general slower than transoceanic ship.\n\nAverage velocity including stops.\n\nCross reference;\n10 km/hour (Lopez-Ruiz, H.G., 2007, Sustainable freight transport: A transport time and logistical organization approach, University of Lyon)\n\n26 km/hour (Rodrigue, J-P., Notteboom, T., Slack, B., 2013, Transport Systems, Chapter 3, Maritime Transport, http://people.hofstra.edu/geotrans/eng/ch3en/conc3en/ch3c4en.html, accessed 20150206)', 'amount': 20.0, 'uncertainty type': 0, 'loc': 20.0, 'name': 'speed_barge'}, {'description': 'speed, average, lorry, freight', 'id': '3819b90e-0c78-4ad8-9cf9-58b415446628', 'unit': 'km/hour', 'comment': 'Expert judgement.\n\nAverage velocity including stops.\n\nReference;\n45 km/hour is the default speed of lorries and trucks used to calculate delivery distances  (www.searates.com, accessed 20141201).', 'amount': 45.0, 'uncertainty type': 0, 'loc': 45.0, 'name': 'speed_lorry'}, {'description': 'speed, average, train, freight', 'id': '00c99a4c-33c7-4d15-b668-edcf67a9485c', 'unit': 'km/hour', 'comment': 'Expert judgement.\n\nAverage velocity including stops.\n\nCross reference;\n40 km/hour (Lopez-Ruiz, H.G., 2007, Sustainable freight transport: A transport time and logistical organization approach, University of Lyon)\n\n33.2 km/hour was the average speed of freight train in China in 2007 (http://www.statista.com/statistics/278404/speed-of-freight-trains-in-china/, accessed 20150206)', 'amount': 40.0, 'uncertainty type': 0, 'loc': 40.0, 'name': 'speed_train'}, {'description': 'speed, average, transoceanic ship, freight', 'id': 'fb887cc6-8e4e-4243-96a4-f177655316ca', 'unit': 'km/hour', 'comment': 'Expert judgement.\n\nAverage velocity including stops.\n\nReference;\n26 km/hour (Rodrigue, J-P., Notteboom, T., Slack, B., 2013, Transport Systems, Chapter 3, Maritime Transport, http://people.hofstra.edu/geotrans/eng/ch3en/conc3en/ch3c4en.html, accessed 20150206)', 'amount': 26.0, 'uncertainty type': 0, 'loc': 26.0, 'name': 'speed_ship'}]";;
683f869780ee789d92d3b2a737534a44;GLO;SSP5-Base-2040;683f869780ee789d92d3b2a737534a44;market for steel, chromium steel 18/8, hot rolled;steel, chromium steel 18/8, hot rolled;kilogram;3.5899083375508973;0.01593016869210359;0.0038513371109336796;5.704745859895185e-08;2.2434376128623798e-08;4.412831865780977e-05;0.3832766170160533;;;
4537fa8ee7e18b21c571c30954ef90c2;GLO;SSP5-Base-2040;4537fa8ee7e18b21c571c30954ef90c2;market for potassium permanganate;potassium permanganate;kilogram;1.6444170442317145;0.0019073932446648468;0.002222224492365612;2.9115705768535704e-08;6.942135454254934e-09;3.358883747825994e-06;0.12518201302221105;;;
22ca1e4b597f6f8618b1b2e614df2954;GLO;SSP5-Base-2040;22ca1e4b597f6f8618b1b2e614df2954;market for tellurium, semiconductor-grade;tellurium, semiconductor-grade;kilogram;3.989055801899391;0.06660864828148562;0.005973353569982643;2.249817091811482e-07;7.680880950761069e-08;6.692955448488464e-05;0.5126000281717126;;;
ce3836ce533841646352e6e52e5aec46;RoW;SSP5-Base-2040;ce3836ce533841646352e6e52e5aec46;market for lime, packed;lime, packed;kilogram;0.09676380224983697;5.607221878946608e-05;0.00013530787047424993;3.966352249190926e-10;4.708299227316127e-10;2.279333407823185e-07;0.004601906178454398;;;
8f7d47730da3b998355ae79a82610c7b;RoW;SSP5-Base-2040;8f7d47730da3b998355ae79a82610c7b;market for cork, raw;cork, raw;kilogram;0.058199578098425256;0.00018559013089555724;0.00013635041040718803;9.396429975880793e-11;4.209300797849163e-08;7.955173123002876e-08;0.004118573732014868;;;
4856268a9526e6e3922ae86844815bf7;GLO;SSP5-Base-2040;4856268a9526e6e3922ae86844815bf7;market for skidder;skidder;unit;40679.7479461445;522.9794184822088;86.79684624640005;0.0007449423591848056;0.00028259922800609954;0.29704574524236416;5887.492549684283;;;
c09ff9913ddd9c6739f44bd3665cfa0f;RoW;SSP5-Base-2040;c09ff9913ddd9c6739f44bd3665cfa0f;market for bundle, energy wood, measured as dry mass;bundle, energy wood, measured as dry mass;kilogram;0.09019165817188235;0.00019160450182891686;0.00041988270422320623;1.8354935243212607e-10;7.547072592687174e-09;1.1742934688898424e-07;0.006448574624367845;;;
3f04052884c4fd0ef7386035c61cabaa;GLO;SSP5-Base-2040;3f04052884c4fd0ef7386035c61cabaa;market for polar fleece, energy use only;polar fleece, energy use only;kilogram;0.6040475032244697;0.0014921131594927551;0.0018473175527764676;1.4038472604663926e-07;2.1996950693515242e-08;9.924199240694493e-06;0.21911210813718737;;;
f7246260eab45ab3c87506e982b1e3e8;GLO;SSP5-Base-2040;f7246260eab45ab3c87506e982b1e3e8;market for isophthalic acid based unsaturated polyester resin;isophthalic acid based unsaturated polyester resin;kilogram;1.6415931952911076;0.008905175003175567;0.00919868269809852;2.6802254471437448e-08;1.4664435854689067e-08;6.909789784543989e-06;0.6932652313590834;;;
e06eed9912af66347d920075212adc8c;GLO;SSP5-Base-2040;e06eed9912af66347d920075212adc8c;market for gold-silver, ingot;gold-silver, ingot;kilogram;19584.383055778562;273.8096621071967;24.45242653230335;3.674260743477706e-05;0.00032151963712404805;0.23003715874000247;943.1298511120917;;;
0bb1b155f3db9bb2bde3e25e4f8bb608;GLO;SSP5-Base-2040;0bb1b155f3db9bb2bde3e25e4f8bb608;market for dryer;dryer;unit;197.13122489051636;3.089212138301088;1.2417767690073966;2.3528636964027273e-06;1.4137316819705212e-06;0.001306360980382906;19.337290123965346;;;
fdc046cf75593ebe477e2d07e8285cb9;GLO;SSP5-Base-2040;fdc046cf75593ebe477e2d07e8285cb9;market for storage, 10'000 l;storage, 10'000 l;unit;3427.099600887321;57.89584023538803;9.762707883652968;4.416667068876425e-05;2.213413916049473e-05;0.02374448919219147;587.0490588647126;;;
2d84b375d597e8610215031178e3992a;RoW;SSP5-Base-2040;2d84b375d597e8610215031178e3992a;market for ammonium carbonate;ammonium carbonate;kilogram;0.7250127245663378;0.0008328175329781544;0.0013429621207227474;1.0420831484972607e-08;8.533031090611432e-09;3.890576023795322e-06;0.14021366262993082;;;
4c47fb2e57f28bb0ec8f613c349a16d5;RoW;SSP5-Base-2040;4c47fb2e57f28bb0ec8f613c349a16d5;market for silicon, single crystal, Czochralski process, electronics;silicon, single crystal, Czochralski process, electronics;kilogram;69.16251319794016;0.13223328244440163;0.126240509964348;6.958969471309033e-06;9.458240538911187e-07;0.0004838276014892927;13.871323184723757;;;
079c76af7a1f3a8cc4b6eea34ca9b1dc;RoW;SSP5-Base-2040;079c76af7a1f3a8cc4b6eea34ca9b1dc;market for pulpwood, softwood, measured as solid wood under bark;pulpwood, softwood, measured as solid wood under bark;cubic meter;20.986001477255527;0.0465832136198738;0.1528482133706857;7.939863642996912e-08;4.538796911259513e-06;4.88902147151838e-05;2.363125138338534;;;
60eccfb05dccf174b2561c7776f81973;GLO;SSP5-Base-2040;60eccfb05dccf174b2561c7776f81973;market for fosetyl-Al;fosetyl-Al;kilogram;6.162036417107776;0.03636312456535355;0.012807821470942197;1.251134288736004e-07;4.2100549507691113e-08;1.991079346004241e-05;0.6920897094042935;;;
55ab5aef2e943c52991b7c83af6bfd6c;GLO;SSP5-Base-2040;55ab5aef2e943c52991b7c83af6bfd6c;market for furnace, logs, hardwood storage area, 30kW;furnace, logs, hardwood storage area, 30kW;unit;4315.928209479556;11.564320027048137;4.7417613853852405;1.5763428423333056e-05;1.009313042987382e-05;0.00938149318820575;167.01018012570287;;;
