;location;database;code;name;reference product;unit;Total (kg);Total (m3);Hazardous (kg);Hazardous (m3);ecosystem quality;human health;natural resources;parameters full;emptied;log parameters
b7d2e705170f4abd8efad8dbc905cd83;World;SSP5-Base-2040;b7d2e705170f4abd8efad8dbc905cd83;market for cement mortar;cement mortar;kilogram;0.1882748345382077;0.00012366454879882187;0.0002348373137871904;9.344885141356654e-10;1.1225003797621718e-09;4.461667146591748e-07;0.011780091775524276;;;
2aa2df40f4420ea92842c24869f4f396;GLO;SSP5-Base-2040;2aa2df40f4420ea92842c24869f4f396;market for exhaust air valve, in-wall housing, plastic/steel, DN 125;exhaust air valve, in-wall housing, plastic/steel, DN 125;unit;2.4973911836032077;0.029538200723989296;0.010103194615490757;2.0540612446043547e-08;1.3167573975875392e-08;1.0048344439748236e-05;0.23437923901747273;;;
1a3af6c63f889db2d2f02ec5f023cc83;GLO;SSP5-Base-2040;1a3af6c63f889db2d2f02ec5f023cc83;market for glass, for liquid crystal display;glass, for liquid crystal display;kilogram;1.4630959387162248;0.003400309304367739;0.0060968628310052835;8.33946038666561e-08;2.3494029619213862e-08;1.5234433457455952e-05;1.0427063424445469;;;
e5008c3d707688112dc1bd2d309b4bdd;GLO;SSP5-Base-2040;e5008c3d707688112dc1bd2d309b4bdd;market for tomato, processing grade;tomato, processing grade;kilogram;0.9108052019415318;0.00023568040034762419;0.0004657584387008744;7.425708073191059e-10;2.6582510284810133e-09;6.205407340596255e-07;0.017456975969255478;"[{'description': 'fraction, time to transfer the reefer between different modes of transport', 'id': '68f592ea-ec5e-40c3-8c86-c952c0763fc4', 'unit': 'dimensionless', 'comment': 'Estimated value.', 'amount': 0.2, 'uncertainty type': 0, 'loc': 0.2, 'name': 'fraction_time_reefer_transfer'}, {'description': 'losses', 'id': '67d91564-dd27-4166-9796-689b78ff86ff', 'unit': 'dimensionless', 'comment': 'Calculated value based on literature.\n\nFAO suggest, that 1/3 of food produced for human consumption is lost or waste globally, which amounts in 1.3 billion tons per year (FAO, 2011, Global food losses and food waste).\n\nThe food losses vary heavily depending on the type of food and geographic location. The food losses/waste occurs in five basic stages of the lifecycle of the product;\n\n1) Agricultural production\n2) Post-harvest handling and storage\n3) Processing\n4) Distribution\n5) Consumption\n\nThe losses during the forth stage - the distribution - are recorded in the market.\n\nLiterature suggest (FAO, 2011, Global food losses and food waste), that the losses of fruits and vegetable distribution are approximately 12%. This value is rather rough estimate and it is assumed, that in the future this value will be replaced by more precise, product specific data.', 'amount': 0.12, 'uncertainty type': 0, 'loc': 0.12, 'name': 'losses'}, {'description': 'speed, average, aircraft, freight', 'id': 'e831114b-6445-4cbd-a1d6-9e6c4366fb5c', 'unit': 'km/hour', 'comment': 'Expert judgement.\n\nAverage velocity including stops.', 'amount': 700.0, 'uncertainty type': 0, 'loc': 700.0, 'name': 'speed_aircraft'}, {'description': 'speed, average, barge, freight', 'id': '16a175c6-27fe-4453-aefb-4604ea30a75d', 'unit': 'km/hour', 'comment': 'Expert judgement. The barge is in general slower than transoceanic ship.\n\nAverage velocity including stops.\n\nCross reference;\n10 km/hour (Lopez-Ruiz, H.G., 2007, Sustainable freight transport: A transport time and logistical organization approach, University of Lyon)\n\n26 km/hour (Rodrigue, J-P., Notteboom, T., Slack, B., 2013, Transport Systems, Chapter 3, Maritime Transport, http://people.hofstra.edu/geotrans/eng/ch3en/conc3en/ch3c4en.html, accessed 20150206)', 'amount': 20.0, 'uncertainty type': 0, 'loc': 20.0, 'name': 'speed_barge'}, {'description': 'speed, average, lorry, freight', 'id': '3819b90e-0c78-4ad8-9cf9-58b415446628', 'unit': 'km/hour', 'comment': 'Expert judgement.\n\nAverage velocity including stops.\n\nReference;\n45 km/hour is the default speed of lorries and trucks used to calculate delivery distances  (www.searates.com, accessed 20141201).', 'amount': 45.0, 'uncertainty type': 0, 'loc': 45.0, 'name': 'speed_lorry'}, {'description': 'speed, average, train, freight', 'id': '00c99a4c-33c7-4d15-b668-edcf67a9485c', 'unit': 'km/hour', 'comment': 'Expert judgement.\n\nAverage velocity including stops.\n\nCross reference;\n40 km/hour (Lopez-Ruiz, H.G., 2007, Sustainable freight transport: A transport time and logistical organization approach, University of Lyon)\n\n33.2 km/hour was the average speed of freight train in China in 2007 (http://www.statista.com/statistics/278404/speed-of-freight-trains-in-china/, accessed 20150206)', 'amount': 40.0, 'uncertainty type': 0, 'loc': 40.0, 'name': 'speed_train'}, {'description': 'speed, average, transoceanic ship, freight', 'id': 'fb887cc6-8e4e-4243-96a4-f177655316ca', 'unit': 'km/hour', 'comment': 'Expert judgement.\n\nAverage velocity including stops.\n\nReference;\n26 km/hour (Rodrigue, J-P., Notteboom, T., Slack, B., 2013, Transport Systems, Chapter 3, Maritime Transport, http://people.hofstra.edu/geotrans/eng/ch3en/conc3en/ch3c4en.html, accessed 20150206)', 'amount': 26.0, 'uncertainty type': 0, 'loc': 26.0, 'name': 'speed_ship'}]";;
9e9c0105e64eb9c9127d52cf4115da9c;GLO;SSP5-Base-2040;9e9c0105e64eb9c9127d52cf4115da9c;market for mint;mint;kilogram;0.93890398140094;0.00032805195461063;0.0006834925889711947;1.2329854010657623e-09;7.518891031626764e-09;1.1912488799110808e-06;0.02557430074968762;"[{'description': 'fraction, time to transfer the reefer between different modes of transport', 'id': '68f592ea-ec5e-40c3-8c86-c952c0763fc4', 'unit': 'dimensionless', 'comment': 'Estimated value.\n\nThe time the reefer is in operation is calculated using different average speed of all the different modes of transport (train, lorry, ship, etc.). This parameter presents an additional time during which the reefer is in operation, but is not being transported; the time when the reefer is being transfered from one type of transport to another. ', 'amount': 0.2, 'uncertainty type': 0, 'loc': 0.2, 'name': 'fraction_time_reefer_transfer'}, {'description': 'losses', 'id': '67d91564-dd27-4166-9796-689b78ff86ff', 'unit': 'dimensionless', 'comment': 'Calculated value based on literature.\n\nFAO suggest, that 1/3 of food produced for human consumption is lost or waste globally, which amounts in 1.3 billion tons per year (FAO, 2011, Global food losses and food waste).\n\nThe food losses vary heavily depending on the type of food and geographic location. The food losses/waste occurs in five basic stages of the lifecycle of the product;\n\n1) Agricultural production\n2) Post-harvest handling and storage\n3) Processing\n4) Distribution\n5) Consumption\n\nThe losses during the forth stage - the distribution - are recorded in the market.\n\nLiterature suggest (FAO, 2011, Global food losses and food waste), that the losses of fruits and vegetable distribution are approximately 12%. This value is rather rough estimate and it is assumed, that in the future this value will be replaced by more precise, product specific data.', 'amount': 0.12, 'uncertainty type': 0, 'loc': 0.12, 'name': 'losses'}, {'description': 'speed, average, aircraft, freight', 'id': 'e831114b-6445-4cbd-a1d6-9e6c4366fb5c', 'unit': 'km/hour', 'comment': 'Expert judgement.\n\nAverage velocity including stops.', 'amount': 700.0, 'uncertainty type': 0, 'loc': 700.0, 'name': 'speed_aircraft'}, {'description': 'speed, average, barge, freight', 'id': '16a175c6-27fe-4453-aefb-4604ea30a75d', 'unit': 'km/hour', 'comment': 'Expert judgement. The barge is in general slower than transoceanic ship.\n\nAverage velocity including stops.\n\nCross reference;\n10 km/hour (Lopez-Ruiz, H.G., 2007, Sustainable freight transport: A transport time and logistical organization approach, University of Lyon)\n\n26 km/hour (Rodrigue, J-P., Notteboom, T., Slack, B., 2013, Transport Systems, Chapter 3, Maritime Transport, http://people.hofstra.edu/geotrans/eng/ch3en/conc3en/ch3c4en.html, accessed 20150206)', 'amount': 20.0, 'uncertainty type': 0, 'loc': 20.0, 'name': 'speed_barge'}, {'description': 'speed, average, lorry, freight', 'id': '3819b90e-0c78-4ad8-9cf9-58b415446628', 'unit': 'km/hour', 'comment': 'Expert judgement.\n\nAverage velocity including stops.\n\nReference;\n45 km/hour is the default speed of lorries and trucks used to calculate delivery distances  (www.searates.com, accessed 20141201).', 'amount': 45.0, 'uncertainty type': 0, 'loc': 45.0, 'name': 'speed_lorry'}, {'description': 'speed, average, train, freight', 'id': '00c99a4c-33c7-4d15-b668-edcf67a9485c', 'unit': 'km/hour', 'comment': 'Expert judgement.\n\nAverage velocity including stops.\n\nCross reference;\n40 km/hour (Lopez-Ruiz, H.G., 2007, Sustainable freight transport: A transport time and logistical organization approach, University of Lyon)\n\n33.2 km/hour was the average speed of freight train in China in 2007 (http://www.statista.com/statistics/278404/speed-of-freight-trains-in-china/, accessed 20150206)', 'amount': 40.0, 'uncertainty type': 0, 'loc': 40.0, 'name': 'speed_train'}, {'description': 'speed, average, transoceanic ship, freight', 'id': 'fb887cc6-8e4e-4243-96a4-f177655316ca', 'unit': 'km/hour', 'comment': 'Expert judgement.\n\nAverage velocity including stops.\n\nReference;\n26 km/hour (Rodrigue, J-P., Notteboom, T., Slack, B., 2013, Transport Systems, Chapter 3, Maritime Transport, http://people.hofstra.edu/geotrans/eng/ch3en/conc3en/ch3c4en.html, accessed 20150206)', 'amount': 26.0, 'uncertainty type': 0, 'loc': 26.0, 'name': 'speed_ship'}]";;
106606494845f6929e1c94c1fb7de7ba;RoW;SSP5-Base-2040;106606494845f6929e1c94c1fb7de7ba;market for ethylene dichloride;ethylene dichloride;kilogram;0.7256836305525831;0.005376904643271898;0.0030644094152802353;1.593368948700117e-08;4.801324932359378e-09;2.3660679373056406e-06;0.22750476630351885;;;
01325356fdc88b89e81180cc2a30b0e2;GLO;SSP5-Base-2040;01325356fdc88b89e81180cc2a30b0e2;market for natural gas, high pressure, vehicle grade;natural gas, high pressure, vehicle grade;kilogram;0.13445984768862956;0.00038130907236476303;0.0030930694253178907;4.072552782632386e-09;2.686229562415654e-09;1.1225324768953156e-06;0.4570338250827985;;;
9ac653e7afabf2c2bb6026f22f7edc8d;GLO;SSP5-Base-2040;9ac653e7afabf2c2bb6026f22f7edc8d;market for propionic acid;propionic acid;kilogram;0.7003966125960117;0.0008440507812466292;0.005284585300092058;3.608703116084138e-08;8.447937173906014e-09;3.815184268177192e-06;0.4447467778871289;;;
03bdcafa6ca2fbbb6ba2ed5a03d0a4b5;GLO;SSP5-Base-2040;03bdcafa6ca2fbbb6ba2ed5a03d0a4b5;market for electronic component, active, unspecified;electronic component, active, unspecified;kilogram;183.31122372120495;7.317441163001774;0.8716481624331396;2.036212167869579e-05;5.496371642023695e-06;0.004286341331931357;62.92649387663977;;;
b92a1496974d5921579e7df8c7c969ea;GLO;SSP5-Base-2040;b92a1496974d5921579e7df8c7c969ea;market for fluazifop-butyl;fluazifop-butyl;kilogram;3.1171671107914163;0.011259791729172082;0.011730870346919236;8.908718371177449e-08;2.6819842633903517e-08;1.39199826005763e-05;1.100685888156965;;;
c51186a2547c55ba1ce703c75cd4dc61;GLO;SSP5-Base-2040;c51186a2547c55ba1ce703c75cd4dc61;market for amine oxide;amine oxide;kilogram;3.445384563747453;0.002985297240551549;0.007196468554027234;2.6485454105586264e-08;5.9149796697475766e-08;1.18042912094052e-05;0.4457995641380922;;;
ddb83d9b3333ce3cd85f35228f4bd175;GLO;SSP5-Base-2040;ddb83d9b3333ce3cd85f35228f4bd175;market for malusil;malusil;kilogram;0.02759457751839072;2.745313995575739e-05;5.9797537876797555e-05;6.24588142731121e-10;1.7156937563771227e-10;8.614182655510764e-08;0.012022435291139343;;;
f92aa9782c1c6f2cf9e7e55a27d85c4d;GLO;SSP5-Base-2040;f92aa9782c1c6f2cf9e7e55a27d85c4d;market for furnace, wood chips, hardwood storage area, 300kW;furnace, wood chips, hardwood storage area, 300kW;unit;515615.1678685034;77.86317454026756;36.36437838819757;0.00010738676311605439;0.00011488599452489563;0.06969085622400921;1734.4742467631386;;;
f85abba69e8f922cdb3fa44a849c9b91;GLO;SSP5-Base-2040;f85abba69e8f922cdb3fa44a849c9b91;market for trinexapac-ethyl;trinexapac-ethyl;kilogram;9.302237583389692;0.048221650942183156;1.9719049505010375;1.7557472631394696e-07;7.587657649886822e-08;3.350689358429665e-05;2.0450228557069234;;;
163fde5588ccb1184ec8baf92f48f22a;RoW;SSP5-Base-2040;163fde5588ccb1184ec8baf92f48f22a;market for biomethane, high pressure, vehicle grade;biomethane, high pressure, vehicle grade;kilogram;0.1913966367391271;0.00029432362034043265;0.0009475492794213257;9.508693650109588e-09;7.131734675466127e-09;2.507323521834771e-06;0.04211087687725884;;;
e2642bb27042fa5282ef4bac6351c359;RoW;SSP5-Base-2040;e2642bb27042fa5282ef4bac6351c359;market for zinc monosulfate;zinc monosulfate;kilogram;0.8552303056180611;0.0012766782379875939;0.0042468681968409056;9.497461644947183e-09;1.1932604647879055e-08;1.2547819014437428e-05;0.08876736025664983;;;
38bfa307891b46a64abd11ce053566f4;GLO;SSP5-Base-2040;38bfa307891b46a64abd11ce053566f4;market for dioctyl terephthalate;dioctyl terephthalate;kilogram;1.3345819545270174;0.00948340792689997;0.009513349145296056;4.302587386566082e-08;1.4879727650186966e-08;7.127195725880106e-06;0.7271864250504009;;;
843d0949e9fdb184861a788655f8ca0e;GLO;SSP5-Base-2040;843d0949e9fdb184861a788655f8ca0e;market for coal tar;coal tar;kilogram;0.1302682263378364;0.0003660712397572573;0.00035186028042085164;2.445106793107325e-09;4.883521230529467e-09;3.7295154785145425e-06;0.07356914336345026;;;
8f8323591fbb401627822048a6077a5e;GLO;SSP5-Base-2040;8f8323591fbb401627822048a6077a5e;market for sodium phenolate;sodium phenolate;kilogram;1.5399529741001161;0.004656440580555045;0.009649204480726883;3.201448872389992e-08;1.462533901873482e-08;6.990939516855358e-06;0.6883023632334745;;;
00922060c0e14e463fea9bb044902df4;GLO;SSP5-Base-2040;00922060c0e14e463fea9bb044902df4;market for resistor, wirewound, through-hole mounting;resistor, wirewound, through-hole mounting;kilogram;5.888746368569245;0.11511491831684999;0.017840411456323795;5.283470451758457e-07;1.0498600138590502e-07;6.236805194882934e-05;1.2585574959712638;;;
a32922582fc738f089a0be8b36b6cf54;GLO;SSP5-Base-2040;a32922582fc738f089a0be8b36b6cf54;market for pyrethroid-compound;pyrethroid-compound;kilogram;5.342225597930578;0.028674347805566176;0.024602802168193473;1.2551516907668615e-07;6.609200511246707e-08;3.163277147326007e-05;1.8692597692140143;;;
688c7dd02c07b5293090d38ddc098b29;GLO;SSP5-Base-2040;688c7dd02c07b5293090d38ddc098b29;market for titania slag, 85% titanium dioxide;titania slag, 85% titanium dioxide;kilogram;0.2649066578633325;0.00026120317269306243;0.0005027282791137861;1.2620450095330215e-09;2.530860616248067e-09;1.1216899505308948e-06;0.11962902914234169;;;
3345ab0b61b4f9bebe73ca0b2d17f77d;GLO;SSP5-Base-2040;3345ab0b61b4f9bebe73ca0b2d17f77d;market for aircraft, dedicated freight, medium haul;aircraft, dedicated freight, medium haul;unit;1651698.1192363421;7469.63202666609;75141.85831350954;0.05360524466287439;0.03371964637469208;17.190884625477267;2819179.142508919;;;
8d2681c5aa28f9f3a2309534fc2ced70;GLO;SSP5-Base-2040;8d2681c5aa28f9f3a2309534fc2ced70;market for ferrochromium, high-carbon, 55% Cr;ferrochromium, high-carbon, 55% Cr;kilogram;0.9802859852436968;0.0008305860040925758;0.009578800139172566;2.234849224618433e-08;1.549742805146584e-08;1.2719820323797285e-05;0.1683163322603996;;;
dba873826e4de6475ee72a0fbd28c0e5;GLO;SSP5-Base-2040;dba873826e4de6475ee72a0fbd28c0e5;market for electrolyte, KOH, LiOH additive;electrolyte, KOH, LiOH additive;kilogram;5.458700546581205;0.018768485730569006;0.002320344260080718;4.584527425194782e-08;1.0249732988989227e-08;5.279675969859592e-06;0.8101611485006551;;;
e12a4ef05c574fbfe5bbebc37120c754;GLO;SSP5-Base-2040;e12a4ef05c574fbfe5bbebc37120c754;market for printed wiring board, through-hole mounted, unspecified, Pb free;printed wiring board, through-hole mounted, unspecified, Pb free;kilogram;22.12953254936284;0.5155726884388452;0.9487724017287347;1.1536872358799885e-06;3.3497447264636445e-07;0.0002659333244687987;4.3921968191775065;;;
5dc11bfa4bf1247f83847e5dae499c87;GLO;SSP5-Base-2040;5dc11bfa4bf1247f83847e5dae499c87;market for phenyl acetic acid;phenyl acetic acid;kilogram;2.1434157442052935;0.008948831000398796;0.012271788474858727;4.9544442936621894e-08;2.069858082204312e-08;9.458987436661632e-06;0.815706470817553;;;
2d61fad5617b6a30bdf52dfaeb219a43;GLO;SSP5-Base-2040;2d61fad5617b6a30bdf52dfaeb219a43;market for hydraulic fracturing fluid;hydraulic fracturing fluid;cubic meter;18.310634107584505;0.024412333800331705;0.041154726275461906;1.0340067064679316e-07;1.0679539399830175e-07;4.442620077647495e-05;2.2965989856424187;;;
68100fb44f8ad49379f1607967f495e0;GLO;SSP5-Base-2040;68100fb44f8ad49379f1607967f495e0;market for banana;banana;kilogram;1.0687705478604972;0.0003565832824337453;0.000590582070628741;1.158234839895173e-09;3.792571152967083e-09;1.1333748530435984e-06;0.020609358430212277;"[{'description': 'fraction, time to transfer the reefer between different modes of transport', 'id': '68f592ea-ec5e-40c3-8c86-c952c0763fc4', 'unit': 'dimensionless', 'comment': 'Estimated value.', 'amount': 0.2, 'uncertainty type': 0, 'loc': 0.2, 'name': 'fraction_time_reefer_transfer'}, {'description': 'losses', 'id': '67d91564-dd27-4166-9796-689b78ff86ff', 'unit': 'dimensionless', 'comment': 'Calculated value based on literature.\n\nFAO suggest, that 1/3 of food produced for human consumption is lost or waste globally, which amounts in 1.3 billion tons per year (FAO, 2011, Global food losses and food waste).\n\nThe food losses vary heavily depending on the type of food and geographic location. The food losses/waste occurs in five basic stages of the lifecycle of the product;\n\n1) Agricultural production\n2) Post-harvest handling and storage\n3) Processing\n4) Distribution\n5) Consumption\n\nThe losses during the forth stage - the distribution - are recorded in the market.\n\nLiterature suggest (FAO, 2011, Global food losses and food waste), that the losses of fruits and vegetable distribution are approximately 12%. This value is rather rough estimate and it is assumed, that in the future this value will be replaced by more precise, product specific data.', 'amount': 0.12, 'uncertainty type': 0, 'loc': 0.12, 'name': 'losses'}, {'description': 'speed, average, aircraft, freight', 'id': 'e831114b-6445-4cbd-a1d6-9e6c4366fb5c', 'unit': 'km/hour', 'comment': 'Expert judgement.\n\nAverage velocity including stops.', 'amount': 700.0, 'uncertainty type': 0, 'loc': 700.0, 'name': 'speed_aircraft'}, {'description': 'speed, average, barge, freight', 'id': '16a175c6-27fe-4453-aefb-4604ea30a75d', 'unit': 'km/hour', 'comment': 'Expert judgement. The barge is in general slower than transoceanic ship.\n\nAverage velocity including stops.\n\nCross reference;\n10 km/hour (Lopez-Ruiz, H.G., 2007, Sustainable freight transport: A transport time and logistical organization approach, University of Lyon)\n\n26 km/hour (Rodrigue, J-P., Notteboom, T., Slack, B., 2013, Transport Systems, Chapter 3, Maritime Transport, http://people.hofstra.edu/geotrans/eng/ch3en/conc3en/ch3c4en.html, accessed 20150206)', 'amount': 20.0, 'uncertainty type': 0, 'loc': 20.0, 'name': 'speed_barge'}, {'description': 'speed, average, lorry, freight', 'id': '3819b90e-0c78-4ad8-9cf9-58b415446628', 'unit': 'km/hour', 'comment': 'Expert judgement.\n\nAverage velocity including stops.\n\nReference;\n45 km/hour is the default speed of lorries and trucks used to calculate delivery distances  (www.searates.com, accessed 20141201).', 'amount': 45.0, 'uncertainty type': 0, 'loc': 45.0, 'name': 'speed_lorry'}, {'description': 'speed, average, train, freight', 'id': '00c99a4c-33c7-4d15-b668-edcf67a9485c', 'unit': 'km/hour', 'comment': 'Expert judgement.\n\nAverage velocity including stops.\n\nCross reference;\n40 km/hour (Lopez-Ruiz, H.G., 2007, Sustainable freight transport: A transport time and logistical organization approach, University of Lyon)\n\n33.2 km/hour was the average speed of freight train in China in 2007 (http://www.statista.com/statistics/278404/speed-of-freight-trains-in-china/, accessed 20150206)', 'amount': 40.0, 'uncertainty type': 0, 'loc': 40.0, 'name': 'speed_train'}, {'description': 'speed, average, transoceanic ship, freight', 'id': 'fb887cc6-8e4e-4243-96a4-f177655316ca', 'unit': 'km/hour', 'comment': 'Expert judgement.\n\nAverage velocity including stops.\n\nReference;\n26 km/hour (Rodrigue, J-P., Notteboom, T., Slack, B., 2013, Transport Systems, Chapter 3, Maritime Transport, http://people.hofstra.edu/geotrans/eng/ch3en/conc3en/ch3c4en.html, accessed 20150206)', 'amount': 26.0, 'uncertainty type': 0, 'loc': 26.0, 'name': 'speed_ship'}]";;
84f89e9f29acae674206e9b376bb545d;RoW;SSP5-Base-2040;84f89e9f29acae674206e9b376bb545d;market for paper, woodfree, coated;paper, woodfree, coated;kilogram;0.7462739036270907;0.0013769044392419895;0.0019095239052408703;9.512284837186e-09;1.9501456849326676e-08;4.389521711352347e-06;0.40656349933875574;;;
4e7eec9ccd3bdd8e89cadfb415d3379c;GLO;SSP5-Base-2040;4e7eec9ccd3bdd8e89cadfb415d3379c;market for activated carbon, granular;activated carbon, granular;kilogram;0.4930894087144041;0.0039454028637659075;0.001205863602759411;1.951659843048688e-08;1.4390234801077312e-08;7.056201498868858e-06;0.14219679809969427;;;
74a3370cdca748e28115aa91a34f81d9;GLO;SSP5-Base-2040;74a3370cdca748e28115aa91a34f81d9;market for amidosulfuron;amidosulfuron;kilogram;9.368022314090979;0.025410836466578234;2.6903944631420855;1.6403310102929378e-07;1.5244690577909938e-07;6.982188812550017e-05;1.1550840397274391;;;
debfcecea0a8a943a07ff240355e51c3;GLO;SSP5-Base-2040;debfcecea0a8a943a07ff240355e51c3;market for brass removed by turning, primarily dressing, conventional;brass removed by turning, primarily dressing, conventional;kilogram;14.390244610744833;0.2060909831480585;0.4613241875720563;1.3974985617861143e-07;1.6680007735822556e-07;0.0001679949835651726;0.7285769431152476;;;
e136e2ce2bbc1c5276cbfcbadb81f3f1;GLO;SSP5-Base-2040;e136e2ce2bbc1c5276cbfcbadb81f3f1;market for polystyrene foam slab;polystyrene foam slab;kilogram;0.849919962955382;0.00047728754241548467;0.04422336918603714;1.3866536260370985e-08;1.578779521154584e-08;6.724140573256303e-06;0.7411243495507052;;;
4db9af889571989d121d634e4862aa99;GLO;SSP5-Base-2040;4db9af889571989d121d634e4862aa99;market for cow milk;cow milk;kilogram;1.5161970120086155;0.001345793406689016;0.0013554486510490616;5.4012270634923285e-09;8.658413867680692e-08;3.543378059592661e-06;0.054160256111165074;;;
2ec10b1b64e70e51c42f3cadf61b7271;RoW;SSP5-Base-2040;2ec10b1b64e70e51c42f3cadf61b7271;market for sodium hypochlorite, without water, in 15% solution state;sodium hypochlorite, without water, in 15% solution state;kilogram;1.723992561253616;0.017267332020286116;0.0018471596869492984;5.2573155334445e-08;8.773843299321675e-09;4.506356461821297e-06;0.16663272432648107;;;
688e7b96b7e399ae066bc0e946f018a9;GLO;SSP5-Base-2040;688e7b96b7e399ae066bc0e946f018a9;market for light clay brick;light clay brick;kilogram;0.3179675805752101;0.00025221621513978683;0.0004956719417351066;6.45514379998187e-10;9.704341544589324e-10;3.920690708571202e-07;0.026141022032033803;;;
34b5bcea440e1a55ab677400ba3f4cea;RoW;SSP5-Base-2040;34b5bcea440e1a55ab677400ba3f4cea;market for liquefied petroleum gas;liquefied petroleum gas;kilogram;0.1525496819106876;0.0003532404492274553;0.005642974568902225;1.5623245805106601e-09;4.330614364539964e-09;1.9418001461087426e-06;0.5902867137177513;;;
20c34a745da0dfde20ce5120bcf7dd03;GLO;SSP5-Base-2040;20c34a745da0dfde20ce5120bcf7dd03;market for graphic paper, 100% recycled;graphic paper, 100% recycled;kilogram;0.42870337368134703;0.03439368692275242;0.0011312359011008692;1.8099874934832845e-08;6.2977686374583e-09;2.331470100724091e-06;0.06450743272927902;;;
f934da401a5cf896274df9ea05715b6b;RoW;SSP5-Base-2040;f934da401a5cf896274df9ea05715b6b;market for concrete, 30MPa;concrete, 30MPa;cubic meter;329.71140738907513;0.37969874300779016;0.3318267748928151;9.638150946983087e-07;1.1707154407459086e-06;0.0004954725618990266;14.086534284217526;;;
5d68a7fd42b989d214867478b999a04c;GLO;SSP5-Base-2040;5d68a7fd42b989d214867478b999a04c;market for borehole heat exchanger, 150m;borehole heat exchanger, 150m;unit;10483.177082758106;19.642360984623693;18.1836023925556;7.825539323081505e-06;1.3390171579925337e-05;0.006376360258386342;400.08954028888445;;;
71218481ac8315319b5a9ec48af6a5cc;GLO;SSP5-Base-2040;71218481ac8315319b5a9ec48af6a5cc;market for heat and power co-generation unit, 1MW electrical, components for heat only;heat and power co-generation unit, 1MW electrical, components for heat only;unit;31062.33487088493;421.0059960635314;75.81466498451394;0.0004786702828699774;0.0002166905404879366;0.20710883075076267;5046.358951276632;;;
63ea017e389a07a36765e03be75c2485;RoW;SSP5-Base-2040;63ea017e389a07a36765e03be75c2485;market for aniline;aniline;kilogram;1.7805792388994004;0.0024828714019351633;0.010018106863493496;2.0498775552779384e-08;2.1334243859856688e-08;1.1498270358741476e-05;0.6786266106767029;;;
a618878275594be40595ef331189707b;RoW;SSP5-Base-2040;a618878275594be40595ef331189707b;market for hard coal, run-of-mine;hard coal, run-of-mine;kilogram;0.04210817835564132;0.00012361520921110288;0.00026397257694934384;4.466658064163452e-10;1.3951658524187176e-09;7.380779583599391e-07;0.040906088261560704;;;
b6035e6be316772a9444f6b161da81b5;GLO;SSP5-Base-2040;b6035e6be316772a9444f6b161da81b5;market for ethephon;ethephon;kilogram;3.54467324184266;0.01146371266855285;0.01190396761879695;1.4054274659147045e-07;3.950255350548932e-08;1.5516019556597486e-05;0.9030151171741441;;;
